,sentence
0,"state and federal rules prohibited interstate branching or acquisitions and in some cases restricted even intrastate branching, reducing competition and the ability of lenders to diversify geographic risk.7 also, interest rate ceilings on mortgages in some locations effectively blocked lending to potential borrowers judged to pose higher risks, and interest rate ceilings on deposits (notably, the infamous regulation q) led to periodic episodes of disintermediation and reduced availability of mortgage credit (chomsisengphet and pennington-cross, 2006; and mcneil and rechter, 1980)."
1,a generally strong economy and lower interest rates also helped improved access to credit by lower-income households.
2,"a paper by board staff members compared census tracts just above and below the low- and moderate-income threshold, finding that the tracts below the threshold had higher homeownership rates, higher growth in owner-occupied units, and lower vacancy rates than would have otherwise been predicted (avery, calem, and canner, 2003)."
3,"at its most successful, the cra may have had a multiplier effect, supplementing its direct impact by stimulating new market-based, profit-driven economic activity in lower-income neighborhoods."
4,"in some cases, nonbank service providers offer convenience to customers but at prices that have raised concerns (carr and schuetz, 2001, and barr, 2004)."
