,sentence
0,"it is a distinct honor to appear before you today from this side of the podium, and i do hope my remarks will contribute to this proud tradition.1 in july, the current u.s. economic expansion will become the longest on record—or at least the record since the 1850s, which is as far back as the national bureau of economic research tracks u.s. business cycles.2 in anticipation of that milestone, i would like to take stock of where the u.s. economy is today, to assess its future trajectory, to review some important structural changes in the economy that have occurred over the past decade, and to explore what all of this might mean for u.s. monetary policy."
1,"the federal reserve has a specific mandate assigned to it in statute by the congress, which is the dual mandate of maximum employment and price stability."
2,"my colleagues and i understand that our responsibility is to conduct a monetary policy that not only is supportive of and consistent with achieving maximum employment and price stability, but also, once achieved, is appropriate, nimble, and consistent with sustaining maximum employment and price stability for as long as possible."
3,"and thus, the title of my talk today is ""sustaining maximum employment and price stability."""
4,"over the past four quarters, gross domestic product (gdp) growth has averaged 3.2 percent, which compares with an average growth rate of 2.3 percent since the recovery began in the summer of 2009."
5,"by most estimates, fiscal policy played an important role in boosting growth in 2018, and i expect that fiscal policies will continue to support growth in 2019."
6,"over the same four quarters, the unemployment rate has averaged 3.8 percent, and the most recent reading, at 3.6 percent, is near its lowest level in 50 years."
7,"wages have been rising broadly in line with productivity and prices and thus, at present, do not signal rising cost-push pressure."
8,"notwithstanding strong growth and low unemployment, u.s. inflation remains muted—currently, it is somewhat below our 2 percent longer-run objective for the personal consumption expenditures (pce) price deflator—and inflation expectations, according to a variety of measures, continue to be stable."
9,"as we look ahead, in our march summary of economic projections, the median projection of federal open market committee (fomc) participants was for gdp growth of around 2 percent as the modal, or most likely, outcome over the next three years, for pce inflation to rise to 2 percent, and for the unemployment rate to edge up to 3.9 percent by 2021."
10,"before i discuss the outlook for monetary policy, allow me to review some important structural changes that have taken place in the economy over the past decade that will be particularly relevant for our monetary policy decisions."
11,"structural changes in the u.s. economy: demand and supply perhaps the most significant structural change relevant to monetary policy is that the real, or inflation-adjusted, rate of interest consistent with full employment and price stability, often referred to as the neutral rate, or r*, appears to have fallen in the united states and abroad from more than 2 percent before the crisis to less than 1 percent today.3 the decline in neutral policy rates likely reflects several factors, including aging populations, higher private saving, a greater demand for safe assets, and a slowdown in global productivity growth."
12,"such a development, in turn, could make it more difficult during a future downturn for monetary policy to provide sufficient accommodation to rapidly return employment and inflation to mandate-consistent levels.4 another important potential change in the u.s. economy has been the steady decline in estimates of the structural rate of unemployment consistent with ""maximum"" employment, often referred to as u*."
13,"this decline in u* may be due in part to higher educational attainment and a larger proportion of older workers in the workforce today relative to the workforce of past decades.5 if u* is lower than historical estimates suggest, this would imply that, even with today's historically low unemployment rate, the labor market would not be as tight—and inflationary pressures would not be as strong—as one would expect, based on historical estimates of u*."
14,i also note that the decline in the unemployment rate in recent years has been accompanied by a pronounced increase in labor force participation for individuals in their prime working years.6 it has also been accompanied since 2014 by a rise in labor's share of national income.
15,"as i have documented previously, in the past several u.s. business cycles, labor's share has risen as those expansions proceeded because workers command higher wages in a stronger labor market; notably, in those cycles, the rise in labor's share did not pass through to faster price inflation.7 the previously mentioned increase in prime-age labor force participation has provided employers with a source of additional labor input and has been one factor restraining inflationary pressures."
16,"over the past few years, we have also seen evidence of a pickup in u.s. productivity growth, albeit from the very depressed average pace that prevailed throughout most of the expansion."
17,"indeed, as of the first quarter of this year, productivity in the nonfarm business sector rose 2.4 percent over the previous four quarters, its fastest pace since 2010 when the u.s. economy was coming out of the great recession."
18,"by contrast, in both the 2001–07 and 1982–90 economic expansions, productivity growth was actually slowing relative to its average pace during those expansions."
19,"that said, while identifying inflection points in trend productivity growth in real time is notoriously difficult, a pickup in trend productivity growth relative to the pace that prevailed earlier in the expansion is a possibility that we should not, i believe, dismiss.8 another structural change relevant for monetary policy is that price inflation appears less responsive to resource slack than it did in the past."
20,"that is, the short-run price phillips curve appears to have flattened, implying a change in the dynamic relationship between inflation and employment.9 a flatter phillips curve is, in a sense, a proverbial double-edged sword."
21,"it permits the federal reserve to support employment more aggressively during downturns—as was the case during and after the great recession—because a sustained inflation breakout is less likely when the phillips curve is flatter.10 however, a flatter phillips curve also increases the cost, in terms of economic output, of reversing unwelcome increases in longer-run inflation expectations."
22,"thus, a flatter phillips curve makes it all the more important that longer-run inflation expectations remain anchored at levels consistent with our 2 percent inflation objective.11 textbook macroeconomics teaches us that understanding the economy and getting monetary policy right requires that we do our best to understand if—and if so, how—the forces of aggregate demand and supply are evolving relative to historical experience and the predictions of our models."
23,"while predicting the future is difficult, with available data it appears that in 2018 and in the first quarter of 2019, the supply side of the economy—employment, participation, and productivity—expanded faster than most forecasters outside and inside the fed expected."
24,"notwithstanding robust growth in demand over these five quarters, pce price inflation fell somewhat short of the fed's 2 percent objective."
25,"with this background, let me now turn to the outlook for u.s. monetary policy."
26,"monetary policy as i mentioned earlier, my colleagues and i on the fomc understand that our priority today is to put in place policies that will help sustain maximum employment and price stability in an economy that appears to be operating close to both of our dual-mandate objectives."
27,i believe that the path for the federal funds rate should be data dependent in two distinct ways.13 monetary policy should be data dependent in the sense that incoming data reveal at any point in time where the economy is relative to the ultimate objectives of price stability and maximum employment.
28,this information on where the economy is relative to the goals of monetary policy is an important input into interest rate feedback rules.
29,"as a result, in the real world, monetary policy should be—and in the united states, i believe, is—data dependent in a second sense: policymakers should and do study incoming data and use models to extract signals that enable them to update and improve estimates of r* and u*."
30,"consistent with my earlier discussion, in the summary of economic projections, fomc participants have, over the past seven years, repeatedly revised down their estimates of both u* and r* as unemployment fell and real interest rates remained well below previous estimates of neutral without the rise in inflation those earlier estimates would have predicted."
31,"in addition to u* and r*, another important input into any monetary policy assessment is the state of inflation expectations."
32,"indeed, i believe price stability requires that not only actual inflation be centered at our 2 percent objective, but also that expected inflation be equal to our 2 percent inflation objective."
33,"unlike realized inflation, inflation expectations themselves are not directly observable; they must be inferred from econometric models, market prices, and surveys of households and firms."
34,"as i assess the totality of the evidence, i judge that, at present, indicators suggest that longer-term inflation expectations sit at the low end of a range that i consider consistent with our price-stability mandate."
35,"as i already noted, the u.s. economy is in a very good place, with the unemployment rate near a 50-year low, inflationary pressures muted, expected inflation stable, and gdp growth solid and projected to remain so."
36,"moreover, the federal funds rate is now in the range of estimates of its longer-run neutral level, and the unemployment rate is not far below many estimates of u*."
37,"most recently, the committee judged at our may meeting that the current stance of policy remains appropriate, and that decision reflects our view that some of the softness in recent inflation data will prove to be transitory."
38,"this judgment aligns with some private-sector forecasts, which now project pce inflation to return to 2 percent by 2020."
39,"however, if the incoming data were to show a persistent shortfall in inflation below our 2 percent objective or were it to indicate that global economic and financial developments present a material downside risk to our baseline outlook, then these are developments that the committee would take into account in assessing the appropriate stance for monetary policy."
40,"monetary policy implementation and balance sheet​ decisions since the beginning of the year, the fomc has made several important decisions about how it will implement monetary policy and how it will conclude the process of normalizing the size of its balance sheet."
41,"the fomc decided at its january meeting to continue to implement monetary policy in a regime with an ample supply of reserves—a regime often referred to as a floor system.14 such a system, which has been in place since late 2008, does not require the active management of reserves through daily open market operations."
42,"the fomc continues to view the target range for the federal funds rate as its primary means of adjusting and communicating the stance of monetary policy, although in doing so, we must and do take into account how our balance sheet size, composition, and trajectory impact broader financial conditions."
43,"and as we stated in january, although adjustments in the target range for the federal funds rate are our primary tool for adjusting the stance of monetary policy, we are prepared to adjust the details of the plans for balance sheet normalization based on economic and financial developments."
44,"when the process of normalizing the size of our balance sheet concludes in september, we expect that our reserves liabilities will, for a time, likely remain somewhat above the level necessary for an efficient and effective implementation of monetary policy."
45,"at the point that the committee judges that reserve balances have declined to the level consistent with the efficient and effective implementation of monetary policy, we plan to resume periodic open market operations to accommodate the normal trend growth in the demand for our liabilities.17 ​ as balance sheet normalization has progressed, the effective federal funds rate has firmed relative to the ioer rate."
46,"review of monetary policy strategy, tools, and communications before i conclude my prepared remarks, allow me to say a few words about our review of our monetary policy strategy, tools, and communication practices.18 while we believe that our existing approach to conducting monetary policy has served the public well, the purpose of this review is to evaluate and assess possible refinements that might help us best achieve our dual-mandate objectives on a sustained basis."
47,"with the u.s. economy operating at or close to our maximum-employment and price-stability goals, now is an especially opportune time to conduct this review."
48,"building on both the perspectives we hear and staff analysis, the fomc will conduct its own assessment of its monetary policy framework, beginning around the middle of the year."
