,sentence
0,"rather than grapple with the definition of the rather slippery concept of liquidity in my short remarks here, i will focus on aspects of global financial markets that many analysts associate with liquidity and that are particularly relevant for monetary policy--namely, the relatively low level of long-term interest rates in both real and nominal terms and the resulting relatively flat slope of yield curves around the world.1 i want to emphasize that, given the openness of capital markets, explanations of these phenomena should have an international component."
1,"i will argue that the flatness of the term structure reflects both the global balance of saving and investment, through its effect on real interest rates, and currency competition, through its effect on expected inflation and inflation risk."
2,we know that the short end of the yield curve is dominated by monetary policy and cyclical factors.
3,"to abstract from the potential effects of cyclical factors on the yield curve, consider the pattern of forward rates many years into the future, at which point the effects of current cyclical shocks would be expected to no longer be important.2 such forward rates reflect not only market expectations of future short-term interest rates but also term premiums to compensate for the risk associated with commitments to extend credit so far in the future, including the risk of future inflation."
4,"the resulting strength of demand has kept real long-term interest rates lower than they might otherwise have been in many countries, and particularly in the united states because it is a relatively attractive place to invest."
5,"i will emphasize three significant changes in most countries around the world that point to a reduction in the compensation required by investors for the possible effects of future inflation on the returns to holding long-term bonds: namely, declines in (1) actual inflation, (2) inflation volatility, and (3) expectations of long-term inflation, both survey based and ""market based."""
6,"what i have elsewhere referred to as ""currency competition"" may be a driving force behind these changes in inflation outcomes and expectations and may be reflected in low nominal long-term interest rates and the flattening of yield curves.5 i’d like to briefly review what i mean by currency competition."
7,"a confluence of four factors--deregulation, globalization, financial innovation, and the public’s increased understanding of the costs of inflation--has fostered a form of competition among currencies."
8,"that competition, in turn, has led to improved central bank performance and thereby contributed to the recent conquest of worldwide inflation."
9,"prompted in part by the collapse of central planning, many countries have turned increasingly to private markets and trade to deliver growth and progress."
10,"as a result, deregulation, globalization, and innovation have made it easier for citizens to move their wealth out of nominal assets in their local currency and thereby avoid any inflation tax should their government show signs that it might resort to inflationary tactics to finance spending.6 at the same time, the public’s understanding of the costs of inflation has increased, in part because of experiences of high inflation in many countries in the 1980s."
11,"almost everywhere, public opinion eventually turned against allowing inflation to continue."
12,this public pressure has reinforced the trend against inflationary policies.
13,"increased competition among currencies, driven by the confluence of factors that i just described, has improved central bank performance by changing the ability and the incentives of governments and central banks to pursue high-inflation policies."
14,"in effect, currency competition has raised the costs of poor policy and thus promoted central bank incentives to maintain low inflation."
15,this change has led many governments to be more willing to adopt institutional changes to improve central bank governance that have bolstered central bank credibility for maintaining low inflation.
16,"such changes have included greater central bank independence, which has typically been granted in conjunction with a mandate including the achievement of low and stable inflation as one of the goals of monetary policy."
17,"when citizens are more aware of the costs of inflation, and when governments are less able to reap benefits from high inflation, institutional reforms that make central banks more credible and independent are more likely to be adopted and sustained.7 let me make it clear that i think that currency competition has been a much larger force in emerging-market economies, in which the costs of poor policies have been demonstrated quite clearly, than in advanced economies."
18,the forces behind currency competition that have bolstered incentives for central banks to maintain low inflation and so have helped anchor inflation expectations are likely to persist and perhaps strengthen.
