,sentence
0,"welcome to the room where members of the board of governors and the presidents of the 12 reserve banks meet eight times a year—most recently, two weeks ago—to decide the stance of monetary policy."
1,"the reserve banks and the board have been holding fed listens events around the country as part of a comprehensive and public review of our monetary policy strategy, tools, and communications practices."
2,"we've invited you here because we want to better understand how monetary policy affects the lives of the people your organizations represent—union members, small business owners, residents of low- and moderate-income communities, retirees, and others."
3,we want to hear your perspective on maximum employment and price stability—the monetary policy goals congress has assigned us.
4,"unemployment is near a half-century low, and inflation is running close to, but a bit below, our 2 percent objective."
5,"while we believe our strategy and tools have been and remain effective, the u.s. economy, like other advanced economies around the world, is facing some longer-term challenges—from low growth, low inflation, and low interest rates."
6,"while slow growth is obviously not good, you may be asking, ""what's wrong with low inflation and low interest rates?"""
7,"low can be good, but when inflation—and, consequently, interest rates—are too low, the fed and other central banks have less room to cut rates to support the economy during downturns."
8,"so, in this review, we are examining strategies that might better allow us to symmetrically and sustainably achieve 2 percent inflation."
9,"doing so would help prevent inflation expectations among consumers, businesses, and investors from slipping too low, as they appear to have done in several advanced economies."
10,"more-firmly anchored expectations, in a virtuous circle, would help keep actual inflation around our target, thus preserving our ability to change interest rates as appropriate to meet our mandate."
11,we are also looking at whether our existing monetary policy tools will be adequate when the next downturn comes.
12,one clear takeaway of the sessions so far is the importance of sustaining our historically strong job market.
