,sentence
0,"surveys suggest that many americans believe being middle class means having a secure job and the ability to save.1 in recent decades, income growth for middle-income households has lagged behind that for high‑income households.2 in addition, economic resources differ markedly by race, education, occupation, geography, and other factors."
1,the first observation is to note the long-term decline in relative income growth and upward economic mobility for those in the middle.
2,"one factor in this decline is the increase in income inequality i just noted, and another is slower productivity growth."
3,"in the 1960s, well over 90 percent of working-age men held a job, and there was very little difference in employment between those with or without a college degree."
4,"research presented this morning will discuss some possible explanations for the divergence in employment, income, and other economic prospects between college grads and others."
