,sentence
0,"it is important here to distinguish between higher expected losses, for which bankers raise prices to cover risks, and higher unexpected losses, which require additional capital."
1,sometimes markets and customers demand a stronger credit rating at the bank than that implied by a minimum capital framework.
2,"obviously, these include credit, market, and operational risk, but also encompass certain other risk types--such as liquidity, interest rate, strategic, and legal risks."
3,"keeping pace with developments in risk management the rapid developments in finance, technology, and information systems have provided tremendous benefits to customers and raised the productivity of banking institutions."
4,"in fact, today we see different interpretations and assessment of risks in financial markets as counterparties assume different probabilities of default, estimates of loss, or forecasts of prices."
