,sentence
0,"the new fdic insurance, the 1933 statutory prohibition of interest payments on demand deposits, and the fed's regulation q upper limit on interest rates paid on savings deposits had together suppressed competition for deposits among banks and made retail deposits a highly stable source of relatively attractive financing."
1,"the squeeze came from both the liability side, in the form of more attractive savings vehicles such as money market funds, and from the asset side, with the growth of public capital markets and international competition."
2,"securitization and associated derivative instruments were merging capital markets and traditional lending activities, fueling the growth of what has become known as the shadow banking system."
3,"the regulatory system had also evolved, notably through progressively more detailed capital requirements and increasing demands that banking organizations enhance their own risk-management systems."
4,"with lenders increasingly unwilling to extend credit against these assets, liquidity-strained institutions made increasingly distressed asset sales, which placed additional downward pressure on asset prices, thereby accelerating margin calls for leveraged actors and amplifying mark-to-market losses for all holders of the assets."
5,too-big-to-fail perceptions weaken normal market disciplinary forces by producing a distorted set of incentives in which counterparties of a large institution may not price into their extensions of credit the full risks assumed by the institution.
6,"however, to the degree that firms cannot demonstrate their capacity to conduct rigorous internal capital assessments, supervisors will demand even higher capital cushions."
