,sentence
107,"to support continued progress toward maximum employment and price stability, the committee today reaffirmed its view that a highly accommodative stance of monetary policy will remain appropriate for a considerable time after the asset purchase program ends and the economic recovery strengthens."
108,"in particular, the committee decided to keep the target range for the federal funds rate at 0 to 1/4 percent and currently anticipates that this exceptionally low range for the federal funds rate will be appropriate at least as long as the unemployment rate remains above 6-1/2 percent, inflation between one and two years ahead is projected to be no more than a half percentage point above the committee's 2 percent longer-run goal, and longer-term inflation expectations continue to be well anchored."
109,"in determining how long to maintain a highly accommodative stance of monetary policy, the committee will also consider other information, including additional measures of labor market conditions, indicators of inflation pressures and inflation expectations, and readings on financial developments."
110,"when the committee decides to begin to remove policy accommodation, it will take a balanced approach consistent with its longer-run goals of maximum employment and inflation of 2 percent. """
111,"accordingly, not only would a reduction be appropriate in light of the ongoing improvement in labor market conditions, but it also would support the credibility and predictability of monetary policy because it would be seen as following through on the committee's earlier communications about the outlook for the asset purchase program."
