,sentence
0,"in support of the committee's longer-run planning for improvements in the implementation of monetary policy, the staff presented an update on the potential for establishing a fixed-rate, full-allotment overnight reverse repurchase agreement (rrp) facility."
1,"the presentation summarized initial discussions with financial market firms about how such a facility might affect money market interest rates and intermediation flows, what the relationship might be between the facility rate and other money market rates, and how the different types of firms might view the facility."
2,"overall, the inquiries suggested that the facility could be an effective additional tool for managing money market interest rates and helping to support a floor on those rates."
3,staff review of the economic situation the information reviewed for the september 17-18 meeting suggested that economic activity continued to increase at a moderate rate.
4,"private-sector employment rose further in july and august, but the unemployment rate was still elevated."
5,"total consumer price inflation picked up in recent months but continued to be modest, and measures of longer-run inflation expectations remained stable."
6,"private nonfarm employment continued to expand in july and august, but at a somewhat slower pace than in the first half of the year, while total government employment edged down on balance."
7,the unemployment rate declined further to 7.
8,"the labor force participation rate also decreased, leaving the employment-to-population ratio essentially unchanged in recent months."
9,"measures of firms' hiring plans moved up, initial claims for unemployment insurance declined, and the share of workers employed part time for economic reasons decreased a little."
10,"however, household expectations of the labor market situation deteriorated somewhat, rates of job openings and gross private-sector hiring were little changed, on net, and the rate of long-duration unemployment rose slightly."
11,"recent information on key factors that influence consumer spending were mixed: households' net worth likely expanded further as home prices posted additional gains through july, but real disposable incomes increased only a little in july and consumer sentiment in the thomson reuters/university of michigan surveys of consumers moved lower in august and early september."
12,growth in real private expenditures for business equipment and intellectual property products appeared to be subdued going into the third quarter.
13,"reductions in real federal government purchases appeared to persist: defense spending continued to decrease in july and august, while federal employment edged down further."
14,the u. s. international trade deficit narrowed substantially in june before widening in july to a level near its second-quarter average.
15,"total u. s. inflation, as measured by the pce price index through july and by the consumer price index through august, was about 1-1/2 percent over the preceding 12-month period for each series."
16,"consumer food prices only edged up in july and august, while energy prices were little changed, on net, over those two months, and retail gasoline prices moved down in the first half of september."
17,"core consumer price inflation, which excludes food and energy, was modest in july and august."
18,both near-term and longer-term inflation expectations from the michigan survey were little changed in august and early september.
19,"both compensation per hour and unit labor costs in the nonfarm business sector rose modestly over the year ending in the second quarter, as there were only slight gains in productivity."
20,"average foreign economic growth remained muted in the first half of the year, although there were some notable divergences across countries."
21,"growth in real gross domestic product (gdp) picked up in the second quarter in the united kingdom and remained strong in japan, recent data suggested that the euro-area economy was coming out of recession, and economic indicators were positive for china and several other emerging market economies (emes) in asia."
22,foreign inflation was generally subdued.
23,"monetary policy remained highly accommodative in the advanced economies, but some eme central banks moved toward tighter monetary policy in the face of capital outflows and depreciation pressures."
24,"staff review of the financial situation longer-term interest rates rose over the intermeeting period, while equity prices were fairly volatile but ended the period modestly higher."
25,the move in interest rates appeared to be importantly influenced by shifting expectations about monetary policy.
26,"the path of the federal funds rate implied by financial market quotes steepened notably during the period, in part reflecting some increase in uncertainty about the outlook for monetary policy as indicated by option-implied measures of uncertainty about the future path of the policy rate."
27,"yields on corporate bonds, agency mbs, and treasury inflation-protected securities rose about in line with those on nominal treasury securities."
28,stock prices for financial-sector firms underperformed the broad equity market somewhat over the intermeeting period.
29,credit flows to nonfinancial businesses remained solid in the face of higher longer-term interest rates.
30,"nonetheless, applications for new mortgages declined only modestly, apparently supported by improvements in labor market conditions and some pent-up demand."
31,"the pace of home price appreciation moderated a bit in july, although it was still strong."
32,bank credit declined in july and august amid the general rise in longer-term interest rates.
33,"while banks' holdings of assets with longer duration, such as residential mortgages, decreased, growth in c&i, cre, and automobile loans--which are more likely to have floating interest rates or relatively short maturities, and therefore less duration risk--tended to hold up in recent months."
34,"against a backdrop of higher interest rates in the advanced economies and slowing economic growth in the emes, several eme currencies came under downward pressure in august; yields and cds premiums on eme sovereign debt increased, particularly for those economies experiencing sharp currency depreciations; and investors continued to decrease their holdings in eme mutual funds."
35,"in response, some eme authorities took actions to support their currencies, including tightening monetary policy, modifying capital controls, and purchasing their currencies in foreign exchange markets."
36,"equity prices in germany increased substantially and sovereign yields in the united kingdom and germany continued to rise as data on economic activity in europe generally improved over the period, while yield spreads of spanish and italian sovereign securities relative to german government debt declined a bit further."
37,"the increase in yields appeared to reduce investors' appetite for taking duration risk, but if a significant volume of bond investors moved to sell at a future time, issues surrounding dealer capacity and willingness to make markets in volatile conditions could again amplify price movements."
38,"staff economic outlook in the economic forecast prepared by the staff for the september fomc meeting, the projection for real gdp growth in the second half of this year was revised down a little from the one prepared for the previous meeting."
39,"the staff's forecast for real gdp over the medium term also was revised down somewhat, reflecting higher projected paths for both longer-term interest rates and the foreign exchange value of the dollar, along with slightly lower projected paths for equity and home prices."
40,"the staff still anticipated that the pace of expansion in real gdp this year would only moderately exceed the growth rate of potential output but continued to forecast that real gdp would accelerate in 2014 and 2015, supported by an eventual easing in the effects of fiscal policy restraint on economic growth, increases in consumer and business sentiment, further improvements in credit availability and financial conditions, and accommodative monetary policy."
41,"in 2016, real gdp growth was projected to begin to edge down toward the growth rate of potential output."
42,"over the projection period, the expansion in economic activity was anticipated to slowly reduce the slack in labor and product markets, and the unemployment rate was expected to decline gradually."
43,the staff's forecast for inflation was little changed from the projection prepared for the previous fomc meeting.
44,"in the near term, the staff continued to project that inflation would be modest in the second half of this year but higher than the readings posted in the first half."
45,"over the medium term, with longer-run inflation expectations assumed to remain stable, changes in commodity and import prices expected to be modest, and resource slack persisting over most of the projection period, inflation was forecast to be subdued through 2016."
46,the staff viewed the uncertainty around the forecast for economic activity as similar to its normal level over the past 20 years.
47,"the staff did not see the uncertainty around its outlook for inflation as unusually high, and the risks were viewed as balanced."
48,"participants' views on current conditions and the economic outlook in conjunction with this fomc meeting, meeting participants--5 members of the board of governors and the presidents of the 12 federal reserve banks, all of whom participated in the deliberations--submitted their assessments of real output growth, the unemployment rate, inflation, and the target federal funds rate for each year from 2013 through 2016 and over the longer run, under each participant's judgment of appropriate monetary policy."
49,"the longer-run projections represent each participant's assessment of the rate to which each variable would be expected to converge, over time, under appropriate monetary policy and in the absence of further shocks to the economy."
50,"in their discussion of the economic situation and outlook, meeting participants regarded the information received during the intermeeting period as indicating that economic activity had continued to expand at a moderate pace, albeit somewhat more slowly than earlier anticipated, and they generally indicated that the broad contours of the outlook further out had not changed materially since their july meeting."
51,"participants continued to project the rate of growth of economic activity to strengthen over coming years, supported by highly accommodative monetary policy and the gradual abatement of the headwinds that have been slowing the pace of economic recovery, such as household-sector deleveraging, tight credit conditions for some households and businesses, and fiscal restraint."
52,"accordingly, the unemployment rate was projected to continue to decline over time toward levels judged to be consistent with the committee's dual mandate."
53,"while downside risks to the outlook for the economy and the labor market were generally viewed as having diminished, on balance, since last fall, a number of significant risks remained, including those related to the potential economic effects of the sizable increases in interest rates since the spring, ongoing fiscal drag, and the possible fallout from near-term fiscal debates."
54,"inflation continued to run below the committee's longer-run objective, apart from fluctuations that largely reflected changes in energy prices, and participants generally saw it as moving back gradually to 2 percent in the medium term."
55,"auto sales, however, remained strong, supported in part by steady interest rates on auto loans, which, unlike mortgage rates, did not rise substantially in recent months."
56,"while the housing sector continued to strengthen, supported by improving fundamentals and gains in house prices, the increases in mortgage rates since the spring were seen as a potential risk."
57,"nonetheless, uncertainties regarding the outlook for the economy and fiscal and regulatory policies were reportedly continuing to weigh on business decisionmaking, with firms focused on improving their balance sheets and enhancing productivity and still quite cautious about expanding their workforces."
58,"some business contacts indicated that wage and price pressures were subdued; however, in one district, contacts pointed to rising wage pressures and labor shortages."
59,"participants discussed the extent to which the ongoing tightening in fiscal policy was likely to further restrain economic activity in the second half of this year, with one participant noting that the effects of the federal sequestration appeared to be less pronounced than previously anticipated."
60,"in discussing labor market developments, a number of participants indicated that gains in payrolls in the july and august employment reports were disappointing, but one participant also noted that seasonal adjustment tended to be challenging during the summer months."
61,participants discussed how to reconcile the notable decline in the unemployment rate over the past year with the only moderate pace of expansion in real gdp.
62,"one possible explanation was that, to the extent the decline in the unemployment rate was primarily driven by a fall in the labor force participation rate and low productivity growth, such a decline might overstate the degree of improvement in broader labor market conditions."
63,"indeed, the continued low readings on the employment-to-population ratio were supportive of this explanation, suggesting that overall labor market conditions had not improved as much as the unemployment rate would indicate."
64,"an alternative explanation for the significant improvement in the labor market performance despite the moderate growth in real gdp over the past year was that growth had been understated somewhat; notably, some research suggested that real gross domestic income, which expanded at a somewhat faster pace than real gdp, may provide better information about overall economic activity."
65,"despite recent declines in the unemployment rate, one participant noted the risk that the longer the duration of elevated unemployment, the more likely it was that the labor market and economy would experience some lasting structural damage."
66,"despite the reversal of some transitory factors that had contributed to the earlier softness in inflation, recent readings continued to be below the committee's longer-run objective of 2 percent."
67,"however, participants generally expected inflation to pick up over the coming year as the pace of economic growth accelerated and slack in resource utilization diminished further, although to a rate still below the committee's longer-run objective."
68,"participants discussed financial market developments, including their views on the extent to which the rise in longer-term interest rates since may reflected growing confidence about the economic outlook or a perception by financial markets that monetary policy would be less accommodative going forward than had been previously anticipated."
69,"a few others observed that the increase in longer-term yields in recent months had not seemed to leave a meaningful imprint on other asset prices, suggesting that the effects on the economy were likely to be relatively muted."
70,"while recognizing the potentially significant impact of higher mortgage rates on the housing market, these same participants pointed to higher equity prices, the further gradual loosening of terms in bank lending, and the continued availability of credit at inexpensive terms in corporate debt markets as signs that financial conditions more generally had not tightened materially."
71,"in any case, however, the assessment of the adverse effects of the increase in longer-term rates on financial conditions and ultimately on economic activity would depend importantly upon the extent to which rates stabilized at current levels or instead continued to rise."
72,"participants also touched on the implications for financial stability resulting from the increase in interest rates, focusing on the effects on securities held by banking and other nonbank institutions, the unwinding of leveraged trades, and the liquidity and functioning of a number of fixed-income markets."
73,"one participant noted that, notwithstanding the recent rise in interest rates, net interest margins remained under pressure at community and regional banks, and as a result many of these banks continued to add to risk exposures."
74,"more broadly, a couple of participants noted the complexities related to the interaction between the stance of monetary policy and the vulnerabilities in the financial system."
75,"in their discussion of the path for monetary policy, participants debated the advantages and disadvantages of reducing the pace of the committee's asset purchases at this meeting, focusing importantly on whether the conditions presented to the public in june for reducing the pace of asset purchases had yet been met."
76,many of these participants had revised down their forecasts for economic activity or pointed to near-term risks and uncertainties.
77,"in particular, concerns were expressed that a delay could potentially undermine the credibility or predictability of monetary policy by, for example, increasing uncertainty about the committee's reaction function and about its commitment to the forward guidance for the federal funds rate, with the result of an increase in volatility in financial markets."
78,"in addition, in an effort to reduce uncertainty about how the committee might adjust its purchases in response to economic developments and to alleviate some of the related communications issues, one participant suggested an approach that would mechanically link the reduction in asset purchases to numerical values for the unemployment rate, with the goal of ending the program when the unemployment rate reached a stated level."
79,"in part toward this end, participants mentioned several possible steps that might be considered, including stating that the committee would not raise its target for the federal funds rate if the inflation rate was expected to run below a given level or providing additional information on the committee's intentions regarding the federal funds rate after the 6-1/2 percent unemployment threshold was reached."
80,"one participant stressed that the committee could use the full range of its tools, including forward guidance, to further improve the alignment of the medium-term outlook for employment and inflation with its longer-term goals."
81,"in discussing the projections for the target federal funds rate at the end of 2016 as reported in the sep, some participants highlighted the importance of communicating to the public the reasons why the policy rates that were projected by most, but not all, participants appeared to remain at low levels even as the unemployment rate and inflation by then were expected to be close to their longer-run values."
82,"in particular, if economic headwinds died away only slowly, as a number of participants expected, the achievement of the committee's employment and price stability objectives would likely require keeping the federal funds rate below its longer-run equilibrium value for some time even as economic conditions improved."
83,committee policy action committee members saw the information received over the intermeeting period as suggesting that economic activity was expanding at a moderate pace.
84,"some indicators of labor market conditions showed further improvement in recent months, but the unemployment rate remained elevated."
85,"household spending and business fixed investment advanced, and the housing sector was strengthening, but mortgage rates had risen further and fiscal policy was restraining growth."
86,"the committee expected that, with appropriate policy accommodation, economic growth would pick up from its recent pace, resulting in a gradual decline in the unemployment rate toward levels consistent with the committee's dual mandate."
87,"apart from fluctuations due to changes in energy prices, inflation was running below the committee's longer-run objective, but longer-term inflation expectations were stable, and the committee anticipated that inflation would move back toward its objective over the medium term."
88,"members recognized, however, that inflation persistently below the committee's 2 percent objective could pose risks to economic performance."
89,"in their discussion of monetary policy for the period ahead, members reviewed the degree of improvement in economic activity and labor market conditions since the asset purchase program began a year ago and judged that, taking into account the extent of federal fiscal retrenchment, the improvement was consistent with growing underlying strength in the broader economy."
90,"in light of the mixed data recently, including inflation readings that remained below the committee's longer-run objective, and the concerns over near-term fiscal uncertainties, some members indicated that they preferred to await more evidence that their expectation of continuing improvement would be realized."
91,"in addition, the committee reaffirmed its intention to keep the target federal funds rate at 0 to 1/4 percent and retained its forward guidance that it anticipates that this exceptionally low range for the federal funds rate will be appropriate at least as long as the unemployment rate remains above 6-1/2 percent, inflation between one and two years ahead is projected to be no more than a half percentage point above the committee's 2 percent longer-run goal, and longer-term inflation expectations continue to be well anchored."
92,"it also acknowledged the improvement in economic activity and labor market conditions since its asset purchase program began, while emphasizing that it was prepared to be patient and await more evidence that progress would be sustained before adjusting downward the pace of purchases."
93,"the committee also adopted language to the effect that, in judging when to moderate the pace of asset purchases at its coming meetings, it would assess whether incoming information continued to support its expectation of ongoing improvement in labor market conditions and of inflation moving back toward its longer-run objective."
94,"at the conclusion of the discussion, the committee voted to authorize and direct the federal reserve bank of new york, until it was instructed otherwise, to execute transactions in the system account in accordance with the following domestic policy directive: ""consistent with its statutory mandate, the federal open market committee seeks monetary and financial conditions that will foster maximum employment and price stability."
95,"the system open market account manager and the secretary will keep the committee informed of ongoing developments regarding the system's balance sheet that could affect the attainment over time of the committee's objectives of maximum employment and price stability. """
96,"the vote encompassed approval of the statement below to be released at 2:00 p. m. : ""information received since the federal open market committee met in july suggests that economic activity has been expanding at a moderate pace."
97,"some indicators of labor market conditions have shown further improvement in recent months, but the unemployment rate remains elevated."
98,"household spending and business fixed investment advanced, and the housing sector has been strengthening, but mortgage rates have risen further and fiscal policy is restraining economic growth."
99,"apart from fluctuations due to changes in energy prices, inflation has been running below the committee's longer-run objective, but longer-term inflation expectations have remained stable."
100,"consistent with its statutory mandate, the committee seeks to foster maximum employment and price stability."
101,"the committee expects that, with appropriate policy accommodation, economic growth will pick up from its recent pace and the unemployment rate will gradually decline toward levels the committee judges consistent with its dual mandate."
102,"the committee recognizes that inflation persistently below its 2 percent objective could pose risks to economic performance, but it anticipates that inflation will move back toward its objective over the medium term."
103,"taking into account the extent of federal fiscal retrenchment, the committee sees the improvement in economic activity and labor market conditions since it began its asset purchase program a year ago as consistent with growing underlying strength in the broader economy."
104,"taken together, these actions should maintain downward pressure on longer-term interest rates, support mortgage markets, and help to make broader financial conditions more accommodative, which in turn should promote a stronger economic recovery and help to ensure that inflation, over time, is at the rate most consistent with the committee's dual mandate."
105,"the committee will closely monitor incoming information on economic and financial developments in coming months and will continue its purchases of treasury and agency mortgage-backed securities, and employ its other policy tools as appropriate, until the outlook for the labor market has improved substantially in a context of price stability."
106,"in judging when to moderate the pace of asset purchases, the committee will, at its coming meetings, assess whether incoming information continues to support the committee's expectation of ongoing improvement in labor market conditions and inflation moving back toward its longer-run objective."
