,sentence
0,"Well known for this integrity, tenacity, and professional dedication, Bill demanded the best from himself and from those around him."
1,"These developments reflect the increased efficiency of financial markets worldwide, which have helped to bring about expanded international trade and economic growth."
2,"Through leverage, in the form principally of taking deposits, banks perform a critical role in the financial intermediation process, providing savers with additional investment choices and borrowers with a greater range of sources of credit, thereby facilitating a more efficient allocation of resources and contributing importantly to greater economic growth."
3,"If banks had to absorb all financial risk, then the degree to which they could leverage, of necessity, would be limited, and their contribution to economic growth, modest."
4,And central banks would risk inflationary instabilities from excess money creation if they acted too readily and too often to head off possible market turmoil.
5,"Within the United States, the growing volume and complexity of transactions, particularly at the largest institutions, is requiring such productivity enhancements and other modifications to our supervisory procedures."
