,sentence
0,"In their discussion of the options and strategies surrounding the use of tools at liftoff and the potential subsequent reduction in aggregate ON RRP capacity, participants emphasized that during the early stages of policy normalization, it will be a priority to ensure appropriate control over the federal funds rate and other short-term interest rates."
1,"A majority of participants thought term reserve draining tools could be useful in reducing ON RRP usage, although a couple of participants questioned their effectiveness in placing upward pressure on market interest rates, and a few did not see term RRPs as reducing the Federal Reserve's presence in money markets, arguing that investors view term and overnight RRPs as close substitutes."
2,"However, a number of participants noted that it could be difficult to communicate the reason for such sales to the public, and, in particular, that the announcement of such sales would risk an outsized market reaction, as the public could view the sales as a signal of a tighter overall stance of monetary policy than they had anticipated or as an indication that the Committee might be more willing than had been thought to sell longer-term assets."
3,"However, a number of participants emphasized that maintaining control of short-term interest rates would be paramount in the initial stages of policy normalization, and that it was difficult to know in advance when a reduction would be appropriate."
4,"At the conclusion of their discussion, all participants agreed to augment the Committee's Policy Normalization Principles and Plans by providing the following additional details regarding the operational approach the FOMC intends to use when it becomes appropriate to begin normalizing the stance of monetary policy."
5,Staff Review of the Economic Situation The information reviewed for the March 17‒18 meeting suggested that real gross domestic product (GDP) growth moderated in the first quarter and that labor market conditions improved further.
6,Consumer price inflation was restrained significantly by declines in energy prices and continued to run below the FOMC's longer-run objective of 2 percent.
7,"Market-based measures of inflation compensation were still low, while survey measures of longer‑run inflation expectations remained stable."
8,Nonfarm payroll employment continued to expand strongly in January and February.
9,The unemployment rate declined to 5.
10,"Both the labor force participation rate and the employment-to- population ratio rose slightly over the first two months of the year, and the share of workers employed part time for economic reasons edged down."
11,"The purchasing power of households' income continued to be supported by low energy prices, and real disposable income rose briskly in January."
12,"Moreover, households' net worth likely increased as equity prices and home values advanced further, and consumer sentiment in the University of Michigan Surveys of Consumers was still near its highest level since prior to the most recent recession."
13,The U. S. international trade deficit widened substantially in December before narrowing somewhat in January.
14,"Exports declined in both December and January, reflecting weak agricultural goods exports, the lower price of petroleum products, and falling or flat exports of most other categories of goods."
15,"Imports rose in December, with an increased volume of petroleum imports, but declined in January, driven by lower prices and volumes for petroleum."
16,"Total U. S. consumer prices, as measured by the PCE price index, edged up only 1/4 percent over the 12 months ending in January, as energy prices declined significantly."
17,"The core PCE price index, which excludes food and energy prices, rose 1-1/4 percent over the same 12-month period."
18,"Measures of expected long-run inflation from a variety of surveys, including the Michigan survey, the Blue Chip Economic Indicators, the Survey of Professional Forecasters, and the Desk's Survey of Primary Dealers, remained stable."
19,Market-based measures of inflation compensation were still low.
20,"Measures of labor compensation continued to increase at a modest pace, although faster than consumer prices."
21,Both compensation per hour in the nonfarm business sector and the employment cost index rose 2-1/4 percent over the year ending in the fourth quarter.
22,"While GDP growth stepped down in several economies, including Canada and China, it picked up in the euro area, Japan, and Mexico."
23,"Consumer prices in many foreign economies declined further in the first months of this year, reflecting the falls in energy prices as well as decreases in food prices in some emerging market economies."
24,"Many central banks took steps to ease monetary policy during the period, including the European Central Bank (ECB), which began purchasing sovereign bonds under its public sector purchase program (PSPP), and the People's Bank of China, which lowered required reserve ratios for banks."
25,A number of other central banks in advanced and emerging market economies cut policy interest rates.
26,Staff Review of the Financial Situation Movements in asset prices over the intermeeting period largely seemed to reflect receding concerns about downside risks to the global economic outlook.
27,"Two strong U. S. employment reports and the January consumer price index release, all of which were above market expectations; the start of sovereign bond purchases by the ECB; and the somewhat more encouraging economic news from Europe all appeared to contribute to the improved sentiment in financial markets."
28,"Equity prices were higher, on net, although they declined later in the period."
29,"Market commentary also highlighted Chair Yellen's statement at the Monetary Policy Report testimony that the eventual removal of the language in the policy statement noting that ""the Committee judges that it can be patient in beginning to normalize the stance of monetary policy"" should not be viewed as indicating that the federal funds rate would necessarily be increased within a couple of meetings."
30,"However, the effects of these communications on the expected path for the federal funds rate were more than offset by reactions to stronger-than-expected data for the labor market and consumer inflation, along with perceptions of receding downside risks to the foreign economic outlook."
31,"Measures of inflation compensation based on Treasury Inflation-Protected Securities increased early in the intermeeting period amid rising oil prices but ended the period little changed, on net, after oil prices dropped back."
32,"Broad U. S. equity price indexes moved up, on balance, over the intermeeting period, and one-month option-implied volatility on the S&P 500 index moved down on net."
33,"In addition, demand for funding of CMBS by hedge funds and real estate investment trusts reportedly rose over the same period."
34,"The dollar appreciated against most other currencies over the intermeeting period, as policymakers in the euro area, Sweden, Denmark, and many emerging market economies eased monetary policy even as market participants anticipated monetary policy tightening in the United States."
35,"Equity prices rose in most of the advanced foreign economies, with euro-area stocks rallying both before and after the early March commencement of sovereign bond purchases by the ECB under its PSPP."
36,"Staff Economic Outlook In the U. S. economic forecast prepared by the staff for the March FOMC meeting, projected real GDP growth in the first half of this year was lower than in the forecast prepared for the January meeting, largely reflecting downward revisions to the near-term forecasts for household spending, net exports, and residential investment."
37,"The staff's medium-term forecast for real GDP growth also was revised down, mostly because of the effects of a higher projected path for the foreign exchange value of the dollar."
38,"Nonetheless, the staff continued to forecast that real GDP would expand at a faster pace than potential output in 2015 and 2016, supported by increases in consumer and business confidence and a small pickup in foreign economic growth, even as the normalization of monetary policy was assumed to begin."
39,"In 2017, real GDP growth was projected to slow toward, but to remain above, the rate of potential output growth."
40,The expansion in economic activity over the medium term was anticipated to gradually reduce resource slack; the unemployment rate was expected to decline slowly and to temporarily move a little below the staff's estimate of its longer-run natural rate.
41,"In its medium-term and longer-run projections, the staff slightly lowered its assumptions for potential GDP growth and real equilibrium interest rates."
42,"The staff's forecast for inflation in the near term was little changed, with the large declines in energy prices since last June still anticipated to lead to a temporary decrease in the 12-month change in total PCE prices in the first half of this year."
43,"The staff's forecast for inflation in 2016 and 2017 was unchanged, as energy prices and non-oil import prices were still expected to bottom out and begin rising later this year; inflation was projected to move closer to, but remain below, the Committee's longer-run objective of 2 percent over those years."
44,"Inflation was anticipated to move back to 2 percent thereafter, with inflation expectations in the longer run assumed to be consistent with the Committee's objective and slack in labor and product markets projected to have waned."
45,"The staff viewed the extent of uncertainty around its March projections for real GDP growth, the unemployment rate, and inflation as similar to the average over the past 20 years."
46,"The risks to the forecasts for real GDP growth and inflation were viewed as tilted a little to the downside, reflecting the staff's assessment that neither monetary policy nor fiscal policy was well positioned to help the economy withstand adverse shocks."
47,"At the same time, the staff viewed the risks around its outlook for the unemployment rate as roughly balanced."
48,"Participants' Views on Current Conditions and the Economic Outlook In conjunction with this FOMC meeting, members of the Board of Governors and participating Federal Reserve Bank presidents submitted their projections of the most likely outcomes for real GDP growth, the unemployment rate, inflation, and the federal funds rate for each year from 2015 through 2017 and over the longer run, conditional on each participant's judgment of appropriate monetary policy."
49,"4 The longer-run projections represent each participant's assessment of the rate to which each variable would be expected to converge, over time, under appropriate monetary policy and in the absence of further shocks to the economy."
50,"In their discussion of the economic situation and the outlook, meeting participants regarded the information received over the intermeeting period as indicating that the pace of economic activity had moderated somewhat."
51,"Labor market conditions continued to improve, with strong job gains and a lower unemployment rate, and participants judged that underutilization of labor resources was continuing to diminish."
52,A number of participants noted that slow growth of productivity or the labor force could reconcile the moderation in economic growth with the solid performance of some labor market indicators.
53,"Participants expected that, over the medium term, real economic activity would expand at a moderate pace and there would be additional improvements in labor market conditions."
54,"Participants generally regarded the net effect of declines in energy prices as likely to be positive for economic activity and employment in the United States, although a couple noted that physical limits on the accumulation of stocks of crude oil could result in further downward pressure on prices and reduce U. S. oil and gas production and investment."
55,"Inflation had declined further below the Committee's longer-run objective, largely reflecting declines in energy prices, and was expected to stay near its recent low level in the near term."
56,"Market-based measures of inflation compensation 5 to 10 years ahead remained low, while survey-based measures of longer-term inflation expectations had remained stable."
57,Participants generally anticipated that inflation would rise gradually toward the Committee's 2 percent objective as the labor market improved further and the transitory effects of energy price declines and other factors dissipated.
58,"While almost all participants noted potential risks to the economic outlook resulting from foreign economic and financial developments, most saw the risks to the outlook for economic growth and the labor market as nearly balanced."
59,"Some participants expressed the view that growth in consumer spending over the medium term would be supported by the strong labor market and rising income, increases in wealth and improvements in household balance sheets, lower gasoline prices, and gains in consumer confidence."
60,"However, there were widespread reports of a slowdown in growth during the first quarter across a range of industries, partly reflecting severe winter weather in some regions as well as labor disputes at West Coast ports that temporarily disrupted some supply chains."
61,"In several parts of the country, persistently low oil prices had resulted in declines in drilling and delays in planned capital expenditures in the energy sector, and had negatively affected state government revenues."
62,"In contrast, service-sector activity had been reasonably strong in several parts of the country, as had auto sales, and the increase in household purchasing power from lower gasoline prices was expected to boost retail sales."
63,"In their discussion of the foreign economic outlook, several participants noted that the dollar's further appreciation over the intermeeting period was likely to restrain U. S. net exports and economic growth for a time."
64,"A few participants suggested that accommodative policy actions by a number of foreign central banks could lead to a further appreciation of the dollar, but another noted that such actions had also strengthened the outlook for growth abroad, which would bolster U. S. exports."
65,"Participants pointed to a number of risks to the international economic outlook, including the slowdown in growth in China, fiscal and financial problems in Greece, and geopolitical tensions."
66,"Participants saw broad-based improvement in labor market conditions over the intermeeting period, including strong gains in payroll employment and a further reduction in the unemployment rate."
67,"Several participants judged, based on the improvement in a variety of labor market indicators, that the economy was making further progress toward the Committee's goal of maximum employment."
68,"Nonetheless, many judged that some degree of labor market slack remained, as evidenced by the low rate of labor force participation, still-elevated involuntary part-time employment, or subdued growth in wages."
69,A few of them noted that continued modest wage growth could prompt them to reduce their estimates of the longer-run normal rate of unemployment.
70,A few participants observed that the absence of a notable pickup in wages might not be a useful yardstick for evaluating the degree of remaining slack because of the long lags between declines in unemployment and the response of wages or uncertainty about trend productivity growth.
71,"One participant, however, saw some evidence of rising wage growth and suggested that compositional changes in the labor force could be masking underlying wage pressures, particularly as measured by average hourly earnings."
72,"Many participants judged that the inflation data received over the intermeeting period had been about in line with their expectations that inflation would move temporarily further below the Committee's goal, largely reflecting declines in energy prices and lower prices of non-oil imports."
73,They continued to expect that inflation would move up toward the Committee's 2 percent objective over the medium term as the effects of these transitory factors waned and conditions in the labor market improved further.
74,"Survey-based measures of inflation expectations had remained stable, and market-based measures of inflation compensation over the longer term were about unchanged from the time of the January meeting, although they had exhibited some volatility over the intermeeting period."
75,"It was noted that the market-based measures had tracked quite closely the movements in crude oil prices over the period, first rising and then falling back."
76,"Participants offered various explanations for this correlation, including that market-based measures of inflation compensation were responding to the same global developments as oil prices, that these measures were capturing changes in risk or liquidity premiums, or that inflation-indexed securities were subject to mispricing."
77,"A couple of participants pointed out that the movements in crude oil prices and market-based inflation compensation measures had not been particularly well aligned over a longer historical period, or that information gleaned from inflation derivatives suggested a substantial increase in the probability that inflation would remain well below the Committee's target over the next decade."
78,"One of them judged that the low level of inflation compensation could reflect increased concern on the part of investors about adverse outcomes in which low inflation was accompanied by weak economic activity, and that it was important not to dismiss this possible interpretation."
79,"In their discussion of communications regarding the path of the federal funds rate over the medium term, almost all participants favored removing from the forward guidance in the Committee's postmeeting statement the indication that the Committee would be patient in beginning to normalize the stance of monetary policy."
80,"It was noted that eliminating the reference to being patient would be appropriate in light of the considerable progress achieved toward the Committee's objective of maximum employment, and that such a change would not indicate that the Committee had decided on the timing of the initial increase in the target range for the federal funds rate."
81,"Participants generally judged that the appropriate timing of liftoff would depend on their assessment of improvement in the labor market and their degree of confidence that inflation would move back to the Committee's 2 percent objective over the medium term, and that it would be helpful to convey to the public this data-dependent approach to monetary policy."
82,"One participant did not favor the change to the forward guidance because, with inflation well below the Committee's 2 percent longer-run target, the announcement of a meeting-by-meeting approach to policy could lead to a tightening of financial conditions that would slow progress toward the Committee's objectives."
83,Participants expressed a range of views about how they would assess the outlook for inflation and when they might deem it appropriate to begin removing policy accommodation.
84,"It was noted that there were no simple criteria for such a judgment, and, in particular, that, in a context of progress toward maximum employment and reasonable confidence that inflation will move back to 2 percent over the medium term, the normalization process could be initiated prior to seeing increases in core price inflation or wage inflation."
85,"Further improvement in the labor market, a stabilization of energy prices, and a leveling out of the foreign exchange value of the dollar were all seen as helpful in establishing confidence that inflation would turn up."
86,"However, others anticipated that the effects of energy price declines and the dollar's appreciation would continue to weigh on inflation in the near term, suggesting that conditions likely would not be appropriate to begin raising rates until later in the year, and a couple of participants suggested that the economic outlook likely would not call for liftoff until 2016."
87,"Committee Policy Action In their discussion of monetary policy for the period ahead, members judged that information received since the FOMC met in January indicated that economic growth had moderated somewhat."
88,"Labor market conditions had improved further, with strong job gains and a lower unemployment rate; a variety of labor market indicators suggested that the underutilization of labor resources continued to diminish."
89,"Household spending was rising moderately, with declines in energy prices boosting household purchasing power."
90,"Business fixed investment was advancing, although the recovery in the housing sector remained slow and export growth had weakened."
91,"Inflation had declined further below the Committee's longer-run objective, largely reflecting the declines in energy prices."
92,Market-based measures of inflation compensation remained low; survey-based measures of longer-term inflation expectations had been stable.
93,"The Committee expected that, with appropriate monetary policy accommodation, economic activity would expand at a moderate pace and labor market indicators would continue to move toward levels the Committee judges consistent with its dual mandate."
94,The Committee also expected that inflation would remain near its recent low level in the near term but rise gradually toward 2 percent over the medium term as the labor market improves further and the transitory effects of energy price declines and other factors dissipate.
95,"In light of the uncertainties attending the outlook for inflation, the Committee agreed that it should continue to monitor inflation developments closely."
96,"In their discussion of language for the postmeeting statement, the Committee agreed that the data received over the intermeeting period suggested that economic growth had moderated somewhat."
97,"One factor behind that moderation was a slowdown in the growth of exports, and members decided that the statement should explicitly note that factor."
98,"In addition, data received over the intermeeting period indicated that inflation had declined, as the Committee had anticipated, and members agreed to update the statement to reflect their judgment that inflation was likely to remain near its recent low level in the near term."
99,Members also judged that it was appropriate to note that market-based measures of inflation compensation remained near levels registered at the time of the January FOMC meeting.
100,The Committee agreed to maintain the target range for the federal funds rate at 0 to 1/4 percent and to reaffirm in the statement that the Committee's decision about how long to maintain the current target range for the federal funds rate would depend on its assessment of actual and expected progress toward its objectives of maximum employment and 2 percent inflation.
101,"Members continued to judge that this assessment of progress would take into account a wide range of information, including measures of labor market conditions, indicators of inflation pressures and inflation expectations, and readings on financial and international developments."
102,"In light of the considerable progress to date toward the Committee's maximum-employment objective and the implications of that progress for the outlook for inflation, members agreed to remove from the forward guidance in the postmeeting statement the indication that the Committee judges that it can be patient in beginning to normalize the stance of monetary policy and to indicate instead that the Committee anticipates that it will be appropriate to raise the target range for the federal funds rate when it has seen further improvement in the labor market and is reasonably confident that inflation will move back to its 2 percent objective over the medium term."
103,"The Committee agreed to reiterate its expectation that, even after employment and inflation are near mandate-consistent levels, economic conditions may, for some time, warrant keeping the target federal funds rate below levels the Committee views as normal in the longer run."
104,"At the conclusion of the discussion, the Committee voted to authorize and direct the Federal Reserve Bank of New York, until it was instructed otherwise, to execute transactions in the SOMA in accordance with the following domestic policy directive: ""Consistent with its statutory mandate, the Federal Open Market Committee seeks monetary and financial conditions that will foster maximum employment and price stability."
105,"The System Open Market Account manager and the secretary will keep the Committee informed of ongoing developments regarding the System's balance sheet that could affect the attainment over time of the Committee's objectives of maximum employment and price stability. """
106,"The vote encompassed approval of the statement below to be released at 2:00 p. m. : ""Information received since the Federal Open Market Committee met in January suggests that economic growth has moderated somewhat."
107,"Labor market conditions have improved further, with strong job gains and a lower unemployment rate."
108,Household spending is rising moderately; declines in energy prices have boosted household purchasing power.
109,"Business fixed investment is advancing, while the recovery in the housing sector remains slow and export growth has weakened."
110,"Inflation has declined further below the Committee's longer-run objective, largely reflecting declines in energy prices."
111,Market-based measures of inflation compensation remain low; survey-based measures of longer-term inflation expectations have remained stable.
