,speaker,sentence
268,CHAIR POWELL,"You know, Facebook, I believe, has made quite broad rounds in—around the world really with regulators, supervisors, and lots of people to discuss their plans, and that certainly includes us."
269,CHAIR POWELL,"And we’re—you know, it’s something we’re looking at."
270,CHAIR POWELL,"We meet with a broad range of private-sector firms all the time on financial technology, and there’s just a tremendous amount of innovation going on out there."
271,CHAIR POWELL,"You know, there are potential benefits here."
272,CHAIR POWELL,"There are also potential risks, particularly of a currency that could, you know, that could potentially have large application."
273,CHAIR POWELL,"So I would echo what Governor Carney said, which is that we will wind up having quite high expectations, from a sort of safety and soundness and regulatory standpoint, if they do decide to go forward with something."
275,CHAIR POWELL,"You know, we have—we don’t have plenary authority over cryptocurrencies as such."
276,CHAIR POWELL,They play into our world through consumer protection and money laundering and things like that.
277,CHAIR POWELL,"But, I would say that, you know, through international forums, you know, we have significant input into the payment system and, as you know, play an important role in the payment system here in the United States."
288,CHAIR POWELL,We have—we’ve said that we wouldn’t look at raising the target rate for inflation.
289,CHAIR POWELL,We did say that.
290,CHAIR POWELL,"And the reason is, it’s become a global norm, 2 percent."
291,CHAIR POWELL,Our statutory mandate is price stability.
292,CHAIR POWELL,"And so we’re actually taking a less—we’re looking at less radical ideas, such as how to make the 2 percent inflation objective more credible."
293,CHAIR POWELL,"This gives me a chance to say a couple things about the review and Chicago, in particular."
294,CHAIR POWELL,So it’s a new thing for us.
295,CHAIR POWELL,It’s something that—I thought it was both appropriate and important for us to do.
296,CHAIR POWELL,"It’ll be a yearlong, or even longer, process, looking at our strategy, tools, and communications."
297,CHAIR POWELL,"And it’s meant to be a way to open ourselves up, to let the sunshine in, and have dialogue and criticism with the constituencies that we serve."
298,CHAIR POWELL,"We’ve had a series of Fed Listens around the country at every Reserve Bank, and we had an academic conference earlier this month, with seven papers written and criticized, and leading global experts."
299,CHAIR POWELL,"But I’ll just say, again, that the heart of the conference was the two panels on—with practitioners in low and moderate income—who live in low- and moderate-income communities and are part of those communities."
300,CHAIR POWELL,"And they were—there, I think, people were quite struck by their intervention, which was really uniformly around how important maximum employment is June 19, 2019 and what it means in their communities."
301,CHAIR POWELL,"You know, the idea being, they haven’t had, you know, Chair Powell’s Press Conference FINAL a bull market in these communities."
302,CHAIR POWELL,"They haven’t had, just, a booming economy."
303,CHAIR POWELL,"What they have had is low unemployment, lots of social problems."
304,CHAIR POWELL,"And just now, you have, you know, companies who want to hire and are bringing people into the—providing opportunities for people to come into the labor force to an extent not seen in quite a long time."
305,CHAIR POWELL,"And that is, I think, you know, for someone who does this work, that was very focusing and motivating, too."
306,CHAIR POWELL,"So I think everybody thought, you know, that’s—that was really quite worth doing."
307,CHAIR POWELL,"I mean, there was some thought at the beginning that we should—some people recommended that we just talk to, you know, econ Ph.D.’s about this, but, no, that’s not what we chose to do, and we’re glad this is the choice we made."
311,CHAIR POWELL,I don’t think it’s—I don’t think it’s a practical alternative.
312,CHAIR POWELL,And I’ll tell you why.
313,CHAIR POWELL,I think you see disinflationary pressures around the world.
314,CHAIR POWELL,You see central banks having a hard time getting inflation up to their—close to their objective.
315,CHAIR POWELL,"We’ve done better than other large central banks that are not, you know, open economies, like the U.K., where you have big currency moves that move inflation around."
316,CHAIR POWELL,"So—but it’s quite challenging to get inflation—it’s been—even with very high levels of resource utilization, inflation has been lingering and not getting back up to target in a sustained, symmetric kind of a way."
317,CHAIR POWELL,So saying that you’re going to go for 4 percent—I wonder how credible that will be.
326,CHAIR POWELL,"So the 2013 guidance is not binding, and that’s what came out of the GAO review."
327,CHAIR POWELL,But that’s really the beginning of this—of the story.
328,CHAIR POWELL,"You know, we have the authority we need to examine the banks for safety and soundness exposure."
329,CHAIR POWELL,"So, this—the first thing you start with as a bank supervisor is the risks that the banks are taking to themselves through their portfolio, through the risks that they’re running and the pipeline—you know, the obligations that they’ve undertaken to underwrite deals."
330,CHAIR POWELL,And so we monitor that very carefully—so do the banks—and you see exposures that are much smaller than they were before the crisis.
331,CHAIR POWELL,"And, by the way, we test that regularly in the stress tests."
332,CHAIR POWELL,"We impose very large losses on those portfolios, so we kind of have a sense of what that is, whereas before the crisis, there was a lot of lack of knowledge about what the losses would be."
333,CHAIR POWELL,"So that’s where it starts for us in supervision, is the risks that the banks are running—you know, running on their own books and to themselves and to each other."
334,CHAIR POWELL,"So, in that, I feel—I feel like that is—that’s in a good place, but we never—we never say “Mission accomplished” on that."
335,CHAIR POWELL,"We will keep—you know, keep monitoring that carefully."
336,CHAIR POWELL,"What’s happened, though, is, the paper is now owned by market-based vehicles: collateralized loan obligations, mutual funds, and things like that."
337,CHAIR POWELL,"And so we now have—you know, we have a good sense of, domestically, of where that paper is."
338,CHAIR POWELL,"I think, internationally, not as much, and the Financial Stability Board is actually looking more carefully at that."
339,CHAIR POWELL,"And we—you know, we monitor those vehicles to see what they are."
340,CHAIR POWELL,"And they’re actually pretty stably funded, in the sense that there’s no run risk, but there’s still macroeconomic risk."
341,CHAIR POWELL,"And, you know, this is something that we take very seriously and that the FSOC, the Financial Stability Oversight Council, is looking at."
342,CHAIR POWELL,"And, you know, we call it out as a macroeconomic risk, but it’s not really a financial stability risk, in the sense that it could undermine the ability of the financial system to do its job of intermediating credit."
346,CHAIR POWELL,"You know, I think the issue isn’t that the banks don’t understand what the rules are."
347,CHAIR POWELL,The issue is that the risk isn’t in the banks.
348,CHAIR POWELL,It’s in—it’s out in those market-based vehicles.
349,CHAIR POWELL,"So I don’t, I don’t—you know, I no longer am day-to-day involved in this as I was before I took this job."
350,CHAIR POWELL,"But my sense is, though, that that’s really not the problem."
351,CHAIR POWELL,"I’m not saying it’s perfect, but I think we do understand what risks the banks are running."
353,CHAIR POWELL,And we’re very carefully assessing that.
354,CHAIR POWELL,"And we June 19, 2019 continue to take all these risks seriously."
355,CHAIR POWELL,"You know, I gave a whole speech about this a few Chair Powell’s Press Conference FINAL weeks ago, so."
362,CHAIR POWELL,"You know, we have to be closer, because more jobs are being created than people are entering the labor force."
363,CHAIR POWELL,The unemployment rate is lower.
364,CHAIR POWELL,"You know, by just lots and lots of numbers, the labor market is in a good place."
365,CHAIR POWELL,You mentioned wages.
366,CHAIR POWELL,"So the level of wages is very consistent with what it should be, in the sense that it’s approximately equal to inflation plus productivity increases on an hourly basis."
367,CHAIR POWELL,"So what’s, I guess, a little surprising, though, is that you could reach these levels of unemployment late—you know, long into a cycle, let’s say, and not see even higher wages that are pushing up on inflation, because wages at this level, even though they’re growing at a healthy rate, at an appropriate rate, they’re not growing at a rate that would provide much upward thrust for inflation."
368,CHAIR POWELL,"So, you know, we watch—we watch all of this very carefully, and I think we’re very careful about not assuming that we’re, you know, that would—that there’s no more slack in the labor market."
369,CHAIR POWELL,"You know, we’ve all lived through—you know, when I got to the Fed, we were in the 8 percent–plus range, and it’s just gone down and down and down, and you haven’t seen wages picked up."
370,CHAIR POWELL,You haven’t seen real signals that we’re at maximum employment.
371,CHAIR POWELL,"You have June 19, 2019 seen a tightening labor market."
372,CHAIR POWELL,"You know, it—the surveys that I mentioned will all show that Chair Powell’s Press Conference FINAL the labor market has tightened, but not overtightened."
376,CHAIR POWELL,"So, of course, we haven’t made any decisions yet."
377,CHAIR POWELL,Balance sheet runoff is very close to the end of its planned life.
378,CHAIR POWELL,"I would say this: If we do provide more accommodation—again, we haven’t really addressed this—but if we do provide more accommodation, we’ll certainly keep in mind what we said earlier this year, which is that we’ll always be willing to adjust balance sheet policy so that it serves our dual-mandate objectives."
379,CHAIR POWELL,Thank you very much.
