,speaker,sentence
0,CHAIRMAN BERNANKE,Good afternoon and welcome.
1,CHAIRMAN BERNANKE,"June 22, 2011 In my opening remarks today, I’ll briefly review today’s policy decision."
2,CHAIRMAN BERNANKE,And I’ll place the decision in the context of our economic projections and our policy strategy.
3,CHAIRMAN BERNANKE,I’ll then be glad to take your questions.
4,CHAIRMAN BERNANKE,"Throughout today’s briefing, my goal will be to reflect the consensus of the Committee while taking note of the diversity of views, as appropriate."
5,CHAIRMAN BERNANKE,"Of course, my remarks and interpretations are my own responsibility."
6,CHAIRMAN BERNANKE,"As indicated in the policy statement released earlier this afternoon, the Committee decided today to keep the target range for the federal funds rate at 0 to ¼ percent."
7,CHAIRMAN BERNANKE,The Committee continues to anticipate that economic conditions—including low rates of resource utilization and a subdued outlook for inflation in the medium run—are likely to warrant exceptionally low levels for the federal funds rate for an extended period.
8,CHAIRMAN BERNANKE,"The Committee’s planned purchases of $600 billion of longer-term Treasury securities will be completed by the end of this month, and the Committee will continue to reinvest principal payments from its securities holdings going forward."
9,CHAIRMAN BERNANKE,"In conjunction with today’s meeting, the FOMC participants submitted projections for economic growth, the unemployment rate, and the inflation rate for the years 2011 to 2013 and over the longer run."
10,CHAIRMAN BERNANKE,These projections are conditional on each participant’s individual assessment of the appropriate path of monetary policy needed to best promote the Committee’s objectives.
11,CHAIRMAN BERNANKE,I’ll focus on the information shown in the figures that have been distributed.
12,CHAIRMAN BERNANKE,"In each figure, the dark area denotes the central tendencies of our current projections, while the lighter shaded area denotes the full range of projections."
13,CHAIRMAN BERNANKE,"The longer-run projections, shown at the right of each figure, represent participants’ assessments of the rate to which each variable will converge over time under appropriate monetary policy and assuming no further shocks to the economy."
14,CHAIRMAN BERNANKE,"The longer-run projections for output growth have a central tendency of 2.5 to 2.8 percent, and the longer-run projections for the unemployment rate have a central tendency of 5.2 to 5.6 percent—the same as in our April projections."
15,CHAIRMAN BERNANKE,These projections may be interpreted as indicating participants’ current estimates of the economy’s normal or trend rate of growth and its normal unemployment rate over the longer run respectively.
16,CHAIRMAN BERNANKE,"It should be noted that these estimates are inherently uncertain and subject to revision, because longer-run rates of economic growth and unemployment are determined largely by nonmonetary factors that may evolve over time and that often cannot be directly measured."
17,CHAIRMAN BERNANKE,"The central tendency of the longer-run projections for inflation, as measured by the price index for personal consumption expenditures, is 1.7 to 2.0 percent."
18,CHAIRMAN BERNANKE,"Since the longer-run inflation outlook is determined almost entirely by monetary policy, these projections can be interpreted as indicating the inflation rate that each of the participants judge to be consistent with the Federal Reserve’s mandate of fostering maximum employment and stable prices."
19,CHAIRMAN BERNANKE,"In effect, the “mandate consistent” inflation rate is judged to be 2 percent or a bit less."
20,CHAIRMAN BERNANKE,I now turn to the contours of the Committee’s economic outlook.
21,CHAIRMAN BERNANKE,"As indicated in today’s policy statement, the economic recovery appears to be proceeding at a moderate pace, though somewhat more slowly than the Committee had expected, and some recent labor market indicators have also been weaker than expected."
22,CHAIRMAN BERNANKE,"For example, the unemployment rate has risen by 0.3 percentage points since March, and new claims for unemployment insurance have moved somewhat higher."
23,CHAIRMAN BERNANKE,The reduced pace of the recovery partly reflects factors that are likely to be temporary.
24,CHAIRMAN BERNANKE,"In particular, consumers’ purchasing power has been damped by higher food and energy prices; and the aftermath of the tragic earthquake and tsunami in Japan has been associated with disruptions in global supply chains, especially in the auto sector."
25,CHAIRMAN BERNANKE,"However, some moderation in gasoline prices is now in prospect, and the effects of the Japanese disaster on manufacturing output are likely to dissipate in coming months."
26,CHAIRMAN BERNANKE,"Consequently, as shown in the first figure, entitled “Change in Real GDP,” the Committee expects that the pace of economic recovery will pick up over coming quarters."
27,CHAIRMAN BERNANKE,"Specifically, participants’ projections for output growth have a central tendency of about 2.7 to 2.9 percent for this year and 3.3 to 3.7 percent for next year—growth rates faster than we have seen so far in 2011."
28,CHAIRMAN BERNANKE,"However, Committee participants have also generally responded to the recent slowing by marking down the growth projections for 2011 and 2012, which are nearly a half percentage point lower than our April projections."
29,CHAIRMAN BERNANKE,"Looking further ahead, the central tendency of the growth projections for 2012—2013, sorry—is 3.5 to 4.2 percent, essentially the same as in the April projections."
30,CHAIRMAN BERNANKE,"As shown in the second figure, entitled “Unemployment Rate,” the unemployment rate is expected to resume its gradual decline towards levels that the Committee judges to be consistent with this dual mandate."
31,CHAIRMAN BERNANKE,"In particular, the unemployment rate is projected to edge down over coming months to 8.6 to 8.9 percent in the fourth quarter of this year and then decline gradually over the subsequent two years to a level of 7.0 to 7.5 percent in the fourth quarter of 2013, still well above the central tendency of participants’ longer-run unemployment projections."
32,CHAIRMAN BERNANKE,"In short, we expect the unemployment rate to continue to decline, but the pace of progress remains frustratingly slow."
33,CHAIRMAN BERNANKE,"Inflation has moved up in recent months, mainly reflecting higher prices for some commodities and imported goods."
34,CHAIRMAN BERNANKE,"In addition, prices of motor vehicles have risen notably as a result of the recent supply chain disruptions."
35,CHAIRMAN BERNANKE,"However, as the effects of these factors dissipate, the Committee anticipates that inflation will subside in coming quarters to levels at or below its mandate-consistent rate, as shown in the figure entitled “PCE Inflation.” Specifically, the central tendency of participants’ inflation projections is 2.3 to 2.5 percent for this year but declines to 1.5 to 2.0 percent in both 2012 and 2013—a trajectory that is broadly similar to that of our April projections."
36,CHAIRMAN BERNANKE,The economic outlook provides important policy context.
37,CHAIRMAN BERNANKE,"In particular, the Committee’s policy strategy is intended to foster both aspects of our dual mandate—that is, promoting the economic recovery so that the unemployment rate returns over time to its longer-term normal level, and ensuring that inflation, over time, is at levels consistent with our mandate."
38,CHAIRMAN BERNANKE,"At 9.1 percent, the current unemployment rate remains elevated, and progress towards more normal levels of unemployment is likely to be slow, as I noted."
39,CHAIRMAN BERNANKE,"Moreover, the inflation rate, which picked up in recent months, is expected to subside to levels at or below the rate of 2 percent, or a bit less, that most participants judge to be most consistent with the dual mandate."
40,CHAIRMAN BERNANKE,The ongoing labor market slack and the subdued inflation outlook are key reasons for the Committee’s decision to maintain the current high degree of monetary policy accommodation and for our judgment that exceptionally low levels of the funds rate are likely to be warranted for an extended period.
41,CHAIRMAN BERNANKE,Thank you.
42,CHAIRMAN BERNANKE,I’d be glad to take your questions.
47,CHAIRMAN BERNANKE,We haven’t made any such commitment.
48,CHAIRMAN BERNANKE,"It’s true that when we begin to allow the portfolio to run off rather than reinvesting, that would be a first step in a process of exiting from our currently highly accommodative policies."
49,CHAIRMAN BERNANKE,But we’ve not yet chosen to make any particular commitment about the time frame.
50,CHAIRMAN BERNANKE,But we’ll be looking at the outlook and trying to assess when the appropriate time is to take that step.
53,CHAIRMAN BERNANKE,"No, that’s a good question."
54,CHAIRMAN BERNANKE,"It’s something we have on the table, something we’ve thought about."
55,CHAIRMAN BERNANKE,"But to this point, we haven’t taken that step."
61,CHAIRMAN BERNANKE,"Well, as you—as you point out, what we say is that the temporary factors are “in part” the reason for the slowdown."
62,CHAIRMAN BERNANKE,"In other words, part of the slowdown is temporary, and part of it may be longer lasting."
63,CHAIRMAN BERNANKE,We do believe that growth is going to pick up going into 2012 but at a somewhat slower pace from—than we had anticipated in April.
64,CHAIRMAN BERNANKE,We don’t have a precise read on why this slower pace of growth is persisting.
65,CHAIRMAN BERNANKE,"One way to think about it is that maybe some of the headwinds that have been concerning us, like, you know, weakness in the financial sector, problems in the housing sector, balance sheet and deleveraging issues—some of these headwinds may be stronger or more persistent than we thought."
66,CHAIRMAN BERNANKE,And I think it’s an appropriate balance to attribute a slowdown partly to these identifiable temporary factors but to acknowledge a possibility that some of the slowdown is due to factors which are longer lived and which will be still operative by next year.
67,CHAIRMAN BERNANKE,"You note that, in 2013, we have growth at about the same rate that we anticipated in April."
70,CHAIRMAN BERNANKE,"Well, with respect to Greece, that’s obviously very important."
71,CHAIRMAN BERNANKE,That—it’s a very difficult situation.
72,CHAIRMAN BERNANKE,"We’ve been in close communication with our colleagues in Europe—obviously not part of the negotiations, but we’ve been kept well informed."
73,CHAIRMAN BERNANKE,"We had a G-7 call over the weekend, for example."
74,CHAIRMAN BERNANKE,I think the Europeans appreciate the incredible importance of resolving the Greek situation.
75,CHAIRMAN BERNANKE,"If there were a failure to resolve that situation, it would pose threats to the European financial system, the global financial system, and to European political unity, I would conjecture as well."
76,CHAIRMAN BERNANKE,"So, yes, we did discuss it."
77,CHAIRMAN BERNANKE,It’s one of several potential financial risks that we’re facing now.
78,CHAIRMAN BERNANKE,"But, again, we are mostly just following the—the situation closely and making sure that, as best we can, that our own institutions are well positioned relative to sovereign debt in the so-called peripheral countries."
79,CHAIRMAN BERNANKE,"With respect to additional asset purchases, we haven’t taken any action, obviously, today."
80,CHAIRMAN BERNANKE,We’ll be reviewing the outlook going forward.
81,CHAIRMAN BERNANKE,It will be a Committee decision.
82,CHAIRMAN BERNANKE,"I think the point I would make, though, in terms of where we are today versus where we were, say, in August of last year when I began to talk about asset purchases, is that at that time, inflation was very low and falling."
83,CHAIRMAN BERNANKE,Many objective indicators suggested that deflation was a nontrivial risk.
84,CHAIRMAN BERNANKE,And I think that the securities purchases have been very successful in eliminating deflation risk.
85,CHAIRMAN BERNANKE,I don’t think people appreciate necessarily that deflation can be a very pernicious situation where it could have very long-lasting effects on economic growth.
86,CHAIRMAN BERNANKE,"In addition, growth in payrolls has actually picked up."
87,CHAIRMAN BERNANKE,"In the four months before the Jackson Hole speech in August, there was about an 80,000 per month payroll increase."
88,CHAIRMAN BERNANKE,"So far in 2011, including the weak payroll report in May, the average is closer to 180,000."
89,CHAIRMAN BERNANKE,"So there has been improvement in the labor market, albeit not as strong as we would like."
90,CHAIRMAN BERNANKE,"As of last August, we were essentially missing significantly in both—on both sides of our mandate."
91,CHAIRMAN BERNANKE,"Inflation was too low and falling, and unemployment looked like it might be even beginning to rise again."
92,CHAIRMAN BERNANKE,"In that case, the case for monetary action was pretty clear in my mind."
93,CHAIRMAN BERNANKE,"I think we are in a different position today—certainly not where we’d like to be, but closer to the dual-mandate objectives than we were at that time."
94,CHAIRMAN BERNANKE,"So, again, the situation is different today than last August, but we’ll continue to monitor the economy and act as needed."
98,CHAIRMAN BERNANKE,The effect of fiscal cuts on the economy depends very much on the timing.
99,CHAIRMAN BERNANKE,"I’ve advocated that the negotiations about the budget focus on the longer term, say, 10 years, which is the budget window, or even longer if you’re taking into account entitlement reform, for example."
100,CHAIRMAN BERNANKE,"By taking a long-run perspective, we can help the economy by reducing the risk that interest rates might rise suddenly."
101,CHAIRMAN BERNANKE,We may help increase confidence in the part of households and businesses.
102,CHAIRMAN BERNANKE,And so I think it’s very desirable that we take strong action to lower our budget deficits over the longer term.
103,CHAIRMAN BERNANKE,"In doing that, I think it would be best not to—in light of the weakness of the recovery, it would be best not to have sudden and sharp fiscal consolidation in the very near term."
104,CHAIRMAN BERNANKE,That doesn’t do so much for the long-run budget situation.
105,CHAIRMAN BERNANKE,It just is a negative for growth.
106,CHAIRMAN BERNANKE,"So my answer is that it depends very much on the timing, and I hope that the congressional negotiators will take a longer-term view as they—as they discuss the issue."
111,CHAIRMAN BERNANKE,"I don’t think that sharp, immediate cuts in the deficit would create more jobs."
112,CHAIRMAN BERNANKE,"I think in the very short run that we are seeing already a certain amount of fiscal drag coming from state and local governments, as well as from the withdrawal of previous federal stimulus."
113,CHAIRMAN BERNANKE,"So I think in the very short run that, you know, the fiscal tightening is—is, at best, neutral but probably somewhat negative for job creation."
114,CHAIRMAN BERNANKE,"I think what people will understand, should understand, is that our budgetary problems are very long run in nature."
115,CHAIRMAN BERNANKE,"The projections made by the CBO, for example, talk about where our debt-to-GDP ratio will be in 2020, 2025, and so on."
116,CHAIRMAN BERNANKE,That doesn’t mean we should wait to act.
117,CHAIRMAN BERNANKE,"The sooner we can act, the better."
118,CHAIRMAN BERNANKE,"But the most efficient and effective way to address our fiscal problems—and, again, I think this is extremely important—is to take a longer-run perspective, not to focus the cuts heavily on the near term."
119,CHAIRMAN BERNANKE,"But by taking a long-run perspective and making a credible plan for reducing future deficits, we’ll lower interest rates, or at least prevent them from rising, and we will increase confidence."
120,CHAIRMAN BERNANKE,And that could be very constructive.
121,CHAIRMAN BERNANKE,"But if it’s entirely focused on the near term, I don’t think that’s the optimal way to proceed."
126,CHAIRMAN BERNANKE,"Well, Neil, as you know, I’ve been a long-time proponent of an inflation target."
127,CHAIRMAN BERNANKE,I think that it would help anchor inflation expectations; it would make it easier to reach our inflation objective.
128,CHAIRMAN BERNANKE,"At the same time, it’s not at all inconsistent with our employment objective because keeping inflation low and stable, keeping inflation expectations low and stable, actually gives the Fed more leeway to respond to short-term shocks to the economy."
129,CHAIRMAN BERNANKE,"So I think it’s something, you know, that is worth considering."
130,CHAIRMAN BERNANKE,"In terms of authorities, I would just say that there are multiple models around the world."
131,CHAIRMAN BERNANKE,"So, for example, in the European Central Bank, that bank has a mandate for price stability, period."
132,CHAIRMAN BERNANKE,And they set their own definition of that using input from economists and others.
133,CHAIRMAN BERNANKE,So I don’t think there’s a real barrier to setting a target.
134,CHAIRMAN BERNANKE,"However, it is very important that, first, that we communicate to the public what we’re doing."
135,CHAIRMAN BERNANKE,"Without sufficient explanation and background, many people might think that we were somehow abandoning our employment target."
136,CHAIRMAN BERNANKE,So we need to make sure that that’s well understood both by the public and by Congress that having a target would not mean that we were abandoning the other leg of the dual mandate.
137,CHAIRMAN BERNANKE,"Also, you asked about consulting with Congress."
138,CHAIRMAN BERNANKE,"I think under any circumstances, it would be important to take the pulse of Congress."
139,CHAIRMAN BERNANKE,"They—we might have the legal authority to do this, but I think we do need some buy-in from the Administration and Congress to take that step."
140,CHAIRMAN BERNANKE,We are continuing to periodically discuss this issue.
141,CHAIRMAN BERNANKE,"It’s been part of our ongoing communications discussion, which included this press conference as one innovation, for example."
142,CHAIRMAN BERNANKE,There’s nothing imminent.
143,CHAIRMAN BERNANKE,"But, again, we’ll continue to discuss this, and, as appropriate, we’ll be consulting about it."
148,CHAIRMAN BERNANKE,"Well, to answer your second question first, we have been very assiduous in examining the exposures of financial institutions to the so-called peripheral countries."
149,CHAIRMAN BERNANKE,"The answer is that the banks that we regulate are not significantly exposed to—to those countries directly, at least."
150,CHAIRMAN BERNANKE,"They have significant exposures to European banks in the nonperipheral countries, and so indirectly, they have that exposure."
151,CHAIRMAN BERNANKE,The—and that statement which I just made includes credit default swaps and so on.
152,CHAIRMAN BERNANKE,The gross numbers that the BIS publishes do not fully account for a wide variety of hedges and other positions.
154,CHAIRMAN BERNANKE,And the answer is that the effects are very small.
155,CHAIRMAN BERNANKE,"It’s also the case that—well, we don’t oversee the money market mutual funds."
156,CHAIRMAN BERNANKE,We have been keeping a close eye on that situation.
157,CHAIRMAN BERNANKE,"There again, the situation is similar in some sense, in that except—with very few exceptions, the money market mutual funds don’t have much direct exposure to the three peripheral countries which are currently dealing with debt problems."
158,CHAIRMAN BERNANKE,"They do have very substantial exposure to European banks in the so-called core countries: Germany, France, et cetera."
159,CHAIRMAN BERNANKE,"So to the extent that there is indirect impact on—on the core European banks, that does pose some concern to money market mutual funds and is a reason why the Federal Reserve and other regulators are continuing to look at ways to strengthen money market mutual funds."
160,CHAIRMAN BERNANKE,"In terms of the impact of the problem in Greece on the United States, as I’ve indicated, the direct exposures are pretty small, and we’re doing all we can to monitor those exposures."
161,CHAIRMAN BERNANKE,"However, as we saw in a small situation, a small case last spring, a disorderly default in one of those countries would no doubt roil financial markets globally."
162,CHAIRMAN BERNANKE,"It would have a big impact on credit spreads, on stock prices, and so on."
163,CHAIRMAN BERNANKE,"And so, in that respect, I think the effects on the United States would be quite significant."
168,CHAIRMAN BERNANKE,"So I’ll be attending that meeting, and so I’ll have a chance to hear others’ views and to contribute to that discussion."
169,CHAIRMAN BERNANKE,It’s only been two years since we had the worst financial crisis certainly since the Great Depression and possibly in the history of the United States.
170,CHAIRMAN BERNANKE,And the failure or near failure of large financial institutions was a major contributor to that crisis.
171,CHAIRMAN BERNANKE,"Since we can’t know exactly what threats will come in the future, probably the best all-purpose way of strengthening the balance sheets of banks and other financial institutions is by capital."
172,CHAIRMAN BERNANKE,"And I’m very supportive of increased capital to—and better quality capital—to help ensure that these banks will be stable and able to lend in the event of another crisis, which I hope we don’t, of course, ever see."
173,CHAIRMAN BERNANKE,"In terms of the SIFI surcharge, so-called, I think it’s also appropriate to have additional capital requirements for the largest and most systemically important institutions."
174,CHAIRMAN BERNANKE,"After all, it’s because their failure would have very deleterious effects in the financial system, we need to take extra steps to make sure that they will be very unlikely to fail."
175,CHAIRMAN BERNANKE,"In addition, it provides some more level playing field because, by having higher equity requirements, the largest institutions avoid some of the funding advantages that would otherwise accrue to firms that are viewed as being too big to fail."
176,CHAIRMAN BERNANKE,So I think it’s very important to do that.
177,CHAIRMAN BERNANKE,"And we’ll be negotiating, discussing with our colleagues internationally what the appropriate number of firms is, what the appropriate criteria are, and what the amount of capital should be."
178,CHAIRMAN BERNANKE,"In choosing the amount of capital, we will certainly be trying to weigh off and balance, on the one hand, the need for extra safety of systemically important firms against the impacts on lending and so on."
179,CHAIRMAN BERNANKE,"Although I would note that, since systemically important firms are only part of the banking system, to the extent that they reduce their lending, some of that lending might go to other institutions."
180,CHAIRMAN BERNANKE,"In terms of going too far, you know, it’s very, very difficult to make a broad-based assessment of the overall impact of all of the rules and regulations."
181,CHAIRMAN BERNANKE,"But I would like to make clear that, both by law and by our internal practices, the Federal Reserve does cost-benefit analysis of every rule that we write, and we publish those."
182,CHAIRMAN BERNANKE,So we are looking at the cost-benefit for these regulations.
183,CHAIRMAN BERNANKE,"Moreover, we have worked with—the Federal Reserve has worked actively with the BIS, the Basel Committee, to do analyses of the effects of capital requirements, on the one hand, on the probability of a crisis, and on the other hand, on the cost of lending and the effect on growth."
184,CHAIRMAN BERNANKE,Those studies have been published.
185,CHAIRMAN BERNANKE,"And if you look at them, you’ll see that we believe that the capital which has been imposed so far would significantly reduce the threat of a massive financial crisis and, on the other hand, have very small effects on growth."
186,CHAIRMAN BERNANKE,So I don’t think we’re on the wrong side of that tradeoff at this point.
192,CHAIRMAN BERNANKE,"Well, to address the latter question first, that’s a possibility."
193,CHAIRMAN BERNANKE,"As you saw from the—but as you saw from the projections we just put out, the Committee—every member of the Committee sees the long-run unemployment rate—the NAIRU, as it’s called by economists—somewhere around 5½ percent, basically."
194,CHAIRMAN BERNANKE,So that would suggest that the Committee still believes that the output gap is quite large.
195,CHAIRMAN BERNANKE,"With respect to core inflation, some of the effects, at least there, are also temporary."
196,CHAIRMAN BERNANKE,"To name two examples, the supply chain disruptions brought about by the Japanese disaster have led to a very significant increase in auto prices, both new and used automobiles, last month."
197,CHAIRMAN BERNANKE,As these problems are resolved—and they appear to be very much on the way to being resolved—we would assume that the auto prices would come back down and incentives would be restored as competition increases and costs are reduced.
198,CHAIRMAN BERNANKE,So that’s one example.
199,CHAIRMAN BERNANKE,"Another would be the fact that energy prices have passed through to a number of—despite the fact that core is defined excluding energy, that’s only the energy, direct energy products—things like airfares, for example, which are very sensitive to the cost of jet fuel, are also a part of the core."
200,CHAIRMAN BERNANKE,"So you would imagine that, as the price of oil declines, that you would see some bounce—decline in, also in—in the core measures of inflation."
