,sentence
134,"Several members commented, however, that the adoption of ranges centered on the Committee's expectations for growth of the monetary aggregates should be reconsidered in the future if the members were to become more confident about the relationship between the growth of the money and measures of aggregate economic performance."
135,The Committee also agreed that the range for nonfinancial debt for 1998 should be left unchanged.
136,The tentative range readily encompassed the pace seen as likely to be associated with the members' forecasts for economic activity and prices.
137,"Accordingly, the following statement of longer-run policy for 1998 was approved for inclusion in the domestic policy directive: The Federal Open Market Committee seeks monetary and financial conditions that will foster price stability and promote sustainable growth in output."
138,"In furtherance of these objectives, the Committee at this meeting established ranges for growth of M2 and M3 of 1 to 5 percent and 2 to 6 percent respectively, measured from the fourth quarter of 1997 to the fourth quarter of 1998."
139,The range for growth of total domestic nonfinancial debt was set at 3 to 7 percent for the year.
140,"The behavior of the monetary aggregates will continue to be evaluated in the light of progress toward price level stability, movements in their velocities, and developments in the economy and financial markets."
141,"Votes for this action: Messrs. Greenspan, McDonough, Ferguson, Gramlich, Hoenig, Jordan, Kelley, McTeer, Meyer, and Mses."
142,"Minehan, Phillips, and Rivlin."
143,Votes against this action: None.
144,"In the Committee's discussion of policy for the intermeeting period ahead, all the members endorsed a proposal to maintain an unchanged policy stance."
145,The economy currently was performing very well and the outlook over the near term was for subdued inflation and continued solid economic growth.
146,"Over a longer horizon, the range of possible outcomes was unusually wide, and the direction that policy would need to move to promote sustained expansion and damped inflation was unclear."
147,"At this point, the extent to which the still largely anticipated external drag from events in Asia would offset the strong upward momentum in domestic demand was a source of major uncertainty."
148,"In addition, it was impossible to predict whether or when the tightness in labor markets would exert a more pronounced effect on labor costs and ultimately on price inflation."
149,Even the thrust of the current stance of monetary policy as it was transmitted through financial markets was open to some question.
150,"On the one hand, a real federal funds rate that was on the high side of historical experience and a substantially stronger dollar suggested some restraint."
151,"From a different perspective, however, financial conditions seemed to be quite stimulative as evidenced by lower nominal and perhaps real intermediate and long-term interest rates, rising equity prices, ready credit availability, and rapid growth of the broad measures of money and credit."
152,"While the members differed to some extent in their forecasts of major trends in the economy and in the risks of alternative outcomes, they agreed that, under foreseeable circumstances, needed adjustments to policy probably could be made on a timely basis once the balance of underlying forces became more evident."
153,"Accordingly, a steady policy would not incur an unacceptable risk of a seriously deteriorating economic performance."
154,"In the interim, the greater risk would be to make a preemptive policy move on the basis of inadequate evidence regarding underlying economic trends."
155,"In the Committee's discussion of possible intermeeting adjustments to policy, all the members agreed that prevailing uncertainties indicated the desirability of retaining a symmetric instruction in the directive."
156,"While a number of members expressed the view that the next policy move was likely to be a tightening action and one member saw a greater probability of an easing action, the uncertainties were sufficiently great to warrant remaining sensitive to the need for a policy change in either direction."
157,"Accordingly, a symmetric directive would signal the Committee's readiness to respond promptly to developments that might threaten the economy's satisfactory performance."
158,"At the conclusion of the Committee's discussion, all the members indicated their support of a directive that called for maintaining conditions in reserve markets that were consistent with an unchanged federal funds rate of about 5-1/2 percent, and all also favored a directive that did not include a presumption about the direction of a change, if any, in the stance of policy during the intermeeting period."
159,"Accordingly, in the context of the Committee's long-run objectives for price stability and sustainable economic growth, and giving careful consideration to economic, financial, and monetary developments, the members decided that a slightly higher or a slightly lower federal funds rate might be acceptable during the intermeeting period."
160,The reserve conditions contemplated at this meeting were expected to be consistent with some moderation in the growth of M2 and M3 over coming months.
161,"The Federal Reserve Bank of New York was authorized and directed, until instructed otherwise by the Committee, to execute transactions in the System Account in accordance with the following domestic policy directive: The information reviewed at this meeting suggests that economic activity continued to grow rapidly during the closing months of 1997."
162,"Nonfarm payroll employment increased sharply further in December after posting very large gains in other recent months; the civilian unem ployment rate, at 4."
163,"7 percent, remained near its low for the current economic expansion."
164,Industrial production continued to advance at a brisk pace in the fourth quarter.
165,"Consumer spending rose appreciably in the quarter, and housing starts remained close to the highs of the current expansion."
166,Business fixed investment weakened following exceptionally strong increases in the second and third quarters; nonfarm inventory accumulation appears to have picked up somewhat.
167,The nominal deficit on U. S. trade in goods and services narrowed significantly on average in October and November from its level in the third quarter.
168,Price inflation has remained subdued despite appreciably faster increases in worker compensation in recent months.
169,"Most interest rates have declined on balance since the day before the Committee meeting on December 16, 1997."
170,"Share prices in U. S. equity markets have moved up somewhat over the period; equity markets in some other countries, notably in Asia, have remained volatile."
171,"In foreign exchange markets, the value of the dollar has risen over the intermeeting period relative to the currencies of several Asian developing countries, but it has registered only a small increase on average in relation to the currencies of major industrial nations."
172,M2 and M3 continued to grow at relatively rapid rates in December and apparently also in January.
173,"From the fourth quarter of 1996 to the fourth quarter of 1997, M2 expanded at a rate somewhat above the upper bound of its range for the year and M3 at a rate substantially above the upper bound of its range."
174,Total domestic nonfinancial debt expanded in 1997 at a pace somewhat below the middle of its range.
175,The Federal Open Market Committee seeks monetary and financial conditions that will foster price stability and promote sustainable growth in output.
176,"In furtherance of these objectives, the Committee at this meeting established ranges for growth of M2 and M3 of 1 to 5 percent and 2 to 6 percent respectively, measured from the fourth quarter of 1997 to the fourth quarter of 1998."
177,The range for growth of total domestic nonfinancial debt was set at 3 to 7 percent for the year.
178,"The behavior of the monetary aggregates will continue to be evaluated in the light of progress toward price level stability, movements in their velocities, and developments in the economy and financial markets."
179,"In the implementation of policy for the immediate future, the Committee seeks conditions in reserve markets consistent with maintaining the federal funds rate at an average of around 5-1/2 percent."
180,"In the context of the Committee's long-run objectives for price stability and sustainable economic growth, and giving careful consideration to economic, financial, and monetary developments, a slightly higher federal funds rate or a slightly lower federal funds rate might be acceptable in the intermeeting period."
181,The contemplated reserve conditions are expected to be consistent with some moderation in the growth in M2 and M3 over coming months.
182,"Votes for this action: Messrs. Greenspan, McDonough, Ferguson, Gramlich, Hoenig, Jordan, Kelley, Meyer, McTeer, Mses."
183,"Minehan, Phillips and Rivlin."
184,"Votes against this action: None It was agreed that the next meeting of the Committee would be held on Tuesday, March 31, 1998."
185,The meeting
