,sentence
133,The reserve conditions contemplated at this meeting were expected to be consistent with moderate growth in M2 and M3 over coming months.
134,"The Federal Reserve Bank of New York was authorized and directed, until instructed otherwise by the Committee, to execute transactions in the System Account in accordance with the following domestic policy directive: The information reviewed at this meeting suggests that domestic final demand has continued to expand at a robust pace, but overall economic activity has been adversely affected by the strike at General Motors and developments in Asia."
135,Nonfarm payroll employment continued to expand through July and the civilian unemployment rate was unchanged at 4.
136,5 percent.
137,Industrial production declined considerably in June and July; most of the drop over the two months reflected the GM strike.
138,A decline in total retail sales in July was more than accounted for by a sharp contraction in spending for motor vehicles.
139,Residential sales and construction have remained exceptionally strong in recent months.
140,"Available indicators point to continued growth in business capital spending, although apparently at a more moderate pace than earlier in the year."
141,Business inventory accumulation slowed sharply in the spring.
142,The nominal deficit on U. S. trade in goods and services widened substantially further in the second quarter.
143,Trends in wages and prices have remained stable in recent months.
144,Most interest rates have fallen slightly on balance since the meeting on June 30-July 1.
145,Share prices in U. S. equity markets have remained volatile and major indexes have declined appreciably on balance over the intermeeting period.
146,"In foreign exchange markets, the trade-weighted value of the dollar rose somewhat further over the intermeeting period in relation to other major currencies; in addition, it was up slightly in terms of an index of the currencies of the developing countries of Latin America and Asia that are important trading partners of the United States."
147,"After robust growth in the second quarter, M2 decelerated somewhat and M3 was about unchanged in July."
148,"For the year through July, both aggregates rose at rates well above the Committee's ranges for the year."
149,Expansion of total domestic nonfinancial debt appears to have moderated somewhat in recent months after a pickup earlier in the year.
150,The Federal Open Market Committee seeks monetary and financial conditions that will foster price stability and promote sustainable growth in output.
151,"In furtherance of these objectives, the Committee reaffirmed at its meeting on June 30-July 1 the ranges it had established in February for growth of M2 and M3 of 1 to 5 percent and 2 to 6 percent respectively, measured from the fourth quarter of 1997 to the fourth quarter of 1998."
152,The range for growth of total domestic nonfinancial debt was maintained at 3 to 7 percent for the year.
153,"For 1999, the Committee agreed on a tentative basis to set the same ranges for growth of the monetary aggregates and debt, measured from the fourth quarter of 1998 to the fourth quarter of 1999."
154,"The behavior of the monetary aggregates will continue to be evaluated in the light of progress toward price level stability, movements in their velocities, and developments in the economy and financial markets."
155,"In the implementation of policy for the immediate future, the Committee seeks conditions in reserve markets consistent with maintaining the federal funds rate at an average of around 5-1/2 percent."
156,"In the context of the Committee's long-run objectives for price stability and sustainable economic growth, and giving careful consider- ation to economic, financial, and monetary developments, a slightly higher federal funds rate or a slightly lower federal funds rate would be acceptable in the inter- meeting period."
157,The contemplated reserve conditions are expected to be consistent with moderate growth in M2 and M3 over coming months.
158,"Votes for this action: Messrs. Greenspan, McDonough, Ferguson, Gramlich, Hoenig, Kelley, Meyer, Ms. Minehan, Mr. Poole, and Ms. Rivlin."
159,Vote against this action: Mr. Jordan.
160,"Mr. Jordan dissented because he believed that the underlying strength of aggregate demand in the U. S. economy would remain fundamentally intact, despite economic problems abroad."
161,The problems in Asia provide a channel for economic imbalances to develop.
162,Exports from some U. S. manufacturing industries will decline due to softer foreign markets and import competition.
163,"At the same time, domestic demand for imports, housing, and consumer durables will increase due to favorable interest rate trends."
164,"Though U. S. production of goods and services might slow during the period ahead, it is not yet clear that total demand will diminish at a comparable pace."
165,"At the same time, ample credit provision encourages speculative lending and excessive consumption."
166,"Consequently, continued rapid growth in the money supply creates the risk that inflation will accelerate and economic imbalances will become protracted."
167,TELEPHONE CONFERENCE On September 21 the Committee held a telephone conference to discuss recent developments in domestic and international financial markets and their implications for the U. S. economy.
168,The consultation was held as background for Chairman Greenspan's testimony on September 23 before the Senate Budget Committee.
169,"It was agreed that the next meeting of the Committee would be held on Tuesday, September 29, 1998."
170,The meeting
