,sentence
135,"Still, in view of their possible advantages in helping to meet SOMA portfolio objectives at some point in the future, the Committee instructed the staff to continue to focus available resources on the possible use of Ginnie Maes for such operations."
136,The Committee also decided to discontinue further consideration of the possible use of foreign sovereign debt obligations as collateral for repurchase agreements in light of the problems that were envisaged in the employment of such securities.
137,At this meeting the Committee also reviewed work that had been done on the potential use of an auction credit facility (ACF) that could serve as a partial substitute for Treasury or other securities.
138,"In addition, the Committee reviewed a study that considered whether an ACF might be adapted for use in a contingency (CACF) as a full substitute for open market operations."
139,Many of the members commended the staff for its careful assessment of the potential for such operations.
140,"The members concluded, however, that significant resources should not be assigned at this time to the further study of these alternatives to open market operations given the prospects for an enlarged supply of Treasury obligations, the decision to focus on Ginnie Maes, and the introduction of a new discount window program, the System's primary credit facility, scheduled for implementation in early 2003."
141,"In addition, the CACF had been made unnecessary by the implementation of contingency plans and backup facilities since September 2001."
142,"The members concurred with the staff's recommendation that the staff studies prepared for the Committee in January 2001, when it discussed in detail various alternatives to holding U. S. government securities, should be released to the public after light editing was completed."
143,"It was agreed that the next meeting of the Committee would be held on Tuesday, December 10, 2002."
144,The meeting
