,sentence
138,"Moreover, a 50 basis point reduction that was associated with the communication of a Committee view that the risks to achieving its objectives for economic activity were balanced might be mistakenly interpreted in the view of some members as a signal that the Committee had come to the end of its policy easing moves--a judgment they were not prepared to make at this time."
139,The case for a larger 50 basis point reduction in the target federal funds rate focused on the desirability of a relatively forceful policy move that would be more likely to promote a strengthening economic expansion and at the same time provide greater assurance of countering any significant disinflation.
140,"One member, who interpreted recent economic developments as providing fairly persuasive indications that an upturn in the expansion was already under way, saw merit in keeping policy unchanged but did not oppose a ¼ percentage point easing."
141,"Concerning the press statement to be released to the public shortly after today's meeting, the members agreed that it should include a reference to signs of firming economic activity and should highlight the key factors underlying the members' outlook for a more robust economic performance over time."
142,"Nonetheless, inflation could edge lower and the Committee needed to be cognizant of the risk of substantial further disinflation, which could have potentially adverse effects."
143,"With regard to the Committee's assessment of the risks to be incorporated in the press release, the members generally agreed that the risks to the goal of sustainable economic growth were about balanced for the next few quarters and that the probability of appreciable further disinflation from an already low level of inflation exceeded the probability of a rise in inflation."
144,"The members also endorsed a general statement stating that, taken together, the balance of risks to the Committee's dual goals was tilted toward the downside for the foreseeable future."
145,"During the discussion, several members also stressed the importance of communicating clearly the reasons for the Committee's decisions, thereby helping to assure the success of the Committee's policymaking efforts."
146,"At the conclusion of the discussion, the Committee voted to authorize and direct the Federal Reserve Bank of New York, until it was instructed otherwise, to execute transactions in the System Account in accordance with the following domestic policy directive: The Federal Open Market Committee seeks monetary and financial conditions that will foster price stability and promote sustainable growth in output."
147,"To further its long-run objectives, the Committee in the immediate future seeks conditions in reserve markets consistent with reducing the federal funds rate to an average of around 1 percent."
148,"The vote encompassed the following statement whose substance would be included in the press release to be made available shortly after the meeting: The risks to the Committee's outlook for sustainable economic growth over the next several quarters are balanced; the risks to its outlook for inflation over the next several quarters are weighted toward the downside; and, taken together, the balance of risks to its objectives is weighted toward the downside in the foreseeable future."
149,"Votes for this action: Messrs. Greenspan, Bernanke, Ms. Bies, Messrs. Broaddus, Ferguson, Gramlich, Guynn, Kohn, Moskow, Olson, and Stewart."
150,(Mr. Stewart voted as an alternate member. )
151,Votes against this action: Mr. Parry.
152,Mr. Parry dissented because he preferred a 50 basis point reduction in the federal funds rate target as insurance against continued sluggishness in economic activity and further declines in inflation measures to undesirably low rates.
153,"While he believed that a significant increase in the pace of activity over the next several quarters was likely, he had not yet seen convincing evidence that this process was under way."
154,"Moreover, the current slack in labor and product markets was likely to persist for some time even with a significant pickup in real GDP growth, and this prospect threatened to reduce inflation further."
155,"Finally, recent declines in inflation expectations had raised the real federal funds rate."
156,"In order to offset that increase and provide additional stimulus, he saw a 50 basis point reduction in the rate as desirable."
157,"It was agreed that the next meeting of the Committee would be held on Tuesday, August 12, 2003."
158,The meeting
