,sentence
166,Some participants noted that foreign demand remained robust and net exports appeared strong.
167,Port utilization rates reportedly remained high.
168,Participants discussed the turbulence in foreign financial markets and noted that unusually high precautionary demand for dollar-denominated term funding in Europe had added to strains in U. S. interbank markets and contributed to a wide spread between libor and federal funds rates.
169,Participants made only modest revisions to their outlook for inflation in the period since the Committee's last regular meeting.
170,"Still, they recognized that incoming data on core inflation continued to be favorable, and they generally were a little more confident that the decline in inflation earlier this year would be sustained."
171,"Inflation expectations seemed to be contained, and the less robust economic outlook implied somewhat less pressure on resources going forward."
172,Participants nonetheless remained concerned about possible upside risks to inflation.
173,"Higher benefit costs, rising unit labor costs more generally, reduced markups, and levels of resource utilization both in the United States and abroad that remained relatively high were all cited as factors that could contribute to inflationary pressures."
174,Inflation risks could be heightened if the dollar were to continue to depreciate significantly.
175,"In the Committee's discussion of policy for the intermeeting period, all members favored an easing of the stance of monetary policy."
176,"Members emphasized that because of the recent sharp change in credit market conditions, the incoming data in many cases were of limited value in assessing the likely evolution of economic activity and prices, on which the Committee's policy decision must be based."
177,Members judged that a lowering of the target funds rate was appropriate to help offset the effects of tighter financial conditions on the economic outlook.
178,"Without such policy action, members saw a risk that tightening credit conditions and an intensifying housing correction would lead to significant broader weakness in output and employment."
179,"Similarly, the impaired functioning of financial markets might persist for some time or possibly worsen, with negative implications for economic activity."
180,"In order to help forestall some of the adverse effects on the economy that might otherwise arise, all members agreed that a rate cut of 50 basis points at this meeting was the most prudent course of action."
181,Such a measure should not interfere with an adjustment to more realistic pricing of risk or with the gains and losses that implied for participants in financial markets.
182,"With economic growth likely to run below its potential for a while and with incoming inflation data to the favorable side, the easing of policy seemed unlikely to affect adversely the outlook for inflation."
183,The Committee agreed that the statement to be released after the meeting should indicate that the outlook for economic growth had shifted appreciably since the Committee's last regular meeting but that the 50 basis point easing in policy should help to promote moderate growth over time.
184,They also agreed that the inflation situation seemed to have improved slightly and judged that it was no longer appropriate to indicate that a sustained moderation in inflation pressures had yet to be shown.
185,"Nonetheless, all agreed that some inflation risks remained and that the statement should indicate that the Committee would continue to monitor inflation developments carefully."
186,"Given the heightened uncertainty about the economic outlook, the Committee decided to refrain from providing an explicit assessment of the balance of risks, as such a characterization could give the mistaken impression that the Committee was more certain about the economic outlook than was in fact the case."
187,Future actions would depend on how economic prospects were affected by evolving market developments and by other factors.
188,"At the conclusion of the discussion, the Committee voted to authorize and direct the Federal Reserve Bank of New York, until it was instructed otherwise, to execute transactions in the System Account in accordance with the following domestic policy directive: ""The Federal Open Market Committee seeks monetary and financial conditions that will foster price stability and promote sustainable growth in output."
189,"To further its long-run objectives, the Committee in the immediate future seeks conditions in reserve markets consistent with reducing the federal funds rate to an average of around 4-3/4 percent. """
190,"The vote encompassed approval of the text below for inclusion in the statement to be released at 2:15 p. m. : ""Developments in financial markets since the Committee's last regular meeting have increased the uncertainty surrounding the economic outlook."
191,"The Committee will continue to assess the effects of these and other developments on economic prospects and will act as needed to foster price stability and sustainable economic growth. """
192,"Votes for this action: Messrs. Bernanke, Geithner, Evans, Hoenig, Kohn, Kroszner, Mishkin, Poole, Rosengren, and Warsh."
193,Votes against this action: None.
194,The Committee then resumed its discussion of monetary policy communication issues.
195,"Subsequently, in a joint session of the Federal Open Market Committee and the Board of Governors, Board members and Reserve Bank presidents discussed additional policy options to address strains in money markets."
196,"No decisions were made in this session, but it was agreed that policymakers should continue to consider such options carefully."
197,"It was agreed that the next meeting of the Committee would be held on Tuesday-Wednesday, October 30-31, 2007."
198,The meeting
