,sentence
0, reported on recent developments in foreign exchange markets.
1,There were no open market operations in foreign currencies for the Systems account in the period since the previous meeting.
2,The Manager also reported on developments in domestic financial markets and on System open market operations in government securities and federal agency obligations during the period since the previous meeting.
3,"By unanimous vote, the Committee ratified these transactions."
4,"The information provided to the Committee on the first day of the meeting, prior to the release of the advance estimates of the third-quarter national income and product accounts, indicated that economic activity expanded at a solid pace in the third quarter."
5,"Consumer spending rose more strongly after a tepid increase in the second quarter, and the pace of expansion of business outlays for equipment and structures remained reasonably solid."
6,Manufacturing posted a sizable gain for the third quarter as a whole.
7,"In contrast, the slump in residential investment intensified during the third quarter, at least partly because of ongoing disruptions in the markets for nonconforming mortgages."
8,The average monthly gain in private employment also slowed significantly.
9,"Headline inflation eased during the third quarter, reflecting a decline in energy prices; core inflation continued to be moderate."
10,Employment increased more slowly in the third quarter than in the first half of the year.
11,"Private payroll employment registered a considerably smaller average monthly gain; employment in residential construction, manufacturing, and industries related to mortgage lending continued to decline, but most service-producing industries added jobs at a moderate pace."
12,"With gains in employment smaller and the workweek flat, the growth of aggregate hours of private production or nonsupervisory workers stepped down from its second-quarter pace."
13,"The labor force participation rate was unchanged, on average, in the third quarter, and the unemployment rate ticked up to 4."
14,7 percent in September.
15,Industrial production changed little in August and September after having posted solid advances in June and July.
16,Manufacturing output expanded in the third quarter overall at about the same pace as in the second quarter but declined modestly on net in August and September.
17,"During those two months, production was damped by declines in the output of motor vehicles and parts."
18,"In addition, output of construction supplies and products fell, likely reflecting the ongoing decline in residential investment."
19,"Meanwhile, production in the high-tech sector rose at a moderate rate."
20,Consumer spending was well maintained in August and September.
21,"Motor vehicle sales improved, and real spending on other goods posted solid gains in both months."
22,Real outlays on consumer services were strong in August because of a weather-induced jump in energy services.
23,Solid increases in nominal wages and salaries and lower headline inflation led to robust gains in real income over the summer.
24,"However, other factors affecting consumer spending were mixed."
25,"Short-term interest rates dropped and stock prices rose, on balance, after August."
26,"By contrast, house prices continued to decelerate, standards on consumer and mortgage credit tightened after mid-summer, and the turmoil in financial markets that started in the summer likely exerted some restraint on consumer spending."
27,"Moreover, measures of consumer confidence had declined in recent months."
28,The housing downturn deepened as sales of new and existing single-family homes continued to fall.
29,Deterioration in nonprime mortgage markets as well as higher mortgage interest rates and tighter lending conditions for prime jumbo loans since earlier in the year appeared to be restraining housing demand.
30,"Forward-looking indicators, including an index of pending home sales and adjusted single-family permit issuance, continued to point to a further slowing in housing activity over the near term."
31,Single-family housing starts declined significantly over August and September.
32,"Nonetheless, with single-family home sales continuing to sag, inventories of unsold homes remained quite elevated."
33,"In the multifamily sector, starts declined sharply in September; however, the third-quarter reading remained within the fairly narrow range observed over the past decade."
34,Orders and shipments of nondefense capital goods excluding aircraft rose on average over August and September.
35,"In the high-tech category, orders and shipments of computers and peripherals posted robust gains over the same period."
36,"Shipments of communication equipment also rose in August and September, but orders were little changed on balance over the same period."
37,"Outside the technology sector, shipments of nondefense capital goods excluding aircraft increased at a solid rate over August and September but orders declined in August and were flat in September."
38,Sales of medium and heavy trucks leveled off in the third quarter after a sharp drop in the first half of the year.
39,Domestic outlays for aircraft likely stepped down somewhat in the third quarter.
40,Nonresidential building activity remained vigorous through August after having posted very strong gains in the second quarter; anecdotal evidence through early October indicated that the recent turbulence in commercial credit markets had done little to slow the pace of commercial construction.
41,"More generally, surveys of business conditions continued to point to further near-term gains in spending, although reports from business contacts indicated that some firms had marked down their capital spending plans."
42,Data on the book value of business inventories through August suggested that real nonfarm inventory investment excluding motor vehicles moved down in the third quarter after having risen at a moderate pace in the second quarter.
43,"The ratio of book-value inventories to sales in the manufacturing and trade sector excluding motor vehicles, which was available through August, remained well below the elevated values seen around the turn of the year."
44,"Purchasing managers, on average, viewed the level of their customers inventories as about right in September."
45,The U. S. international trade deficit narrowed in August as exports increased and imports decreased.
46,"Goods exports were boosted by a jump in exports of agricultural products and of gold, which more than offset a decline in exports of other goods."
47,Exports of automotive products fell back sharply after a surge in July.
48,"Exports of capital goods contracted slightly, led by a drop in aircraft exports."
49,"Exports of semiconductors declined, while exports of computers were about flat."
50,"On the import side, the decline was concentrated in goods; service imports were flat."
51,"Higher imports of oil and of capital goods, particularly computers and semiconductors, were more than offset by lower imports of automotive products, consumer goods, and industrial supplies excluding oil."
52,Indicators of economic activity in the third quarter for advanced foreign economies were solid on balance.
53,"In the euro area, production and sales picked up in the third quarter from their second-quarter levels."
54,"However, recent survey data, including the purchasing managers index for the service sector in the euro area, pointed to a possible slowing in the pace of growth."
55,"Likewise, notwithstanding a strong preliminary estimate of third-quarter GDP growth in the United Kingdom, more recent surveys pointed to some softening."
56,"Recent Canadian data were mixed, with relatively strong employment growth and some weakness in retail sales."
57,"In contrast, Japans retail sales and exports rebounded in August, and the October Tankan survey seemed to suggest that the second quarters sharp contraction in investment was temporary."
58,"In emerging-market economies, recent information, mostly through August, gave no signs that the turmoil in financial markets was having a significant negative effect on real economic activity."
59,"In emerging Asia, activity appeared to have remained robust, although growth slowed from its elevated second-quarter pace."
60,Economic indicators for Mexico pointed to moderate growth in the third quarter.
61,"In South America, activity was strong, boosted by high prices for commodities and, in Argentina and Venezuela, by expansionary macroeconomic policies."
62,"Food prices continued to be a major source of inflationary pressures in emerging-market economies, and Chinese authorities took several steps aimed at quelling rising prices."
63,"After having risen rapidly in the first half of the year, headline consumer prices decelerated considerably over the summer, largely because of a fall in energy prices."
64,"Over September and October, gasoline prices appeared to have risen only moderately despite a jump in crude oil costs."
65,Consumer food prices posted further sizable increases in August and September and continued to run well above the change in core prices.
66,"Core consumer price inflation remained moderate in August and September and, on a twelve-month change basis, was down noticeably from a year earlier."
67,"Core goods prices fell over the year ending in September after having risen little over the preceding year; noticeable decelerations occurred in the prices of apparel, prescription drugs, and motor vehicles."
68,"In addition, increases in owners equivalent rent slowed noticeably, while rent inflation remained about the same as a year earlier."
69,The producer price index for core intermediate materials edged up in September.
70,"The twelve-month change in that index stepped down considerably from last year, in part because of softer prices for a variety of energy-intensive and construction-related items."
71,"Household surveys indicated that median year-ahead inflation expectations inched down in September and October to about the level observed in the first quarter, and longer-term inflation expectations slipped to their lowest level in two years."
72,Average hourly earnings posted a moderate increase over the twelve months ending in September.
73,"At its September meeting, the FOMC lowered its target for the federal funds rate 50 basis points, to 4-3/4 percent."
74,"The Board of Governors also approved a 50 basis point decrease in the discount rate, to 5-1/4 percent, leaving the gap between the federal funds rate target and the discount rate at 50 basis points."
75,"The Committees statement noted that, while economic growth had been moderate during the first half of the year, the tightening of credit conditions had the potential to intensify the housing correction and to restrain economic growth more generally."
76,The Committee indicated that its action was intended to help forestall some of the adverse effects on the broader economy that could otherwise arise from the disruptions in financial markets and to promote moderate growth over time.
77,"Readings on core inflation had improved modestly during the year, but the Committee judged that some inflation risks remained, and the Committee planned to continue to monitor inflation developments carefully."
78,The Committee further noted that developments in financial markets since the last regular FOMC meeting had increased the uncertainty surrounding the economic outlook.
79,"Accordingly, the Committee would continue to assess the effects of these and other developments on economic prospects and remained ready to act as needed to foster price stability and sustainable economic growth."
80,"The expected path for monetary policy as inferred from futures markets declined in the wake of the September policy action, as many investors were surprised by the magnitude of the reduction in the target rate."
81,"Over the intermeeting period, many investors came to expect that the Committee would reduce the target federal funds rate at its October meeting; in addition, the anticipated policy path further ahead moved down a bit more, on net, over the remainder of the intermeeting period, apparently in response to heightened concerns among investors about economic growth."
82,"Early in the intermeeting period, the functioning of short-term funding markets improved somewhat, but conditions in these markets remained strained."
83,"The effective federal funds rate was very close to the target, on average, but the average absolute daily deviation of the effective rate from the target and the intraday standard deviation remained elevated."
84,Credit spreads declined in the commercial paper and term interbank funding markets but stayed well above longer-term norms.
85,Liquidity in the Treasury bill market was poor at times.
86,"Corporate bond spreads narrowed somewhat, leaving private yields a little lower."
87,Nonfinancial bond issuance was robust; speculative-grade offerings increased markedly.
88,"The credit quality of most households remained strong, but delinquency rates on subprime mortgages climbed further."
89,"Securitization of nonconforming mortgages remained limited, and spreads on jumbo mortgages relative to conforming mortgages stayed high."
90,"Two-year Treasury yields declined roughly in line with the lower expected policy path, while yields on ten-year Treasuries were little changed, on net."
91,TIPS-based inflation compensation was about unchanged on balance over the intermeeting period despite a sharp rise in spot oil prices.
92,"Stock prices jumped early in the intermeeting period in response to the cut in the target federal funds rate and some favorable economic news but later dropped back, leaving broad indexes up only a bit on net."
93,The foreign exchange value of the dollar against other major currencies declined notably.
94,Debt of the domestic nonfinancial sectors was estimated to have expanded slightly more quickly in the third quarter than in the previous quarter.
95,"Despite evidence that bank lending standards and terms had tightened over the previous three months, business debt was still rising strongly, reflecting a continued surge in commercial and industrial (C&I) lending by banks and robust issuance of investment-grade bonds."
96,The expansion of business loans was apparently due in part to financings for leveraged buyouts that underwriters could not syndicate to institutional investors.
97,Household mortgage borrowing was estimated to have decelerated again in the third quarter.
98,"M2 increased significantly more slowly in September and October than the rapid pace observed in August, when the financial market turmoil apparently drove investors to the safety of M2 assets."
99,Inflows to retail money market funds and small time deposits were especially strong in September and October; small time deposits were apparently boosted by the attractive rates that banks were offering in order to help fund their expanding loan portfolios.
100,"In the forecast prepared for this meeting, which was formulated prior to the release of the advance estimates of the third-quarter national income and product accounts, the staff revised up its estimate of aggregate economic activity in the third quarter from its forecast presented at the September meeting in light of available indicators that suggested that consumer spending, business investment, and exports were stronger than previously expected."
101,"Nonetheless, the staff expected real GDP growth to be considerably slower in the fourth quarter, reflecting steepening declines in residential construction, reductions in the pace of motor vehicle production, and a smaller contribution from net exports."
102,"Looking forward, the staff expected residential investment to remain weak in 2008 with modest declines in house prices."
103,"In addition, the staff continued to expect the stress in credit markets and the appreciably higher oil prices indicated by futures markets to restrain spending by businesses and consumers, although the lower foreign exchange value of the dollar suggested some boost to net exports."
104,"On balance, real GDP growth for 2008 was projected to slow to a pace a bit below that of its potential, and unemployment was expected to creep up slightly."
105,"For 2009, the forecast called for real output growth to step up to a pace slightly above potential as the drags on economic activity exerted by the contraction in residential investment and financial strains were expected to abate."
106,The staffs forecast for core PCE inflation was little changed from that presented at the September meeting because favorable incoming figures on core PCE inflation were offset by expectations for some limited feed-through into retail prices of recent increases in energy prices and for slightly less easing in resource utilization.
107,"The forecast for headline inflation was in the same range as that for core inflation in 2008 and 2009, reflecting expectations that energy prices would level off and then turn down and that increases in food prices would slow to a pace more in line with core inflation."
108,"The advance data on the national income and product accounts for the third quarter, which were released on the morning of the second day of the FOMC meeting, indicated a stronger increase in real GDP than the staff had forecast, mostly because inventory investment was estimated to be higher than projected by the staff."
109,"The staff interpreted this information as suggesting some upward revision to its estimate of output growth in the third quarter, a small downward revision to its forecast of growth in the current quarter, and no significant change to its forecast for coming quarters."
110,"In conjunction with the FOMC meeting in October, all meeting participants (Federal Reserve Board members and Reserve Bank presidents) provided annual projections for economic growth, unemployment, and inflation for the period 2007 through 2010."
111,"The projections are described in the Summary of Economic Projections, which is attached as an addendum to these minutes."
112,"In their discussion of the economic outlook and situation, and in the projections that they had submitted for this meeting, participants noted that economic activity had expanded at a somewhat faster pace in the third quarter than previously anticipated and that there was scant evidence of negative spillovers from the ongoing housing correction to other sectors of the economy."
113,"Conditions in financial markets had improved since the September FOMC meeting, but functioning in a number of markets remained strained."
114,"Even with some further easing of monetary policy, participants expected economic growth to slow over the next few quarters, reflecting continued sharp declines in the housing sector and tighter lending standards and terms across a broad range of credit products."
115,"The slowing of growth was likely to produce a modest increase in the unemployment rate from its recent levels, leading to the emergence of a little slack in labor markets."
116,"Looking further ahead, participants noted that economic growth should increase gradually to around its trend rate by 2009 as weakness in the housing sector abated and stresses in financial markets subsided."
117,"With aggregate demand showing somewhat greater than expected strength in the third quarter and little evidence of significant spillovers from the housing sector to other components of spending, participants viewed the downside risks to growth as somewhat smaller than at the time of the September meeting, but those risks were still seen as significant."
118,"Participants generally expected that inflation would edge down over the next few years, a projection consistent with the recent string of encouraging releases on core consumer prices, futures prices pointing to a flattening of energy costs, and the anticipated easing of pressures on resources."
119,"Nonetheless, some upside risks to inflation remained, reflecting in part the potential feed-through to inflation expectations of increases in energy and import prices."
120,"Financial market functioning was judged to have improved somewhat since the previous FOMC meeting, but the situation in a number of markets remained strained, and credit market conditions were thought likely to weigh on economic growth over coming quarters."
121,"In light of some improvement in the commercial paper and leveraged loan markets over the intermeeting period, participants were somewhat less concerned that banks would not have sufficient balance-sheet capacity to absorb large volumes of assets."
122,"Conditions in corporate credit markets also had improved in recent weeks, and most businesses were apparently having little difficulty raising external funds, as evidenced by strong issuance of investment-grade corporate bonds, a pickup in speculative-grade issuance, and surging C&I loans."
123,"Markets for nonconforming mortgages, by contrast, remained disrupted."
124,"Meeting participants also mentioned that while financial market conditions had improved, the functioning of some markets remained somewhat impaired."
125,"Indeed, several participants noted some relapse in financial conditions late in the intermeeting period."
126,"Moreover, unusual pressures in funding markets persisted."
127,Participants generally viewed financial markets as still fragile and were concerned that an adverse shock--such as a sharp deterioration in credit quality or disclosure of unusually large and unanticipated losses--could further dent investor confidence and significantly increase the downside risks to the economy.
128,Participants were also concerned about a potential scenario in which unexpected economic weakness could cause a further tightening of credit conditions that could in turn reinforce weakness in aggregate demand.
129,"In their discussion of individual sectors of the economy, participants noted that the recent declines in housing activity--while substantial--had largely been anticipated."
130,"Nonetheless, the potential for significant further weakening in housing activity and home prices represented a downside risk to the economic outlook."
131,"Most participants pointed to the deterioration in nonprime mortgage markets as well as higher interest rates and tighter credit standards for prime nonconforming mortgages as factors that had exacerbated the deterioration in housing markets, and they noted that these developments could further limit the availability of mortgage credit and depress the demand for housing."
132,"Some participants also pointed to downside risks to the housing market stemming from the large volume of substantial upward interest-rate resets that were likely on subprime mortgages in coming quarters, which could lead to a faster pace of foreclosures in the near term, thereby intensifying the downward pressure on house prices."
133,Participants generally agreed that the available data suggested that consumer spending had been well maintained over the past several months and that spillovers from the strains in the housing market had apparently been quite limited to date.
134,"Nevertheless, a number of participants cited notable declines in survey measures of consumer confidence since the onset of financial turbulence in mid-summer, along with sharply higher oil prices, declines in house prices, and tighter underwriting standards for home equity loans and some types of consumer loans, as factors likely to restrain consumer spending going forward."
135,"Moreover, anecdotal reports by business contacts suggested a softening in retail sales in some regions of the country."
136,"Participants expressed a concern that larger-than-expected declines in house prices could further sap consumer confidence as well as net worth, causing a pullback in consumer spending."
137,"All told, however, participants envisioned that the most likely scenario was for consumer spending to continue to advance at a moderate rate in coming quarters, supported by the generally strong labor market and further gains in real personal income."
138,Meeting participants noted that capital expenditures had grown at a solid pace in recent months and that the financial turmoil generally appeared to have had a limited effect on business capital spending plans to date.
139,"Nevertheless, business sentiment appeared to have eroded somewhat amid heightened economic and financial uncertainty, potentially restraining investment outlays in some industries."
140,"However, participants noted that conditions in corporate bond markets had improved since the September FOMC meeting, and that credit availability generally appeared to be ample, albeit on somewhat tighter terms."
141,Participants judged that moderate growth of investment outlays going forward was the most likely outcome.
142,"A number of participants saw downside risk to the outlook for nonresidential building activity, reflecting elevated spreads on commercial-mortgage-backed securities and a further tightening of banks lending standards for commercial real estate loans."
143,"Data on economic growth outside the United States indicated that the global expansion, though likely to slow somewhat in coming quarters, was nevertheless on a firm footing."
144,The continued strength of global growth and the recent decline in the foreign exchange value of the dollar were seen as likely to support U. S. exports going forward.
145,"Readings on core inflation received during the intermeeting period continued to be generally favorable, and meeting participants agreed that the recent moderation in core inflation would likely be sustained."
146,The slower pace of economic expansion anticipated for the next few quarters would help ease inflationary pressures.
