,sentence
147,"Nonetheless, participants expressed concern about the upside risks to the outlook for inflation."
148,"The recent increases in the prices of energy and other commodities, along with the significant decline in the foreign exchange value of the dollar, were cited as factors that could exert upward pressure on prices of some core goods and services in the near term."
149,Increases in unit labor costs also could add to inflationary pressures.
150,"Moreover, participants expressed concern that some measures of inflation compensation calculated from TIPS securities had risen this year, although they viewed inflation expectations generally as remaining contained."
151,"Participants were concerned that if headline inflation remained above core measures for a sustained period, then longer-term inflation expectations could move higher, a development that could lead to greater inflation pressures over the longer term and be costly to reverse."
152,"In the Committees discussion of policy for the intermeeting period, members discussed the relative merits of lowering the target federal funds rate 25 basis points, to 4-1/2 percent, at this meeting or awaiting additional information on prospects for economic activity and inflation before assessing whether a further adjustment in the stance of monetary policy was necessary."
153,Many members noted that this policy decision was a close call.
154,"However, on balance, nearly all members supported a 25 basis point reduction in the target federal funds rate."
155,"The stance of monetary policy appeared still to be somewhat restrictive, partly because of the effects of tighter credit conditions on aggregate demand."
156,"Moreover, most members saw substantial downside risks to the economic outlook and judged that a rate reduction at this meeting would provide valuable additional insurance against an unexpectedly severe weakening in economic activity."
157,"Many members were concerned about the still-sensitive state of financial markets and thought that an easing of policy would help to support improvements in market functioning, thereby mitigating some of the downside risks to economic growth."
158,"With real GDP likely to expand below its potential over coming quarters, recent price trends favorable, and inflation expectations appearing reasonably well anchored, the easing of policy at this meeting seemed unlikely to affect adversely the outlook for inflation."
159,A number of members noted that the recent policy moves could readily be reversed if circumstances evolved in a manner that would warrant such action.
160,The Committee agreed that the statement to be released at this meeting should indicate that economic growth was solid in the third quarter and that strains in financial markets had eased somewhat on balance.
161,"Members also agreed that economic growth seemed likely to slow over coming quarters, but that the easing action taken at the meeting--combined with the 50 basis point cut in the target federal funds rate at the September meeting--should help to promote moderate growth over time, although some downside risks to growth would remain."
162,"Members felt that it was appropriate to underscore the upside risks to inflation stemming from the recent increases in the prices of energy and other commodities, even though recent readings on core inflation had been favorable."
163,"While the Committee saw uncertainty regarding the economic outlook as still elevated, it judged that, after this action, the upside risks to inflation roughly balanced the downside risks to growth."
164,"At the conclusion of the discussion, the Committee voted to authorize and direct the Federal Reserve Bank of New York, until it was instructed otherwise, to execute transactions in the System Account in accordance with the following domestic policy directive: The Federal Open Market Committee seeks monetary and financial conditions that will foster price stability and promote sustainable growth in output."
165,"To further its long-run objectives, the Committee in the immediate future seeks conditions in reserve markets consistent with reducing the federal funds rate to an average of around 4-1/2 percent."
166, The vote encompassed approval of the statement below to be released at 2:15 p. m. : The Federal Open Market Committee decided today to lower its target for the Federal funds rate 25 basis points to 4-1/2 percent.
167,"Economic growth was solid in the third quarter, and strains in financial markets have eased somewhat on balance."
168,"However, the pace of economic expansion will likely slow in the near term, partly reflecting the intensification of the housing correction."
169,"Todays action, combined with the policy action taken in September, should help forestall some of the adverse effects on the broader economy that might otherwise arise from the disruptions in financial markets and promote moderate growth over time."
170,"Readings on core inflation have improved modestly this year, but recent increases in energy and commodity prices, among other factors, may put renewed upward pressure on inflation."
171,"In this context, the Committee judges that some inflation risks remain, and it will continue to monitor inflation developments carefully."
172,"The Committee judges that, after this action, the upside risks to inflation roughly balance the downside risks to growth."
173,The Committee will continue to assess the effects of financial and other developments on economic prospects and will act as needed to foster price stability and sustainable economic growth.
174," Votes for this action: Messrs. Bernanke, Geithner, Evans, Kohn, Kroszner, Mishkin, Poole, Rosengren, and Warsh."
175,Votes against this action: Mr. Hoenig.
176,Mr. Hoenig dissented because he believed that policy should remain unchanged at this meeting.
177,Projections for the U. S. and global economies suggested that growth was likely to proceed at a reasonable pace over the outlook period.
178,"To better assure that outcome, the FOMC had moved rates down significantly at its September meeting."
179,"At this meeting, inflation risks appeared elevated and Mr. Hoenig felt that the target federal funds rate was currently close to neutral."
180,"In these circumstances, he judged that policy needed to be slightly firm to better hold inflation in check."
181,"Going forward, if the data suggested the Committee needed to ease further, it could do so."
182,He also recognized that liquidity remains a near-term challenge and that the Federal Reserve would be prepared to act if needed.
183,"Mr. Hoenig saw the risks to both economic growth and inflation to be elevated and preferred to wait, watch, and be ready to act depending on how events developed."
184,The Committee then resumed its discussion of an enhanced role for the economic projections that are made periodically by the members of the Board of Governors and the Reserve Bank presidents.
185,"At this meeting, participants reached a consensus on increasing the frequency and expanding the content of the projections that in the past have been released to the public in summary form twice a year."
186,They agreed to publish with the minutes a summary of participants economic projections made for this meeting and to release a press statement describing the plan for the future.
187,The release of more frequent forecasts covering longer time spans and accompanied by explanations of those forecasts was seen as providing the public with more context for understanding the Committees monetary policy decisions.
188,"It was agreed that the next meeting of the Committee would be held on Tuesday, December 11, 2007."
189,The meeting
