,sentence
161,"Indeed, it was noted that, with elevated inflation still a concern and growth expected to pick up next year if financial strains diminish, the Committee should also remain prepared to reverse the policy easing put in place over the past year in a timely fashion."
162,"At the conclusion of the discussion, the Committee voted to authorize and direct the Federal Reserve Bank of New York, until it was instructed otherwise, to execute transactions in the System Account in accordance with the following domestic policy directive: ""The Federal Open Market Committee seeks monetary and financial conditions that will foster price stability and promote sustainable growth in output."
163,"To further its long-run objectives, the Committee in the immediate future seeks conditions in reserve markets consistent with maintaining the federal funds rate at an average of around 2 percent. """
164,"The vote encompassed approval of the statement below to be released at 2:15 p. m. : ""The Federal Open Market Committee decided today to keep its target for the federal funds rate at 2 percent."
165,Strains in financial markets have increased significantly and labor markets have weakened further.
166,"Economic growth appears to have slowed recently, partly reflecting a softening of household spending."
167,"Tight credit conditions, the ongoing housing contraction, and some slowing in export growth are likely to weigh on economic growth over the next few quarters."
168,"Over time, the substantial easing of monetary policy, combined with ongoing measures to foster market liquidity, should help to promote moderate economic growth."
169,"Inflation has been high, spurred by the earlier increases in the prices of energy and some other commodities."
170,"The Committee expects inflation to moderate later this year and next year, but the inflation outlook remains highly uncertain."
171,The downside risks to growth and the upside risks to inflation are both of significant concern to the Committee.
172,"The Committee will monitor economic and financial developments carefully and will act as needed to promote sustainable economic growth and price stability. """
173,"Votes for this action: Mr. Bernanke, Mses."
174,"Cumming and Duke, Messrs. Fisher, Kohn, and Kroszner, Ms. Pianalto, Messrs. Plosser, Stern, and Warsh."
175,Votes against this action: None.
176,Ms. Cumming voted as the alternate for Mr. Geithner.
177,"It was agreed that the next meeting of the Committee would be held on Tuesday-Wednesday, October 28-29, 2008."
178,The meeting
