,sentence
0, reported on recent developments in domestic and foreign financial markets.
1,"The Manager also reported on System open market operations in Treasury securities, agency debt, and agency mortgage-backed securities (MBS) since the Committee's August 11-12 meeting."
2,"By unanimous vote, the Committee ratified those transactions."
3,There were no open market operations in foreign currencies for the System's account during the intermeeting period.
4,"Since the Committee met in August, the Federal Reserve's total assets had risen about $125 billion, on balance, to approximately $2."
5,"1 trillion, as the System's purchases of securities exceeded a further decline in usage of the System's credit and liquidity facilities."
6,The staff briefed the Committee on the current status of the asset purchase programs.
7,Participants noted that the primary influence of the programs is likely through the cumulative effect that they generate on the publicly available stocks of securities.
8,"However, they also observed that the rate of new purchases could have an effect on asset prices, especially of MBS."
9,"Given this possibility, participants remarked that a gradual reduction in the pace at which the Federal Reserve buys agency debt and agency MBS could help promote a smooth transition in markets as the announced asset purchases are completed."
10,Participants observed that such a strategy would be similar to the approach adopted in August for the purchases of Treasury securities and generally viewed it as a useful step to mitigate the risk of a sharp change in yields as purchases end.
11,Participants expressed a range of views about the rate at which asset purchases should be slowed.
12,"Some suggested tapering quickly and completing the purchases by year-end, while a few preferred slowing the rate of purchases over a longer period in order to maintain flexibility regarding the pace and the cumulative amount purchased and thus potentially better calibrate the programs to evolving economic and financial market conditions."
13,Most participants supported extending purchases of agency debt and agency MBS through the first quarter of 2010.
14,The staff also briefed the Committee on the likely implications of very high reserve balances for bank balance sheet management and for the economy.
15,"The staff's assessment, based in part on consultations with market participants, was that many banks were currently comfortable holding high levels of reserves as a means of managing liquidity risks, and these balances or further increases along the lines implied by the announced programs were not likely to crowd out other lending through pressures on capital positions."
16,"As the economy improves, however, banks could seek to lower their levels of reserve balances by purchasing securities, thereby putting downward pressure on market interest rates, or by easing their credit standards and terms in order to expand lending."
17,"Such effects, if significant, would provide further impetus to economic growth."
18,The staff analysis indicated that these effects would likely emerge only gradually and that their magnitude could be quite limited.
19,"However, some participants thought that declining demand for reserves might already be putting downward pressure on yields."
20,"Participants expressed a range of views about the likely stimulative effect of a further expansion of reserve balances on economic activity, as well as the potential impact of elevated reserves on inflation expectations."
21,"Some meeting participants noted that the announced decrease in the balance in the Treasury's Supplementary Financing Account (SFA) would increase reserves in the banking system unless it were offset by Federal Reserve actions or by a further reduction in borrowing from the Federal Reserve's various credit and liquidity facilities, and that these increases could be expansionary."
22,"Others noted that the decrease in the SFA could well be temporary and, in any event, that the macroeconomic effects of the increase in reserves would probably be limited in the current environment."
23,The staff presented an update on the continuing development of several tools that could help support a smooth withdrawal of policy accommodation at the appropriate time.
24,"These measures included executing reverse repurchase agreements on a large scale, potentially with counterparties other than the primary dealers; implementing a term deposit facility, available to depository institutions, to reduce the supply of reserve balances; and taking steps to tighten the link between the interest rate paid on reserve balances held at the Federal Reserve Banks and the federal funds rate."
25,"Participants expressed confidence that these tools, along with the payment of interest on reserves and possible sales of assets from the System's portfolio, would allow them to remove policy accommodation at the appropriate time and pace."
26,Completing development of these tools would remain a top priority of the Federal Reserve.
27,The staff presented proposed schedules for operations under the Term Auction Facility (TAF) and Term Securities Lending Facility (TSLF) through January 2010.
28,"As conditions in short-term funding markets had continued to improve, usage of these facilities had diminished."
29,"The proposed schedules were consistent with not only the Federal Reserve's previously announced intention to gradually scale back these facilities in response to continued improvements in financial market conditions, but also with a desire to assure market participants that the Federal Reserve will provide sufficient liquidity over year-end."
30,There was general agreement that the Federal Reserve should assess over the next several months whether to maintain a TAF on a permanent basis.
31,"Secretary's note: On September 24, 2009, the Federal Reserve announced schedules for operations under the TAF and the TSLF through January 2010 and indicated that it would seek public comment on a proposal for a permanent TAF."
32,Staff Review of the Economic SituationThe information reviewed at the September 22-23 meeting suggested that overall economic activity was beginning to pick up.
33,"Factory output, particularly motor vehicle production, rose in July and August."
34,"Consumer spending on motor vehicles during that period was boosted by government rebates and greater dealer incentives, and household spending outside of motor vehicles appeared to rise in August after having been roughly flat from May through July."
35,"Although employment continued to contract in August, the pace of job losses slowed noticeably from that of earlier in the year."
36,Investment in equipment and software (E&S) also seemed to be stabilizing.
37,"Sales and construction of single-family homes during July and August, while still at low levels, were significantly above the readings at the beginning of the year."
38,"The sharp cuts in production this year reduced inventory stocks significantly, though they remained elevated relative to the recent level of sales."
39,"Core consumer price inflation continued to be subdued in July and August, but higher gasoline prices raised overall consumer price inflation in August."
40,"Firms continued to reduce payrolls, but job losses abated further in August, with the decline in private payroll employment the smallest since that of August 2008."
41,"Although employment losses continued to be widespread, the rate of decline diminished in most industries."
42,"The length of the average workweek for production and nonsupervisory workers remained steady, albeit at a low level, and the rate of decline in aggregate hours for this group over July and August was the smallest of the past year."
43,"In the household survey, although the unemployment rate rose in August to 9."
44,"7 percent, the rise in the unemployment rate slowed, on net, in recent months from its pace earlier in the year."
45,The labor force participation rate in August remained at the low level that had prevailed through much of the year.
46,"Continuing claims for unemployment insurance through regular state programs fell slightly, on balance, from its earlier peak, but the total including extended and emergency benefits stayed near its recent high level."
47,Initial claims for unemployment insurance fluctuated within a narrow range that was consistent with further declines in employment.
48,"With labor markets still weak, the year-over-year increase in average hourly earnings of production and nonsupervisory workers slowed further in August, even with the higher federal minimum wage that went into effect at the end of July."
49,"Industrial production rose in July and August, led by a rebound in motor vehicle production from the extraordinarily low assembly rates in the first half of the year."
50,"Manufacturing production outside of motor vehicles increased solidly, likely reflecting stronger demand for materials from the motor vehicle sector and a slower pace of inventory liquidation elsewhere."
51,Business survey indicators suggested further gains in factory output over the near term.
52,"Nevertheless, the factory utilization rate in August was only modestly above its recent historical low."
53,"Real personal consumption expenditures increased modestly in July, led by a strong advance in motor vehicle purchases, which were boosted appreciably by the government's ""cash-for-clunkers"" program."
54,This program contributed to a further surge in motor vehicle sales in August to their highest level since the first half of 2008.
55,"After declining in July, sales at retailers, excluding those at motor vehicle dealers, building materials stores, and gasoline stations, rose significantly in August, suggesting an increase in real consumer expenditures on non-motor-vehicle goods for the month."
56,"Even so, many determinants of spending continued to be tepid."
57,"In particular, the weak labor market continued to restrain growth in household income, and the prior declines in household net worth probably continued to weigh on spending."
58,"However, an increase in household net worth since March, a rise in nominal labor compensation in July, and increases in various measures of consumer sentiment indicated some improvement in the outlook for consumer spending."
59,Data from the housing sector indicated that a gradual recovery in activity was under way.
60,"Although single-family housing starts fell modestly in August, this decrease followed five consecutive monthly increases, and the number of starts in August was well above the record low reached in the first quarter of the year."
61,"In contrast, in the much smaller multifamily sector, where credit conditions were still particularly tight and vacancy rates remained high, starts continued to be down, on net, in 2009 after a significant fall in the second half of 2008."
62,The sales data for July indicated further increases in the demand for both new and existing single-family homes.
63,"Even though new home sales remained modest, they had been sufficient, given the slow pace of construction, to pare the overhang of unsold new single-family houses: In July, the level of inventories of such homes was about one-half of its peak in the summer of 2006, and the months' supply had fallen considerably from its record high in January."
64,"Sales of existing homes in July were at their fastest pace since mid-2007, and pending home sales agreements suggested that resale activity would rise further in following months."
65,"Although sales of distressed properties remained elevated, the rise in total sales of existing homes over the summer appeared to have been driven by an increase in transactions involving nondistressed properties."
66,"The apparent modest strengthening of housing demand was likely due, in part, to improvements in housing affordability stemming from low interest rates for conforming mortgages, a lower level of house prices, and possibly the first-time homebuyer tax credit."
67,"In addition, demand may have been buoyed by a sense that house prices were beginning to stabilize."
68,"Through the end of the second quarter, many house price indexes had smaller year-over-year declines than they had shown earlier this year, and some indexes recorded positive changes for the second quarter."
69,Real spending on E&S appeared to be stabilizing after falling sharply for more than a year.
70,Business purchases of transportation equipment seemed to be expanding solidly in the third quarter.
71,"Nominal shipments and orders for high-tech equipment in July were significantly above their second-quarter averages; moreover, a few major producers of high-tech equipment reported some signs of improvement in demand."
72,Business investment in equipment other than high tech and transportation showed tentative signs of stabilization.
73,"Some forward-looking indicators of investment in E&S improved, suggesting that conditions had become less adverse than earlier in the year."
74,"Monthly surveys of business conditions and sentiment recently recovered to levels consistent with a modest rise in business spending, and corporate bond spreads over Treasury securities narrowed further."
75,"In contrast, conditions in the nonresidential construction sector generally remained quite poor, and measures of construction spending excluding energy-related projects stayed on a downward trajectory through July."
76,"Vacancy rates continued to rise, property prices fell further, and financing for nonresidential construction projects remained very tight."
77,"The nominal book value of businesses inventories continued to fall in July, which contributed to further declines in inventory-to-sales ratios; however, those ratios stayed elevated."
78,"After narrowing to a 10-year low in May, the U. S. international trade deficit widened in June and July, as strong increases in exports were more than offset by sizable rises in imports."
79,The July trade data provided additional evidence that the levels of both exports and imports probably reached their trough in the second quarter.
80,About one-half of the increase in exports of goods and services in July was in exports of automotive products; the other gains were widespread across other major categories of exports.
81,"As with exports, the largest increase in imports of goods and services in July was in automotive products, reflecting some recovery in North American motor vehicle production."
82,"Imports of consumer goods, capital goods, and industrial supplies also rose markedly."
83,"Imports of oil increased more moderately, with the rise wholly reflecting higher prices."
84,"Real gross domestic product (GDP) in the advanced foreign economies contracted more moderately in the second quarter than in the first quarter, with growth resuming in several countries."
85,"In Japan, a trade-related rebound in industrial production led to an increase in overall output."
86,"Government incentives for motor vehicle purchases contributed to a modest expansion of the German and French economies, but the euro-area economy as a whole contracted slightly as inventory drawdowns weighed on activity."
87,Output also fell in Canada and the United Kingdom.
88,"Purchasing managers indexes (PMIs) rose further in the major economies during the intermeeting period, and reached levels consistent with stabilization or moderate expansion of output in the third quarter."
89,"Indicators of consumer sentiment continued to increase, but remained well below pre-recession levels, in part because of concerns about rising unemployment."
90,"In most emerging market economies, particularly in Asia, economic activity rebounded in the second quarter; however, output declined again in Mexico."
91,"Indicators of activity in the third quarter pointed to a continued expansion of output in most emerging market countries, and PMIs moved into the expansionary range in many of them."
92,"International trade in emerging market economies picked up, supported by Chinese demand, while demand from advanced economies still appeared weak."
93,"In the United States, core consumer price inflation remained subdued in July and August, as price increases in housing services moderated and durable goods prices declined."
94,"Overall consumer price inflation increased in August, boosted by a sharp upturn in energy prices, particularly those of gasoline."
95,The latest available survey data indicated that gasoline prices edged up further in the first half of September.
96,Consumer food prices were little changed in August.
97,"According to the preliminary September release of the Reuters/University of Michigan Surveys of Consumers, median year-ahead inflation expectations decreased modestly in the first half of September, but remained somewhat above the low levels posted at the beginning of the year."
98,Longer-term inflation expectations from this survey stayed in the narrow range that has prevailed over recent years.
99,"The producer price index for core intermediate materials rose in August, its third consecutive monthly increase; over those three months, the index retraced about one-third of the decline of the previous eight months."
100,All measures of nominal hourly compensation and wages suggested that labor costs had decelerated markedly this year amid the considerable weakness in labor markets.
101,"Staff Review of the Financial SituationThe decisions by the Federal Open Market Committee (FOMC) at the August meeting to leave the target range for the federal funds rate unchanged and to maintain the maximum sizes of its large-scale asset purchase programs, along with the accompanying statement, were broadly in line with market expectations."
102,The announcement in the statement of the decision to slow the pace of Treasury securities purchases so that the full amount of $300 billion would be completed by the end of October reduced uncertainty about the timing of the end of this program and the ultimate amount of purchases.
103,"After the release of the statement, the expected path for the federal funds rate implied by money market futures prices declined modestly."
104,"Subsequently, the expected policy path shifted down further, on net, as investors apparently interpreted weak labor market conditions and generally quiescent inflation as consistent with an outlook that would lead the FOMC to maintain low policy rates over the medium term."
105,"In addition, investors' uncertainty about the future policy rate path appeared to diminish, which may have also contributed to the lowering of the path implied by futures prices by reducing term premiums."
106,Yields on nominal Treasury securities also decreased since the Committee met in August.
107,A decline in implied volatility on longer-term Treasury yields suggested that some of the drop in yields was due to reduced risk premiums.
108,"Inflation compensation based on five-year Treasury inflation-protected securities (TIPS) increased a little, on balance, over the intermeeting period, while five-year inflation compensation five years ahead declined modestly; the decrease in forward inflation compensation partially reversed increases in prior intermeeting periods."
109,"Liquidity in the TIPS market reportedly continued to be poor, complicating inferences about investors' expectations of future inflation."
110,Conditions in short-term funding markets showed modest further improvement over the intermeeting period.
111,Spreads between London interbank offered rates (Libor) and overnight index swaps (OIS) at the one- and three-month maturities returned to near the levels that prevailed before the onset of the financial crisis in August 2007.
112,"Longer-term Libor-OIS spreads also narrowed, but they remained high by historical standards."
113,Reports continued to suggest that lending institutions were unusually selective about their counterparties in funding markets.
114,"Spreads on A2/P2-rated commercial paper and AA-rated asset-backed commercial paper were little changed, on net, remaining at the low end of their ranges over the past two years."
115,"Indicators of Treasury market functioning showed no material change, and functioning continued to be somewhat impaired."
116,"Bid-asked spreads held roughly steady, and trading volumes remained low."
117,"The on-the-run liquidity premium for the 10-year Treasury note was little changed at an elevated level, although it was well below its peak last fall; the premiums on two- and five-year Treasury securities stayed low."
118,"Amid lower interest rates as well as further indications that the contraction in economic activity may have ended, broad stock price indexes rose, on net, over the intermeeting period."
119,The spread between an estimate of the expected real equity return over the next 10 years for S&P 500 firms and an estimate of the real 10-year Treasury yield--a rough gauge of the equity risk premium--remained high by historical standards.
120,"After having dropped significantly in prior months, option-implied volatility on the S&P 500 index declined modestly, on balance, over the intermeeting period, but was still at a level comparable with that of previous recessions."
121,Yields on corporate bonds fell a bit more than those on Treasury securities of similar duration.
122,Indicators suggested that liquidity in the secondary market for corporate bonds increased a bit further.
123,"Conditions in the secondary market for leveraged syndicated loans continued to improve slowly, as secondary-market prices rose slightly and bid-asked spreads narrowed."
124,Changes in investor sentiment toward claims on financial firms were mixed over the intermeeting period.
125,"Equity prices for larger banks increased, but stock prices for regional and smaller banks were little changed."
126,Market participants reportedly took note of the increased number of failures at regional and smaller banks and remained concerned about the credit quality of such banks' loan portfolios and their ability to raise capital.
127,"Credit default swap spreads for banking institutions changed little, on net, over the intermeeting period."
128,A number of financial institutions issued debt that was not guaranteed by the Federal Deposit Insurance Corporation.
129,"The level of debt of the private domestic nonfinancial sector declined again in the second quarter, as both household and nonfinancial business debt fell."
130,Consumer credit posted its sixth consecutive monthly decline in July; both revolving and nonrevolving credit showed sizable drops.
131,"While issuance of consumer credit asset-backed securities decreased in August, a large volume of securities eligible for the Term Asset-Backed Securities Loan Facility was issued in early September."
132,Gross bond issuance by nonfinancial corporations rose in August following a lull in July; the rebound was particularly robust for speculative-grade firms.
133,"However, commercial paper outstanding was unchanged and bank loans fell again; as a result, borrowing by the nonfinancial business sector declined, on net, again in August."
134,"In contrast, the federal government continued to issue debt at a rapid pace, and gross issuance of state and local government debt was robust, supported in part by issuance of Build America Bonds authorized under the fiscal stimulus program."
135,Commercial bank credit contracted further in August; all major loan categories declined.
136,Commercial and industrial (C&I) lending again decreased steeply amid reported broad-based paydowns of outstanding loans.
137,"At the same time, the latest Survey of Terms of Business Lending showed that C&I loan spreads over comparable-maturity market instruments rose noticeably in recent months."
138,The contraction of commercial real estate loans held by banks also intensified in August.
139,"Even though originations of residential mortgages apparently increased during August, banks sold an unusually large volume of loans to the government-sponsored enterprises; consequently, banks' balance sheet holdings of residential mortgages decreased markedly."
140,"After declining in July, M2 contracted more quickly in August."
141,"The reduced demand for M2 assets likely reflected low interest rates on retail deposits and money market mutual fund shares, as well as a continued reallocation of wealth toward riskier assets."
142,Small time deposits and retail money market mutual funds fell more sharply in August than earlier in the year.
143,"Liquid deposits increased in August, but at a slower rate than in July."
144,"Currency expanded less rapidly in July and August than in the first half of the year, as demand from abroad evidently was restrained."
145,Global financial markets showed some further signs of stabilization over the intermeeting period.
146,"Stock indexes in Europe rose solidly, apparently reflecting an improved economic outlook, but the Japanese stock market declined modestly."
147,"In emerging markets, credit default swap spreads on sovereign debt declined slightly, and equity prices in most countries rose moderately; however, stock prices fell notably in China, partly driven by reports that authorities were taking actions to moderate loan growth."
148,"Despite fairly positive economic indicators, sovereign yields fell in major industrial economies, reportedly in part because of the reiteration by major central banks of their intention to keep policy interest rates low."
149,"On a trade-weighted basis, the dollar depreciated against major foreign currencies, notably against the euro and Japanese yen; it was little changed, on average, against the currencies of the other major trading partners of the United States."
150,"The European Central Bank, the Bank of England, the Bank of Canada, and the Bank of Japan kept their respective policy rates constant over the intermeeting period."
