,sentence
151,"On the first day of the FOMC meeting, the Bank of Canada announced the expiration of two temporary liquidity facilities at the end of October 2009."
152,"Staff Economic OutlookIn the forecast prepared for the September FOMC meeting, the staff raised its projection for real GDP growth over the second half of 2009 and over 2010."
153,"The information received during the intermeeting period appeared to indicate a more noticeable upturn than anticipated at the time of the August meeting: Sales and starts of single-family homes provided evidence of some firming in housing activity, capital spending indicators pointed to an earlier-than-anticipated trough for investment in E&S, and some data suggested a modest recovery in consumer spending."
154,"These tentative signs of a recovery of economic activity were supported by other factors, including recent rises in house and equity prices that would support household net worth, declines in interest rates on corporate bonds and fixed-rate mortgages, and a stronger outlook for activity in foreign economies."
155,"The staff expected that these positive factors would lead to a modest increase in final sales in the second half of 2009, despite continued weakness in commercial construction and some further deterioration in labor markets."
156,"As a result of the expected increase in final sales and an anticipated reduction in inventory liquidation, the staff projected that real GDP would increase in the second half of 2009 at a rate somewhat above the growth rate of potential output."
157,"For 2010, the staff forecast that output growth would continue to strengthen, supported by an ongoing improvement in financial conditions, a fading of the drag from earlier declines in income and wealth, accommodative monetary and fiscal policy, and recovery in the housing sector."
158,"These factors also contributed to an expected further increase in real GDP growth in 2011, despite an anticipated decline in the impetus from fiscal policy."
159,"Even though the upward revision to the projection for output was expected to generate larger gains in employment than previously forecast, the staff still projected only a slow improvement in labor markets, with the unemployment rate moving down to about 9 1/4 percent by the end of 2010 and then falling to about 8 percent by the end of 2011."
160,The staff forecast for inflation was little changed from that at the August meeting.
161,"The recent data on consumer price inflation were a little above staff expectations, but still indicated a slower increase in core prices compared with those of earlier in the year."
162,Survey measures of inflation expectations displayed no significant change.
163,"Nonetheless, with the significant under-utilization of resources expected to persist through 2011, the staff forecast core inflation to slow somewhat further over the next two years from the pace of the first half of 2009."
164,"Because of recent increases in energy prices, overall consumer price inflation was projected to be somewhat above core inflation in the second half of 2009 and 2010, but it was expected to be near the core rate in 2011."
165,"Participants' Views on Current Conditions and the Economic OutlookIn their discussion of the economic situation and outlook, meeting participants agreed that the incoming data and information received from business contacts suggested that economic activity had picked up following its severe downturn; most thought an economic recovery was under way."
166,"Many participants noted that since August, they had revised up their projections for the second half of 2009 and for subsequent years."
167,"A number of factors were expected to support growth over the next few quarters: Activity in the housing sector was evidently rising, and house prices had apparently stabilized or even increased; consumer spending seemed to be in the process of leveling out; reports from business contacts and regional surveys were consistent with firms making progress in bringing inventories into better alignment with sales and with production stabilizing or beginning to rise in many sectors; the outlook for growth abroad had also improved, auguring well for U. S. exports; and financial market conditions had continued to improve over the past several months."
168,"Despite these positive factors, many participants noted that the economic recovery was likely to be quite restrained."
169,Credit from banks remained difficult to obtain and costly for many borrowers; these conditions were expected to improve only gradually.
170,"In light of recent experience, consumers were likely to be cautious in spending, and business contacts indicated that their firms would also be cautious in hiring and investing even as demand for their products picked up."
171,"Some of the recent gains in activity probably reflected government policy support, and participants expressed considerable uncertainty about the likely strength of the upturn once those supports were withdrawn or their effects waned."
172,"Overall, the economy was projected to expand over the remainder of 2009 and during 2010, but at a pace that was unlikely to reduce the unemployment rate appreciably."
173,"Subsequently, as the housing market picked up further and financial conditions improved, economic growth was expected to strengthen, leading to more-substantial increases in resource utilization over time."
174,"Nonetheless, most participants anticipated that slack in both labor and product markets would be substantial over the next few years, leading to subdued and potentially declining wage and price inflation."
175,"Some participants were skeptical of the usefulness of measures of resource utilization in gauging inflation pressures, partly because of the difficulty of measuring slack, especially in real time."
176,"Also, those participants noted that the degree to which slack reduces inflation depends on the stability of longer-term inflation expectations, which in turn depends on expectations for monetary policy."
177,"In any case, all participants recognized that inflation expectations are a key determinant of inflation, and that various measures of inflation expectations, although imperfect, needed to be carefully monitored in the current environment."
178,Participants discussed the extent to which the size of the Federal Reserve's balance sheet would affect inflation expectations going forward.
179,"To keep inflation expectations well anchored, all agreed on the importance of the Federal Reserve continuing to communicate that it has the tools and willingness to begin withdrawing monetary policy accommodation at the appropriate time and pace to prevent any persistent increase in inflation."
180,"Overall, many participants viewed the risks to their inflation outlook over the next few quarters as being roughly balanced."
181,"A few continued to see some risk of substantial further disinflation, but that risk had eased somewhat further over the intermeeting period."
182,"Over a longer horizon, a few felt the risks were tilted to the upside."
183,Developments in financial markets were again regarded as broadly positive; participants saw the cumulative improvement in market functioning and pricing since the spring as substantial.
184,"Over the intermeeting period, the strengthening in the economic outlook led to an increase in investors' appetite for riskier assets."
185,"Markets for corporate debt continued to improve, private credit spreads narrowed further, and equity prices rose."
186,"Given the improved economic prospects, the decline in longer-term Treasury yields and the apparent marking down of the implied path for the policy interest rate were seen as somewhat puzzling but supportive of recovery."
187,Some participants saw the decline in yields on Treasury securities and other instruments as an indication that the expansion of excess reserve balances was putting downward pressure on market rates; some others viewed the configuration of rate movements as consistent with reduced concerns about inflation and with lower term premiums in a more settled economic environment.
188,"In any event, the ongoing improvement in broader financial and economic conditions seemed to some participants to reflect the onset of a positive feedback loop in which better financial conditions contribute to stronger growth in output and employment, which in turn bolsters expected returns and strengthens financial firms, leading to a further easing in financial conditions."
189,"Others noted, however, that many financial markets and institutions were still strained and that downside financial risks remained."
190,"In particular, because the improvement in financial markets was due, in part, to support from various government programs, market functioning might deteriorate as those programs wind down."
191,"Moreover, credit remained quite tight for many businesses and households dependent on banks, and many regional and small banks were vulnerable to the deteriorating performance of commercial real estate loans."
192,Participants noted that all categories of bank lending continued to decline.
193,Participants emphasized that labor market conditions remained weak.
194,"Although recent data indicated that the pace at which employment was declining had slowed, job losses remained sizable and the unemployment rate was high."
195,"The unusually large fraction of those who were working part time for economic reasons, the unusually low level of the average workweek, and indications from business contacts that firms would be slow to hire additional staff as sales and production turn up all pointed to a period of modest job gains, and thus only a slow decline in the unemployment rate as the economic recovery proceeds."
196,Significant cost cutting by firms was thought to have led to a sizable increase in productivity growth in the first half of the year; sustained outsized gains in productivity could further damp hiring.
197,"Finally, high levels of long-term unemployment and permanent separations could lead to losses of skills and greater needs for labor reallocation that could slow employment growth."
198,"Consumer spending had picked up more than expected over the intermeeting period, but participants saw that increase as partly reflecting special factors like the cash-for-clunkers program."
199,"Recent increases in house prices and equity prices were positives, but participants generally expected no more than moderate growth in consumer spending over the near term."
200,"Households still faced considerable headwinds, including tight credit, high levels of debt, uncertain job prospects, and wealth levels that remained relatively low despite the recent rise in equity prices and stabilization in house prices."
201,"In that environment, households' saving behavior remained an important source of uncertainty in the outlook."
202,"The household saving rate had risen considerably in recent quarters, and the most likely outcome was for the saving rate to remain near its higher level; however, some participants noted that there was some chance that the sharp drop in household net worth over the past few years, reduced access to credit, and high household debt burdens could lead households to save a substantially larger fraction of their incomes going forward."
203,Firms appeared to be reducing inventories and fixed investment at a slower pace than earlier in the year and had made substantial progress in reducing stocks toward desired levels.
204,"With inventories low, firms were beginning to raise production to meet at least a portion of new demand; this adjustment was likely to make an important contribution to economic recovery in the second half of this year."
205,Recent data on new orders and shipments pointed to an earlier bottoming out in equipment and investment spending than previously anticipated.
206,"Some participants reported that while business contacts had expressed relief that the most severe economic outcomes had been avoided, they remained cautious about the recovery."
207,"This caution, together with low utilization rates and substantial excess capacity, could hold back the rate of increase of new capital spending."
208,"In the residential real estate sector, home sales and construction had increased from very low levels, and house prices appeared to be stabilizing."
209,"Participants welcomed the cumulating evidence that the housing sector was beginning to recover, and many participants had marked up their forecasts for housing activity."
210,"However, some viewed the improvement as quite tentative, pointing to the pending termination of the temporary tax credit for first-time homebuyers and the winding down of the Federal Reserve's agency MBS purchase program as potential risks to the outlook for the sector."
211,"Also, some participants questioned whether the recent stabilization in house prices would be sustained as likely further increases in foreclosures would probably put downward pressure on prices."
212,"Still, a better outlook for house prices was an important input to the improved economic outlook; not only would household wealth benefit from a turnaround in such prices, but the exposure of lenders to real estate losses would be diminished."
213,"In contrast to developments in the residential sector, commercial real estate activity continued to fall markedly in most districts, reflecting deteriorating fundamentals, including declining occupancy and rental rates and very tight credit conditions."
214,"Participants marked up their outlook for foreign economies, mainly reflecting better-than-expected incoming data from a range of countries."
215,"The pickup in foreign economic activity, especially in Asia, had buoyed U. S. export growth, and several participants noted that higher growth abroad would support growth in U. S. exports going forward."
216,"Committee Policy ActionIn their discussion of monetary policy for the period ahead, Committee members agreed that no significant changes to its policy target rate or large-scale asset purchase programs were warranted at this meeting."
217,"Although the economic outlook had improved further in recent weeks and the risks to the forecast had become more balanced, the level of economic activity was likely to be quite weak and resource utilization low."
218,"With substantial resource slack likely to persist and longer-term inflation expectations stable, the Committee anticipated that inflation would remain subdued for some time."
219,"Under these circumstances, the Committee judged that the costs of growth turning out to be weaker than anticipated could be relatively high."
220,"Accordingly, the Committee agreed that it was appropriate to maintain its target range for the federal funds rate at 0 to 1/4 percent and to reiterate its view that economic conditions were likely to warrant an exceptionally low level of the federal funds rate for an extended period."
221,"With respect to the large-scale asset purchase programs, some members thought that an increase in the maximum amount of the Committee's purchases of agency MBS could help to reduce economic slack more quickly than in the baseline outlook."
222,Another member believed that the recent improvement in the economic outlook could warrant a reduction in the Committee's maximum purchases.
223,"However, all members were able to support an indication by the Committee of its intention at this time to purchase the full $1."
224,25 trillion of agency MBS that it had previously established as the maximum for this program.
225,"With respect to agency debt, the Committee agreed to reiterate its intention to purchase up to $200 billion of these securities."
226,"To promote a smooth transition in markets as these programs are concluded, members decided to gradually slow the pace of both its agency MBS and agency debt purchases and to extend their completion through the end of the first quarter of 2010."
227,The Committee agreed that it would continue to evaluate the timing and overall amounts of its purchases of securities in light of the evolving economic outlook and conditions in financial markets.
228,Members discussed the importance of maintaining flexibility to expand the asset purchase programs should the economic outlook deteriorate or to scale back the programs should economic and financial conditions improve more than anticipated.
229,"At the conclusion of the discussion, the Committee voted to authorize and direct the Federal Reserve Bank of New York, until it was instructed otherwise, to execute transactions in the System Account in accordance with the following domestic policy directive: ""The Federal Open Market Committee seeks monetary and financial conditions that will foster price stability and promote sustainable growth in output."
230,"To further its long-run objectives, the Committee seeks conditions in reserve markets consistent with federal funds trading in a range from 0 to 1/4 percent."
231,"The Committee directs the Desk to purchase agency debt, agency MBS, and longer-term Treasury securities during the intermeeting period with the aim of providing support to private credit markets and economic activity."
232,The timing and pace of these purchases should depend on conditions in the markets for such securities and on a broader assessment of private credit market conditions.
233,The Desk is expected to complete purchases of about $300 billion of longer-term Treasury securities by the end of October.
234,It is also expected to execute purchases of up to $200 billion in housing-related agency debt and about $1.
235,25 trillion of agency MBS by the end of the first quarter of 2010.
236,The Desk is expected to gradually slow the pace of these purchases as they near completion.
237,The Committee anticipates that outright purchases of securities will cause the size of the Federal Reserve's balance sheet to expand significantly in coming months.
238,"The System Open Market Account Manager and the Secretary will keep the Committee informed of ongoing developments regarding the System's balance sheet that could affect the attainment over time of the Committee's objectives of maximum employment and price stability. """
239,"The vote encompassed approval of the statement below to be released at 2:15 p. m. : ""Information received since the Federal Open Market Committee met in August suggests that economic activity has picked up following its severe downturn."
240,"Conditions in financial markets have improved further, and activity in the housing sector has increased."
241,"Household spending seems to be stabilizing, but remains constrained by ongoing job losses, sluggish income growth, lower housing wealth, and tight credit."
242,"Businesses are still cutting back on fixed investment and staffing, though at a slower pace; they continue to make progress in bringing inventory stocks into better alignment with sales."
243,"Although economic activity is likely to remain weak for a time, the Committee anticipates that policy actions to stabilize financial markets and institutions, fiscal and monetary stimulus, and market forces will support a strengthening of economic growth and a gradual return to higher levels of resource utilization in a context of price stability."
244,"With substantial resource slack likely to continue to dampen cost pressures and with longer-term inflation expectations stable, the Committee expects that inflation will remain subdued for some time."
245,"In these circumstances, the Federal Reserve will continue to employ a wide range of tools to promote economic recovery and to preserve price stability."
246,The Committee will maintain the target range for the federal funds rate at 0 to 1/4 percent and continues to anticipate that economic conditions are likely to warrant exceptionally low levels of the federal funds rate for an extended period.
247,"To provide support to mortgage lending and housing markets and to improve overall conditions in private credit markets, the Federal Reserve will purchase a total of $1."
248,25 trillion of agency mortgage-backed securities and up to $200 billion of agency debt.
249,The Committee will gradually slow the pace of these purchases in order to promote a smooth transition in markets and anticipates that they will be executed by the end of the first quarter of 2010.
250,"As previously announced, the Federal Reserve's purchases of $300 billion of Treasury securities will be completed by the end of October 2009."
251,The Committee will continue to evaluate the timing and overall amounts of its purchases of securities in light of the evolving economic outlook and conditions in financial markets.
252,"The Federal Reserve is monitoring the size and composition of its balance sheet and will make adjustments to its credit and liquidity programs as warranted. """
253,"Voting for this action: Messrs. Bernanke and Dudley, Ms. Duke, Messrs. Evans, Kohn, Lacker, Lockhart, Tarullo, and Warsh, and Ms. Yellen."
254,Voting against this action: None.
255,"It was agreed that the next meeting of the Committee would be held on Tuesday-Wednesday, November 3-4, 2009."
256,The meeting
