,sentence
150,Participants also discussed readings from various market- and survey-based measures of longer-run inflation expectations.
151,"Recently, some of the available surveys had reported softer longer-run inflation expectations, while others suggested still-stable expectations."
152,"In addition, the market-based measures of inflation compensation that had declined earlier were still at low levels."
153,"A number of participants noted, based on historical patterns, that some of the survey-based measures could be overly sensitive to energy price fluctuations rather than indicating shifts in perceptions of underlying inflation trends and that the declines in the market-based measures could reflect changes in risk and liquidity premiums."
154,Many concluded that longer-run inflation expectations remained reasonably stable.
155,"However, some expressed concerns that inflation expectations may have already moved lower, or that they might do so if inflation persisted for much longer at a rate below the Committee's objective."
156,"Labor market conditions improved further in recent months: Monthly gains in nonfarm payroll employment averaged more than 200, 000 over the period from September to November, and the unemployment rate edged lower."
157,The cumulative reduction in the underutilization of labor resources since early in the year was appreciable.
158,"The unemployment rate, at 5."
159,"0 percent in November, was 0."
160,7 percentage point lower than in January and close to most participants' estimates of its longer-run normal level.
161,Broader measures of underemployment that include marginally attached workers and those employed part time for economic reasons also fell substantially since January.
162,"However, the labor force participation rate moved down since January as well, with some FOMC participants attributing part of the decline to demographic trends or a structural rise in detachment among prime-age men."
163,"A number of participants observed that wage increases had begun to pick up, or that they appeared likely to do so over the coming year."
164,"Although many participants judged that the improvement in labor market conditions had been substantial, some others indicated that further progress in reducing labor market slack would be required before conditions would be consistent with the Committee's objective of maximum employment."
165,"In particular, some participants stressed the importance of the pace of economic growth staying above that of potential output in order to reduce remaining labor underutilization across broader dimensions--for example, by lowering the still-elevated numbers of workers employed part time for economic reasons and by encouraging additional workers who are currently outside the labor force but want a job to reenter the labor force."
166,"Most participants expected that the unemployment rate would edge below their estimates of its longer-run level in the coming year and then stabilize for a time, with the further strengthening of the labor market helping move inflation higher."
167,"Because labor compensation was still increasing at a subdued rate and inflation remained well below 2 percent, some participants judged that a moderate further decline in unemployment would be unlikely to lead to a buildup of unduly strong inflation pressures."
168,A few commented that a sustained period of labor market activity above levels consistent with maximum employment should speed the rise in inflation to the Committee's objective.
169,Financial conditions tightened modestly over the intermeeting period.
170,Quotes in financial markets and survey results suggested that investors were quite confident that the Committee would raise the federal funds target range 25 basis points at the current meeting.
171,Concerns among investors about the high-yield bond market increased notably in the days before the meeting after an open-ended mutual fund specializing in junk bonds suspended redemptions and closed.
172,"In their discussion, several participants commented that markets for leveraged finance had been correcting since midyear--particularly for the most risky assets, including those associated with energy firms--and noted that the widening of credit spreads in corporate bond markets appeared to be largely due to the repricing of riskier assets."
173,"During their consideration of economic conditions and monetary policy, almost all participants agreed that the improvements that had occurred in the labor market and their confidence in a return of inflation to 2 percent over the medium term now satisfied the Committee's criteria for beginning the policy normalization process."
174,Participants also discussed the implications of economic conditions going forward for the likely future path of the target range for the federal funds rate.
175,"Even after the initial increase in the target range, the stance of policy would remain accommodative."
176,Participants saw several reasons why a gradual removal of policy accommodation would likely be appropriate.
177,Normalizing policy gradually would keep the stance of monetary policy sufficiently accommodative to support further improvement in labor market conditions and to exert upward pressure on inflation.
178,"Also, a number of participants pointed out that because inflation was still running well below the Committee's objective and the outlook for inflation was subject to considerable uncertainty, it would probably take some time for the data to confirm that inflation was on a trajectory to return to 2 percent over the medium term."
179,Gradual adjustments in the federal funds rate would also allow policymakers to assess how the economy was responding to increases in interest rates.
180,"In addition, by several estimates, the neutral short-term real interest rate was currently close to zero and was expected to rise only slowly as headwinds restraining the expansion receded."
181,"Moreover, the ability of monetary policy to offset the economic effects of an unanticipated economic shock remained asymmetric, and a cautious approach to normalizing policy could help minimize the risk of having to respond to a negative economic shock while the policy rate remained near its effective lower bound."
182,"While viewing a gradual approach to policy normalization as likely to be appropriate given their economic outlook, participants emphasized the need to adjust the policy path as economic conditions evolved and to avoid appearing to commit to any specific pace of adjustments."
183,"They stressed the importance of communicating clearly that the future policy path could become shallower if the economic expansion weakened and inflation rose more slowly than currently anticipated, and that it could become steeper if real activity and inflation surprised to the upside."
184,"A few participants also indicated that significant risks to financial stability, should they emerge, could alter their view of the appropriate policy path."
185,"Committee Policy Action In their discussion of monetary policy for the period ahead, members judged that information received since the FOMC met in October indicated that economic activity had been expanding at a moderate pace."
186,"Although net exports remained soft, consumer and business spending remained solid, and the housing sector improved further."
187,"Overall, taking into account domestic and foreign developments, members saw the risks to the outlook for both economic activity and the labor market as balanced, and they expected that, with gradual adjustments in the stance of monetary policy, economic activity would most likely continue to expand at a moderate pace."
188,"Members agreed that a range of recent labor market indicators, including ongoing job gains and declining unemployment, showed further improvement and confirmed that underutilization of labor resources had diminished appreciably since early this year."
189,"Members anticipated that economic activity was likely to continue to expand at a pace sufficient to lead to a further increase in the utilization of labor resources, and many members judged that additional progress would be required to reach the Committee's maximum-employment objective."
190,"Inflation continued to run below the Committee's longer-run objective, held down in part by the effects of declines in energy and non-energy import prices."
191,Market-based measures of inflation compensation remained low; some survey-based measures of longer-term inflation expectations had edged down.
192,Members anticipated that the further decline in crude oil prices over the intermeeting period was likely to exert some additional transitory downward pressure on inflation in the near term.
193,"Regarding the medium-term outlook, inflation was projected to increase gradually as energy prices and prices of non-energy imports stabilized and the labor market strengthened."
194,"Overall, taking into account economic developments and the outlook for economic activity and the labor market, the Committee was now reasonably confident in its expectation that inflation would rise, over the medium term, to its 2 percent objective."
195,"However, for some members, the risks attending their inflation forecasts remained considerable."
196,Among those risks was the possibility that additional downward shocks to prices of oil and other commodities or a sustained rise in the exchange value of the dollar could delay or diminish the expected upturn in inflation.
197,A couple also worried that a further strengthening of the labor market might not prove sufficient to offset the downward pressures from global disinflationary forces.
198,And several expressed unease with indications that inflation expectations may have moved down slightly.
199,"In view of these risks and the shortfall of inflation from 2 percent, members expressed their intention to carefully monitor actual and expected progress toward the Committee's inflation goal."
200,"After assessing the outlook for economic activity, the labor market, and inflation and weighing the uncertainties associated with the outlook, members agreed to raise the target range for the federal funds rate to 1/4 to 1/2 percent at this meeting."
201,A number of members commented that it was appropriate to begin policy normalization in response to the substantial progress in the labor market toward achieving the Committee's objective of maximum employment and their reasonable confidence that inflation would move to 2 percent over the medium term.
202,Members agreed that the postmeeting statement should report that the Committee's decision reflected both the economic outlook and the time it takes for policy actions to affect future economic outcomes.
203,"If the Committee waited to begin removing accommodation until it was closer to achieving its dual-mandate objectives, it might need to tighten policy abruptly, which could risk disrupting economic activity."
204,"Members observed that after this initial increase in the federal funds rate, the stance of monetary policy would remain accommodative."
205,"However, some members said that their decision to raise the target range was a close call, particularly given the uncertainty about inflation dynamics, and emphasized the need to monitor the progress of inflation closely."
206,Members also discussed their expectations for the size and timing of adjustments in the target range for the federal funds rate going forward.
207,"Based on their current forecasts for economic activity, the labor market, and inflation, as well as their expectation that the neutral short-term real interest rate will rise slowly over the next few years, members expected economic conditions would evolve in a manner that would warrant only gradual increases in the federal funds rate."
208,"However, they also recognized that the appropriate path for the federal funds rate would depend on the economic outlook as informed by incoming data."
209,Members stressed the potential need to accelerate or slow the pace of normalization as the economic outlook evolved.
210,"In the current situation, because of their significant concern about still-low readings on actual inflation and the uncertainty and risks present in the inflation outlook, they agreed to indicate that the Committee would carefully monitor actual and expected progress toward its inflation goal."
211,"In determining the size and timing of further adjustments to monetary policy, some members emphasized the importance of confirming that inflation would rise as projected and of maintaining the credibility of the Committee's inflation objective."
212,"Based on their current economic outlook, they continued to anticipate that the federal funds rate was likely to remain, for some time, below levels that the Committee expected to prevail in the longer run."
213,The Committee also maintained its policy of reinvesting principal payments from agency debt and agency mortgage-backed securities in agency mortgage-backed securities and of rolling over maturing Treasury securities at auction.
214,"In view of members' outlook for moderate growth in economic activity, inflation moving toward its target only gradually, and the asymmetric risks posed by the continued proximity of short-term interest rates to their effective lower bound, the Committee anticipated retaining this policy until normalization of the level of the federal funds rate was well under way."
215,"This policy, by keeping the Committee's holdings of longer-term securities at sizable levels, should help maintain accommodative financial conditions."
216,"At the conclusion of the discussion, the Committee voted to authorize and direct the Federal Reserve Bank of New York, until it was instructed otherwise, to execute transactions in the SOMA in accordance with the following domestic policy directive, to be released at 2:00 p. m. : ""Effective December 17, 2015, the Federal Open Market Committee directs the Desk to undertake open market operations as necessary to maintain the federal funds rate in a target range of 1/4 to 1/2 percent, including: (1) overnight reverse repurchase operations (and reverse repurchase operations with maturities of more than one day when necessary to accommodate weekend, holiday, or similar trading conventions) at an offering rate of 0."
217,"25 percent, in amounts limited only by the value of Treasury securities held outright in the System Open Market Account that are available for such operations and by a per-counterparty limit of $30 billion per day; and (2) term reverse repurchase operations to the extent approved in the resolution on term RRP operations approved by the Committee at its March 17-18, 2015, meeting."
218,The Committee directs the Desk to continue rolling over maturing Treasury securities at auction and to continue reinvesting principal payments on all agency debt and agency mortgage-backed securities in agency mortgage-backed securities.
219,"The Committee also directs the Desk to engage in dollar roll and coupon swap transactions as necessary to facilitate settlement of the Federal Reserve's agency mortgage-backed securities transactions. """
220,"The vote also encompassed approval of the statement below to be released at 2:00 p. m. : ""Information received since the Federal Open Market Committee met in October suggests that economic activity has been expanding at a moderate pace."
221,"Household spending and business fixed investment have been increasing at solid rates in recent months, and the housing sector has improved further; however, net exports have been soft."
222,"A range of recent labor market indicators, including ongoing job gains and declining unemployment, shows further improvement and confirms that underutilization of labor resources has diminished appreciably since early this year."
223,"Inflation has continued to run below the Committee's 2 percent longer-run objective, partly reflecting declines in energy prices and in prices of non-energy imports."
224,Market-based measures of inflation compensation remain low; some survey-based measures of longer-term inflation expectations have edged down.
225,"Consistent with its statutory mandate, the Committee seeks to foster maximum employment and price stability."
226,"The Committee currently expects that, with gradual adjustments in the stance of monetary policy, economic activity will continue to expand at a moderate pace and labor market indicators will continue to strengthen."
227,"Overall, taking into account domestic and international developments, the Committee sees the risks to the outlook for both economic activity and the labor market as balanced."
228,Inflation is expected to rise to 2 percent over the medium term as the transitory effects of declines in energy and import prices dissipate and the labor market strengthens further.
229,The Committee continues to monitor inflation developments closely.
230,"The Committee judges that there has been considerable improvement in labor market conditions this year, and it is reasonably confident that inflation will rise, over the medium term, to its 2 percent objective."
231,"Given the economic outlook, and recognizing the time it takes for policy actions to affect future economic outcomes, the Committee decided to raise the target range for the federal funds rate to 1/4 to 1/2 percent."
232,"The stance of monetary policy remains accommodative after this increase, thereby supporting further improvement in labor market conditions and a return to 2 percent inflation."
233,"In determining the timing and size of future adjustments to the target range for the federal funds rate, the Committee will assess realized and expected economic conditions relative to its objectives of maximum employment and 2 percent inflation."
234,"This assessment will take into account a wide range of information, including measures of labor market conditions, indicators of inflation pressures and inflation expectations, and readings on financial and international developments."
235,"In light of the current shortfall of inflation from 2 percent, the Committee will carefully monitor actual and expected progress toward its inflation goal."
236,"The Committee expects that economic conditions will evolve in a manner that will warrant only gradual increases in the federal funds rate; the federal funds rate is likely to remain, for some time, below levels that are expected to prevail in the longer run."
237,"However, the actual path of the federal funds rate will depend on the economic outlook as informed by incoming data."
238,"The Committee is maintaining its existing policy of reinvesting principal payments from its holdings of agency debt and agency mortgage-backed securities in agency mortgage-backed securities and of rolling over maturing Treasury securities at auction, and it anticipates doing so until normalization of the level of the federal funds rate is well under way."
239,"This policy, by keeping the Committee's holdings of longer-term securities at sizable levels, should help maintain accommodative financial conditions. """
240,"Voting for this action: Janet L. Yellen, William C. Dudley, Lael Brainard, Charles L. Evans, Stanley Fischer, Jeffrey M. Lacker, Dennis P. Lockhart, Jerome H. Powell, Daniel K. Tarullo, and John C. Williams."
241,Voting against this action: None.
242,"To support the Committee's decision to raise the target range for the federal funds rate, the Board of Governors voted unanimously to raise the interest rates on required and excess reserve balances by 1/4 percentage point, to 1/2 percent, effective December 17, 2015."
243,"The Board of Governors also voted unanimously to approve a 1/4 percentage point increase in the primary credit rate (discount rate) to 1 percent, effective December 17, 2015."
244,"4 After these policy decisions, the deputy manager of the System Open Market Account briefed the Committee on plans for term RRPs over year-end."
245,"It was agreed that the next meeting of the Committee would be held on Tuesday-Wednesday, January 26-27, 2016."
246,The meeting
