,sentence
0," (SOMA) reported on developments in domestic and foreign financial markets, including expectations of market participants for monetary policy action by the Federal Open Market Committee (FOMC) at this meeting and in the future."
1,The deputy manager followed with a briefing on money market developments and System open market operations conducted by the Open Market Desk during the period since the Committee met on October 27-28.
2,It was noted that the System's reverse repurchase (RRP) agreement operations continued to provide a soft floor under short-term interest rates.
3,The deputy manager also discussed plans to publish additional information on details of the Committee's current Treasury securities reinvestment policy.
4,"The manager then briefed the Committee on several other matters, including plans to begin publishing the effective federal funds rate and a broader overnight bank funding rate based on the Report of Selected Money Market Rates (FR 2420) in early March 2016; the possibility that the Federal Reserve, in cooperation with the Office of Financial Research, might publish a reference rate for overnight transactions collateralized by Treasury securities; and the staff's ongoing review of the readiness of various Desk operations and facilities."
5,"By unanimous vote, the Committee ratified the Desk's domestic transactions over the intermeeting period."
6,There were no intervention operations in foreign currencies for the System's account over the intermeeting period.
7,Staff Review of the Economic Situation The information reviewed for the December 15-16 meeting suggested that real gross domestic product (GDP) was increasing at a moderate pace and that labor market conditions had improved further.
8,"Consumer price inflation continued to run below the FOMC's longer-run objective of 2 percent, restrained in part by declines in both energy prices and the prices of non-energy imported goods."
9,"Some survey-based measures of longer-run inflation expectations edged down, while market-based measures of inflation compensation were still low."
10,Total nonfarm payroll employment expanded at a faster monthly rate in October and November than in the third quarter.
11,The unemployment rate ticked down to 5.
12,"0 percent in October and remained at that level in November; over the 12 months ending in November, the unemployment rate fell 3/4 percentage point."
13,"Both the labor force participation rate and the employment-to-population ratio increased slightly, on net, over October and November."
14,"The share of workers employed part time for economic reasons was flat, on balance, in recent months after declining considerably over the previous year."
15,"The rates of private-sector job openings, hires, and quits were little changed in October from their average levels in the third quarter."
16,"Recent measures of the gains in labor compensation were mixed: Over the four quarters ending in the third quarter, compensation per hour in the business sector advanced at a strong 3-1/2 percent rate, while the employment cost index rose at a more moderate 2 percent pace."
17,Average hourly earnings for all employees increased 2-1/4 percent over the 12 months ending in November.
18,"Manufacturing production increased in October, although output in the mining sector continued to decrease."
19,"Automakers' assembly schedules and broader indicators of manufacturing production, such as the readings on new orders from national and regional manufacturing surveys, generally pointed to a slow pace of gains in factory output in the coming months."
20,Information on crude oil and natural gas extraction through early December indicated further declines in mining output.
21,Real personal consumption expenditures (PCE) appeared to be rising at a solid rate in the fourth quarter.
22,"The components of the nominal retail sales data used by the Bureau of Economic Analysis to construct its estimate of PCE increased in October and moved up at a faster pace in November, while the rate of sales of light motor vehicles remained high."
23,"Household spending was supported by strong growth in real disposable income in September and October, and households' net worth was bolstered by recent gains in home values."
24,"In addition, consumer sentiment in the University of Michigan Surveys of Consumers improved a little in November and early December."
25,Recent information on activity in the housing sector was mixed.
26,"Starts of new single-family homes were somewhat lower in October than in the third quarter, although building permits moved up."
27,"Meanwhile, starts of multifamily units declined."
28,"Sales of new homes rose in October, while existing home sales decreased."
29,"Real private expenditures for business equipment and intellectual property products increased at a solid pace in the third quarter, but business spending growth looked to be slowing somewhat in the fourth quarter."
30,"Nominal shipments of nondefense capital goods excluding aircraft edged down in October, although new orders for these capital goods continued to move up."
31,Recent readings from national and regional surveys of business conditions were consistent with more modest increases in business equipment spending than in the third quarter.
32,"Firms' nominal spending for nonresidential structures excluding drilling and mining rose in October, although available indicators of drilling activity, such as the number of oil and gas rigs in operation, continued to fall through early December."
33,Total real government purchases appeared to be about flat in the fourth quarter.
34,"Federal government spending for defense moved roughly sideways, on balance, over recent months."
35,"State and local government payrolls were little changed, on net, in October and November, while the level of nominal construction spending of these governments in October was essentially the same as its average in the third quarter."
36,The U. S. international trade deficit widened in October after narrowing in September.
37,"Exports declined, on balance, to the lowest level in three years; lower prices for commodities, along with reduced shipments of capital and consumer goods, weighed on nominal exports."
38,"Imports decreased in September and October, partly reflecting further declines in the price of imported oil."
39,The available trade data suggested that declines in real net exports would likely continue to be a drag on real GDP growth in the fourth quarter.
40,"Total U. S. consumer prices, as measured by the PCE price index, rose only 1/4 percent over the 12 months ending in October, held down by large declines in consumer energy prices."
41,"Core PCE inflation, which excludes changes in food and energy prices, was 1-1/4 percent over the same 12-month period, partly restrained by declines in the prices of non-energy imported goods."
42,"Over the 12 months ending in November, total consumer prices as measured by the consumer price index (CPI) rose 1/2 percent, while core CPI inflation was 2 percent."
43,"Survey measures of expected longer-run inflation were relatively stable, although they showed some hints of having edged slightly lower: In November and early December, the Michigan survey measure continued to run somewhat below its typical range of the past 15 years, though historical patterns suggest that these relatively low readings may have reflected softness in total inflation and energy prices."
44,The measures from both the Survey of Professional Forecasters for the fourth quarter and the Survey of Primary Dealers in December moved down slightly.
45,"Foreign real GDP growth improved in the third quarter after being weak in the first half, and recent indicators were consistent with a further moderate expansion in the fourth quarter."
46,"Economic activity in Canada rebounded in the third quarter, boosted by rising exports and a smaller drag from declines in oil-sector investment."
47,The Japanese economy expanded in the third quarter following a small contraction in the previous quarter.
48,"In contrast, growth in the euro-area economy slowed in the third quarter."
49,"Recent indicators for economic activity in China were relatively favorable, and several other emerging Asian economies strengthened in the third quarter."
50,"Mexican economic growth also picked up in the third quarter, but the Brazilian economy continued to contract."
51,Falling energy prices kept headline inflation very low in many foreign economies.
52,Staff Review of the Financial Situation Federal Reserve communications and economic data releases over the intermeeting period appeared to have led investors to raise the odds they assigned to an increase in the target range for the federal funds rate at the December FOMC meeting.
53,"The October FOMC statement and the stronger-than-expected October employment report, in particular, boosted expectations of FOMC action at this meeting."
54,"Subsequent data releases and FOMC communications firmed those views, and in the weeks before the meeting, market participants came to attach high odds to the possibility of a December increase."
55,The expected path of the federal funds rate implied by market quotes on interest rate derivatives rose moderately over the intermeeting period.
56,"Nominal yields on 2- and 10-year Treasury securities rose about 40 basis points and 25 basis points, respectively."
57,Measures of inflation compensation based on Treasury Inflation-Protected Securities remained low.
58,"Over the first few weeks of the intermeeting period, the increase in the perceived likelihood of an increase in the target range for the federal funds rate at the December meeting was not accompanied by a rise in implied or realized volatility in domestic equity and fixed-income markets."
59,"However, later in the period, concerns among market participants about the implications of falling crude oil prices and the credit quality of high-yield bonds evidently increased."
60,"In reaction, broad measures of U. S. equity prices declined, with a steep selloff in energy-sector stocks, and the one-month-ahead option-implied volatility on the S&P 500 index, the VIX, climbed."
61,"In addition, strains in the high-yield bond market increased notably after a mutual fund that specialized in very low-rated and unrated bonds suspended investor redemptions and closed."
62,"Over the intermeeting period, high-yield bond spreads widened significantly, on net, particularly for bonds rated triple-C or below, with more pronounced increases for firms in the energy sector."
63,"In contrast, spreads on investment-grade corporate bonds were little changed on balance."
64,Nonfinancial businesses continued to tap financial markets at a brisk pace in the intermeeting period.
65,"Issuance of investment-grade corporate bonds and institutional leveraged loans remained solid, buoyed by demand to finance mergers and acquisitions."
66,"Growth of commercial and industrial loans on banks' books continued to be strong in October and November, driven mainly by the expansion of large loans at large banks."
67,"However, high-yield bond issuance slowed and refinancing-related leveraged loan issuance stayed weak during the intermeeting period."
68,Corporate earnings and credit quality continued to show some signs of weakening.
69,"Available reports and analysts' estimates suggested that aggregate earnings per share in the third quarter declined slightly compared with year-earlier levels, in line with expectations."
70,Earnings were particularly weak in the energy and materials sectors because of declines in prices of crude oil and metals.
71,The stronger dollar appeared to weigh on earnings growth across many sectors.
72,Conditions in the municipal bond market were generally stable.
73,Gross issuance of municipal bonds was solid in recent months.
74,"Yields on municipal bonds declined a little, leaving their ratios to long-term Treasury yields somewhat lower but still near the high end of their historical range."
75,Financing conditions for commercial real estate tightened somewhat.
76,"Spreads on commercial mortgage-backed securities (CMBS) widened further, suggesting that investors in CMBS continued to reassess the risks in this sector following several years of robust demand for these securities."
77,"Nonetheless, underwriting standards continued to be relatively loose, and financing conditions appeared to remain quite accommodative overall."
78,CMBS issuance stayed strong.
79,"Residential mortgage market conditions were little changed, on net, over the intermeeting period."
80,"Credit remained tight for borrowers with low credit scores, hard-to-document income, or higher debt-to-income ratios."
81,"Interest rates on 30-year fixed-rate mortgages increased 30 basis points, in line with increases in yields on mortgage-backed securities and comparable-maturity Treasury securities."
82,"Nevertheless, mortgage rates continued to be quite low by historical standards."
83,Consumer credit markets remained accommodative for most borrowers.
84,Consumer loan balances continued to rise at a robust pace through October because of sustained expansion in credit card balances and sizable increases in auto and student loans; growth of student loans continued to slow gradually.
85,"Student and auto loans remained broadly available, even to borrowers with subprime credit histories, but the availability of credit card loans for subprime borrowers was still tight."
86,"Movements in foreign financial markets over the period reflected increased expectations that the FOMC would begin raising the target range for the federal funds rate in December, investors' views about monetary policies abroad, and substantial declines in commodity prices."
87,The broad nominal index of the dollar rose appreciably.
88,Equity indexes declined in many advanced and emerging market economies amid concerns about corporate earnings and falling oil and metals prices.
89,Short-term sovereign yields changed little in the euro area and Japan but rose moderately in the United Kingdom.
90,Longer-term sovereign yields moved higher in Europe along with U. S. Treasury yields.
91,"Staff Economic Outlook In the economic forecast prepared by the staff for the December FOMC meeting, real GDP growth in the second half of this year was little changed, on net, relative to the projection for the October meeting."
92,"The staff's medium-term projection for real GDP growth was revised up slightly, on balance, from the previous forecast, primarily because the recently passed Bipartisan Budget Act of 2015 was anticipated to lead to somewhat higher federal government purchases."
93,"The staff continued to project that real GDP would expand at a somewhat faster pace than potential output in 2016 through 2018, supported primarily by increases in consumer spending."
94,The unemployment rate was expected to decline gradually and to run somewhat below the staff's estimate of its longer-run natural rate over this period.
95,"The staff's forecast for inflation was revised down slightly in the near term in response to recent data for consumer prices and the further decline in the price of crude oil; over the medium term, the projection was little revised."
96,Energy prices and prices of non-energy imported goods were expected to begin steadily rising next year.
97,The staff projected that inflation would increase gradually over the next several years and reach the Committee's longer-run objective of 2 percent by the end of 2018.
98,"The staff viewed the uncertainty around its December projections for real GDP growth, the unemployment rate, and inflation as similar to the average of the past 20 years."
99,"The risks to the forecast for real GDP were seen as tilted somewhat to the downside, reflecting the staff's assessment that neither monetary nor fiscal policy was currently well positioned to help the economy withstand substantial adverse shocks."
100,"Consistent with this downside risk to aggregate demand, the staff viewed the risks to its outlook for the unemployment rate as skewed somewhat to the upside."
101,"The risks to the projection for inflation were seen as weighted to the downside, reflecting the possibility that longer-term inflation expectations may have edged down and that the foreign exchange value of the dollar could rise substantially further, which would put downward pressure on inflation."
102,"Participants' Views on Current Conditions and the Economic Outlook In conjunction with this FOMC meeting, members of the Board of Governors and Federal Reserve Bank presidents submitted their projections of the most likely outcomes for real GDP growth, the unemployment rate, inflation, and the federal funds rate for each year from 2015 through 2018 and over the longer run."
103,3 Each participant's projections were conditioned on his or her judgment of appropriate monetary policy.
104,"The longer-run projections represent each participant's assessment of the rate to which each variable would be expected to converge, over time, under appropriate monetary policy and in the absence of further shocks to the economy."
105,"These projections and policy assessments are described in the Summary of Economic Projections, which is an addendum to these minutes."
106,"In their discussion of the economic situation and the outlook, meeting participants viewed the information received over the intermeeting period as indicating that economic activity was expanding moderately and confirming that underutilization of labor resources had diminished appreciably since early in the year."
107,"Participants' outlook indicated that, with gradual adjustments in the stance of monetary policy, real GDP would continue to increase at a moderate rate over the medium term and that labor market indicators would continue to strengthen."
108,They anticipated that the relative strength in domestic demand would be only partially offset by some further weakness in net exports.
109,"Participants generally saw the downside risks to U. S. economic activity from global economic and financial developments, although still material, as having diminished since late summer."
110,"In addition, new and revised information on employment in recent months had reduced earlier concerns about a possible slowing of progress in the labor market."
111,"Accordingly, taking into account domestic and international developments, most participants judged the risks to the outlook for both economic activity and the labor market to be balanced."
112,"Incoming data indicated that inflation continued to run below the Committee's 2 percent longer-run objective, partly reflecting declines in energy prices and prices of non-energy imports."
113,"The price of crude oil fell further over the intermeeting period, and many participants lowered their near-term forecasts for inflation somewhat while leaving their medium-term forecasts little changed."
114,Nearly all continued to anticipate that inflation would rise to or very close to 2 percent over the medium term as the transitory effects of declines in energy and import prices dissipated and the labor market strengthened further.
115,"Over the intermeeting period, market-based measures of inflation compensation stayed low; some survey-based measures of longer-term inflation expectations edged down."
116,"Although many participants remained concerned about downside risks attending the outlook for inflation, a majority of participants saw the risks to the outlook for inflation as balanced."
117,"Consumer spending continued to rise at a solid rate in recent months; retail sales picked up over the October-November period, and motor vehicle sales remained strong."
118,"The available information from District business contacts was generally consistent with the recent trend in data on spending, although a couple of reports noted that households were spending cautiously and that some price discounting was likely."
119,"Over the coming year, participants expected consumer outlays to be supported importantly by ongoing gains in jobs, rising income, and improved household balance sheets."
120,"In addition, several participants pointed out that low energy costs should help support consumer expenditures."
121,"The housing market was recovering gradually, with single-family homebuilding continuing to trend up and multifamily construction remaining at a high level."
122,The reports on the pace of construction and real estate activity across Districts varied.
123,"Nonetheless, several participants noted factors pointing to continued improvement in the housing sector, including ongoing house price appreciation, low levels of home inventories, the substantial gap between the rate of household formation and the relatively slow pace of construction, and the possibility that homebuyers may be entering the market in anticipation of higher mortgage rates."
124,"Outside of the residential sector, commercial building was highlighted as an area of relative strength in a few Districts."
125,"As a result of the recently passed Bipartisan Budget Act, federal spending was expected to provide a modest boost to economic activity over the next few years."
126,Contacts in one District with a relatively large amount of federal government activity reported that their businesses would also benefit from the reduced uncertainty about the federal fiscal outlook.
127,Business activity was solid outside of sectors adversely affected by low energy prices and weak exports.
128,"A number of participants commented on the strength in the services sector in their Districts, citing, in particular, activity in high-tech, transportation, leisure and hospitality, and health-related businesses."
129,"Some reported that the stronger manufacturing industries in their Districts included aerospace, power generation equipment, and medical equipment, and that the domestic auto industry was still a bright spot."
130,"However, manufacturing activity overall continued to be restrained by weakness in industries with significant international exposures, such as steel, agricultural and drilling equipment, and chemicals."
131,"In addition, domestic energy producers and their service suppliers remained under significant pressure from the excess supply of crude oil and declining prices."
132,The cutbacks in drilling led to further reductions in capital spending and to layoffs; credit conditions for some firms continued to deteriorate.
133,"In the agricultural sector, high levels of domestic crop production and weak global demand had depressed commodity prices, and farm income was expected to decline."
134,"Participants generally agreed that the drag on U. S. economic activity from the appreciation of the dollar since the summer of 2014 and the slowdown in foreign economic growth, particularly in emerging market economies, was likely to continue to depress U. S. net exports for some time."
135,Many expressed the view that the risks to the global economy that emerged late this summer had receded and anticipated moderate improvement in economic growth abroad in the coming year as currency and commodity markets stabilized.
136,"However, participants cited a number of lingering concerns, including the possibility that further dollar appreciation and persistent weakness in commodity prices could increase the stress on emerging market economies and that China could find it difficult to navigate the cyclical and structural changes under way in its economy."
137,"Several upside risks to the U. S. outlook also were noted, including the possibility that declining energy prices could spur consumer spending more than currently anticipated."
138,"Consumer prices, as measured by the PCE index, were little changed, on net, in September and October, held down importantly by declines in energy prices; core PCE prices posted only small increases."
139,"Over the intermeeting period, crude oil prices dropped notably, other commodity prices declined, and the dollar appreciated further."
140,The 12-month change in the core PCE price index was 1.
141,"3 percent in October and had been running at about that rate since the beginning of the year, despite the declines in prices of non-energy imported goods over the period."
142,"Several participants noted that alternative indicators of underlying inflation, such as the core CPI, the trimmed mean PCE, and the sticky price CPI, showed somewhat higher year-over-year increases, close to or above 2 percent."
143,"Inflation by these measures, however, had typically run higher than PCE price inflation, and a range of views was expressed about their implications for the outlook for PCE inflation."
144,"Almost all participants continued to expect that once energy prices and prices of non-energy commodities stabilized, the effects of the declines in those prices on headline and core PCE inflation would fade."
145,"Moreover, with margins of resource underutilization having already diminished appreciably and longer-run inflation expectations reasonably stable, most anticipated that tightening resource utilization over the next year would contribute to higher inflation."
146,Nearly all participants were now reasonably confident that inflation would move back to 2 percent over the medium term.
147,"However, because of the recent further decline in crude oil prices, many participants judged that falling energy prices would depress headline inflation somewhat longer than previously anticipated."
148,"Also, several observed that the additional appreciation of the dollar would continue to hold down the prices of imported goods."
149,"Although almost all still expected that the downward pressure on inflation from energy and commodity prices would be transitory, many viewed the persistent weakness in those prices as adding uncertainty or posing important downside risks to the inflation outlook."
