,sentence
0,"At the Federal Reserve, our monetary policy is guided by the dual mandate to promote maximum employment and stable prices."
1,"From that standpoint, the current picture is plain to see: The labor market is very strong, and inflation is much too high."
2,"My colleagues and I are acutely aware that high inflation imposes significant hardship, especially on those least able to meet the higher costs of essentials like food, housing, and transportation."
3,"There is an obvious need to move expeditiously to return the stance of monetary policy to a more neutral level, and then to move to more restrictive levels if that is what is required to restore price stability."
4,We are committed to restoring price stability while preserving a strong labor market.
5,"At our meeting that concluded last week, we took several steps in pursuit of these goals: We raised our policy interest rate for the first time since the start of the pandemic and said that we anticipate that ongoing rate increases will be appropriate to reach our objectives."
6,"These actions, along with the adjustments we have made since last fall, represent a substantial firming in the stance of policy with the intention of restoring price stability."
7,"In my comments today, I will first discuss the economic conditions that warrant these actions and then address the path ahead for monetary policy."
8,"The Labor Market Is Very Strong and Extremely Tight To begin with employment, in the last few years of the historically long expansion that ended with the arrival of the pandemic, we saw the remarkable benefits of an extended period of strong labor market conditions."
9,"Employment growth powered through the difficult Omicron wave, adding 1.75 million jobs over the past three months."
10,"The unemployment rate has fallen to 3.8 percent, near historical lows, and has reached this level much faster than anticipated by most forecasters (figure 1)."
11,"While disparities in employment remain, job growth has been widespread across racial, ethnic, and demographic groups."
12,"By many measures, the labor market is extremely tight, significantly tighter than the very strong job market just before the pandemic."
13,"There are far more job openings going unfilled today than before the pandemic, despite today's unemployment rate being higher."
14,"It is worth considering why the labor market is so tight, given that the unemployment rate is actually higher than it was before the pandemic."
15,"One explanation is that the natural rate of unemployment may be temporarily elevated, so wage pressure is greater for any given level of unemployment."
16,"Over time, we might expect these factors to fade, reducing pressure in the job market."
17,"Total demand for labor, measured by total employment plus posted job openings, has substantially recovered and far exceeds the size of the workforce."
18,Increases in labor force participation often substantially lag declines in unemployment.
19,"Overall, the labor market is strong but showing a clear imbalance of supply and demand."
20,"Our monetary policy tools cannot help with labor supply in the near term, but in a long expansion, the factors holding back supply will likely ease."
21,"In the meantime, we aim to use our tools to moderate demand growth, thereby facilitating continued, sustainable increases in employment and wages."
22,"The Inflation Outlook Has Deteriorated Significantly Turning to price stability, the inflation outlook had deteriorated significantly this year even before Russia's invasion of Ukraine."
23,The rise in inflation has been much greater and more persistent than forecasters generally expected.
24,"For example, at the time of our June 2021 meeting, every Federal Open Market Committee (FOMC) participant and all but one of 35 submissions in the Survey of Professional Forecasters predicted that 2021 inflation would be below 4 percent."
25,"Inflation came in at 5.5 percent.2 For a time, moderate inflation forecasts looked plausible—the one-month headline and core inflation rates declined steadily from April through September."
26,"But inflation moved up sharply in the fall, and, just since our December meeting, the median FOMC projection for year-end 2022 jumped from 2.6 percent to 4.3 percent."
27,"In my view, an important part of the explanation is that forecasters widely underestimated the severity and persistence of supply-side frictions, which, when combined with strong demand, especially for durable goods, produced surprisingly high inflation."
28,"The pandemic and the associated shutdown and reopening of the economy caused a serious upheaval in many parts of the economy, snarling supply chains, constraining labor supply, and creating a major boom in demand for goods and a bust in services demand."
29,The combination of the surge in goods demand with supply chain bottlenecks led to sharply rising goods prices (figure 4).
30,"Prices soared across the vehicles sector as booming demand was met by a sharp decline in global production during the summer of 2021, owing to shortages of computer chips."
31,"Production remains below pre-pandemic levels, and an expected sharp decline in prices has been repeatedly postponed."
32,"Many forecasters, including FOMC participants, had been expecting inflation to cool in the second half of last year, as the economy started going back to normal after vaccines became widely available.3 Expectations were that the supply-side damage would begin to heal."
33,"Schools would reopen—freeing parents to return to work—and labor supply would begin bouncing back, kinks in supply chains would begin resolving, and consumption would start rotating back to services, all of which could reduce price pressures."
34,"The Policy Response As the magnitude and persistence of the increase in inflation became increasingly clear over the second half of last year, and as the job market recovery accelerated beyond expectations, the FOMC pivoted to progressively less accommodative monetary policy."
35,I believe that these policy actions and those to come will help bring inflation down near 2 percent over the next 3 years.
36,"Thus, my main message today is that, as the outlook evolves, we will adjust policy as needed in order to ensure a return to price stability with a strong job market."
37,How will fallout from the invasion of Ukraine affect the economy and monetary policy?
38,"In addition to the direct effects from higher global oil and commodity prices, the invasion and related events are likely to restrain economic activity abroad and further disrupt supply chains, which would create spillovers to the U.S. economy."
39,We might look to the historical experience with oil price shocks in the 1970s—not a happy story.
40,"Fortunately, the United States is now much better situated to weather oil price shocks.4 We are now the world's largest producer of oil, and our economy is significantly less oil intensive than in the 1970s."
41,"Today a rise in oil prices has mixed effects on the economy, lowering real household incomes and thus demand, but raising investment in drilling over time and benefiting oil-producing areas more generally."
42,"Second, how likely is it that monetary policy can lower inflation without causing a recession?"
43,Our goal is to restore price stability while fostering another long expansion and sustaining a strong labor market.
44,"In the FOMC participant projections I just described, the economy achieves a soft landing, with inflation coming down and unemployment holding steady."
45,"Growth slows as the very fast growth from the early stages of reopening fades, the effects of fiscal support wane, and monetary policy accommodation is removed."
46,"I believe that the historical record provides some grounds for optimism: Soft, or at least soft-ish, landings have been relatively common in U.S. monetary history.5 In three episodes—in 1965, 1984, and 1994—the Fed raised the federal funds rate significantly in response to perceived overheating without precipitating a recession (figure 6).6 In other cases, recessions chronologically followed the conclusion of a tightening cycle, but the recessions were not apparently due to excessive tightening of monetary policy."
47,"And monetary policy is often said to be a blunt instrument, not capable of surgical precision."
48,It is worth noting that today the economy is very strong and is well positioned to handle tighter monetary policy.
49,"Finally, what will it take to restore price stability?"
50,The ultimate responsibility for price stability rests with the Federal Reserve.
51,Price stability is essential if we are going to have another sustained period of strong labor market conditions.
52,We will take the necessary steps to ensure a return to price stability.
53,"Our monetary policy framework, as embodied in our Statement on Longer-Run Goals and Monetary Policy Strategy, emphasizes that having longer-term inflation expectations anchored at our longer-run objective of 2 percent helps us achieve both our dual-mandate objectives."
54,"In the recent period, short-term inflation expectations have, of course, risen with inflation, but longer-run expectations remain well anchored in their historical ranges (figure 7)."
55,"The added near-term upward pressure from the invasion of Ukraine on inflation from energy, food, and other commodities comes at a time of already too high inflation."
56,"In normal times, when employment and inflation are close to our objectives, monetary policy would look through a brief burst of inflation associated with commodity price shocks."
57,"However, the risk is rising that an extended period of high inflation could push longer-term expectations uncomfortably higher, which underscores the need for the Committee to move expeditiously as I have described."
58,"But, to end where I began, inflation is much too high."
59,"We have the necessary tools, and we will use them to restore price stability."
