,speaker,sentence
176,CHAIR POWELL,"The fourth-quarter growth globally was quite weak last year, and a number of factors played into that."
177,CHAIR POWELL,It wasn’t any one factor.
178,CHAIR POWELL,"There was trade policy uncertainty, absolutely, but also there was the decision by the Chinese authorities to try to rein in leverage and financial excesses."
179,CHAIR POWELL,There was a turn—downturn in the global high-tech manufacturing cycle in global auto production.
180,CHAIR POWELL,"There were some idiosyncratic strains in some countries like Argentina, Turkey."
181,CHAIR POWELL,"And then, later, in Hong Kong and Chile, you had social unrest."
182,CHAIR POWELL,"So, all of those things were playing into that cycle of weakening growth over the course of 2019 and the last half of ’18."
183,CHAIR POWELL,"I would say, now there are grounds for what I would call “cautious optimism” about the outlook now for the global economy."
184,CHAIR POWELL,"Many analysts are predicting a pickup in growth this year, although still to relatively modest growth rates."
185,CHAIR POWELL,"And I would—people are pointing to, and we would point to, supportive financial conditions, the easing of trade tensions, the lower odds of a hard Brexit."
186,CHAIR POWELL,"The high-tech manufacturing industry does appear to be rebounding well in Asia, including in China."
187,CHAIR POWELL,"The latest indicators—manufacturing PMIs, for example—suggest that manufacturing may have bottomed out, that they’re still below 50 in many jurisdictions, but they have moved up off of their lows."
188,CHAIR POWELL,"I would—I would just say, none of this is assured."
189,CHAIR POWELL,"As I mentioned, we saw the fourth quarter of last year came in quite weak—weaker than expected."
190,CHAIR POWELL,"We are not at all assured of a global rebound, but there are signs and reasons to expect it."
191,CHAIR POWELL,"And then comes the coronavirus, which, again, it’s too early to say what the effects will be."
192,CHAIR POWELL,"Of course, we’re, as I mentioned, monitoring it carefully."
193,CHAIR POWELL,"There will clearly be implications, at least in the near term, for Chinese output and, I would guess, for some of their close-in neighbors, and we’ll just have to see what the effect is globally."
194,BRENDAN GREELEY,Brendan Greeley with the Financial Times.
195,BRENDAN GREELEY,"As recently as 2018, interest on excess reserves was at the top of the band, sort of dragging the fed funds rate up."
196,BRENDAN GREELEY,"Over the course of the adjustments since last year, it’s moved steadily down, closer to the bottom of the band."
197,BRENDAN GREELEY,"So, if you’re moving it back up, how high do you want to get it?"
198,BRENDAN GREELEY,Are we looking to get interest on excess reserves at the top of the band again as the fed funds rate moves to the middle of the band?
199,BRENDAN GREELEY,And should we see movements in IOER as an indicator that we’re approaching “ample”?
200,CHAIR POWELL,So our stated goal is to keep IOER and the federal funds rate well within the range.
201,CHAIR POWELL,That’s it.
202,CHAIR POWELL,Well within the range.
203,CHAIR POWELL,"And that, clearly, you know—5 basis points from the bottom or from the top isn’t that."
204,CHAIR POWELL,So that’s why we moved back up.
205,CHAIR POWELL,You’re right.
206,CHAIR POWELL,Last year we were—we saw some tightness as reserves were draining out of the system.
207,CHAIR POWELL,We saw the—gradually moving up.
208,CHAIR POWELL,"And, in hindsight, we know what was happening."
209,CHAIR POWELL,"With ample reserves, we see—we see that it’s possible to bring the interest on reserves rate up to 10 basis points."
210,CHAIR POWELL,"So now we’re—now we are well within the range, I would say."
211,BRENDAN GREELEY,We are.
212,BRENDAN GREELEY,"So you don’t think that, as the fed funds goes back up towards the center of the range, that IOER is going to end up at the top?"
213,CHAIR POWELL,Don’t know that.
214,CHAIR POWELL,We want it to be well within the range.
215,CHAIR POWELL,I think we’ll continue to adjust it to the extent it’s appropriate.
216,CHAIR POWELL,"Ultimately, what we’re trying to do is deliver a federal funds rate that’s well within the range."
217,CHAIR POWELL,IOER is just a tool to do that.
218,CHAIR POWELL,"If we—if we need to make changes to keep it well within the range, we’ll do that."
219,CHAIR POWELL,"It just means—I mean, the thing that matters for the economy is that we keep the federal funds rate—which is the rate that, of course, transmits into other money market rates, which ultimately transmit into all kinds of financial conditions—that’s what we care about."
220,CHAIR POWELL,"So, ultimately, we will—we will use that tool to keep it well within the range."
221,HOWARD SCHNEIDER,Thank you.
222,HOWARD SCHNEIDER,Howard Schneider with Reuters.
223,HOWARD SCHNEIDER,"Just to sort of close the loop on one thing, where do discussions stand on a standing repo facility?"
224,HOWARD SCHNEIDER,Because what you’ve said so far sort of implies that there won’t be one or that it will be a limited one.
225,HOWARD SCHNEIDER,"So if you could just, you know, let us know where that discussion stands."
226,HOWARD SCHNEIDER,And also— UNIDENTIFIED SPEAKER.
227,HOWARD SCHNEIDER,Can you turn mic over?
228,HOWARD SCHNEIDER,Turn the mic over.
229,HOWARD SCHNEIDER,Sorry about that.
230,HOWARD SCHNEIDER,Sorry about that.
231,HOWARD SCHNEIDER,Did you get the question?
232,HOWARD SCHNEIDER,Did you hear the question okay?
233,CHAIR POWELL,I did.
234,CHAIR POWELL,I don’t think—I’m not sure your colleagues did.
235,CHAIR POWELL,[Laughter] HOWARD SCHNEIDER.
236,CHAIR POWELL,Where do the discussions stand on standing repo?
237,CHAIR POWELL,[Aside] That was great.
238,CHAIR POWELL,"And the other thing is, on the, you know, on the standing repo facility and on the purchases—Treasury bill purchases, as you enter this new regime later in the second quarter or later in the year, will that be preannounced by amounts?"
239,CHAIR POWELL,"Will there be preset amounts like you’re doing now, or will that just be something that people will have to sort of intuit and figure out as you go along?"
240,CHAIR POWELL,So I’ll go in reverse order.
241,CHAIR POWELL,"When we—when we make decisions about the steps we’re going to be taking in that adjustment process that I described at some length, we’ll be making them as early as we can and as transparently as we can—and specifically."
242,CHAIR POWELL,But we’re not at that stage.
243,CHAIR POWELL,"It’s January, and we’re several months away from—from that."
244,CHAIR POWELL,"In terms of the standing repo facility, as I mentioned in, I guess, in my answer to an earlier question, there may well be a role for repo in this system even after we’re at an ample-reserves level."
245,CHAIR POWELL,"Now, we haven’t decided what that role is, we have not decided—we haven’t at all made a decision on a standing repo facility."
246,CHAIR POWELL,We haven’t.
247,CHAIR POWELL,"We’ve had a couple of discussions about it, as you know, back in, I guess, June and October."
248,CHAIR POWELL,And there’s a range of views.
249,CHAIR POWELL,"We’re going to return, I would say, fairly soon to this question."
250,CHAIR POWELL,"And I think it was wise to wait, because we’re still getting a better sense of what that—what that world looks like."
251,CHAIR POWELL,"And, you know, it’s really going to be a question of, how useful will it be?"
252,CHAIR POWELL,What will be the costs and benefits?
253,CHAIR POWELL,"And my thinking is, we will return to that fairly soon, and I wouldn’t assume a decision one way or the other."
254,CHAIR POWELL,"Really, we haven’t made one, because we haven’t had to."
255,CHAIR POWELL,"And I think you—when you delay, you get more information by waiting."
256,CHAIR POWELL,It’s good to wait.
257,CHAIR POWELL,"We don’t have any urgency in making that decision, because we’re still trying to find that sort of stable equilibrium where we’re in an ample-reserves regime."
258,HEATHER LONG,Heather Long from the Washington Post.
259,HEATHER LONG,"I’m wondering, do you think that there is a financial stability risk from climate change?"
260,HEATHER LONG,"You’ve spoken several times that you think severe weather events are happening more often and that the Fed is monitoring what that could physically do to a bank or a financial institution, but that’s sort of one institution."
261,HEATHER LONG,Do you think there’s a systemwide risk that may—that could develop from climate change?
262,CHAIR POWELL,"So that’s an interesting question—the question being, is there a systemwide financial stability risk?"
263,CHAIR POWELL,"I’d say, over—over the longer term, it’s certainly possible, and I would say that sort of feeds into the way we’re thinking about climate change as an institution."
264,CHAIR POWELL,"So, as I’ve mentioned, climate change is an important issue, a very important issue, but it’s essentially assigned to many other agencies in the federal government and state governments for leadership on that."
265,CHAIR POWELL,"And, importantly, society’s overall response to climate change needs to be decided by elected officials and not by the Fed."
266,CHAIR POWELL,"All of that said, if you look at our mandate, we’ve got a monetary policy mandate and, more immediately perhaps, a supervisory mandate where we’re supervising financial markets, utilities, and financial institutions, banks."
267,CHAIR POWELL,And we haven’t—we share overall responsibility for financial stability with a number of agencies.
268,CHAIR POWELL,And that latter part—I think the public has every right to expect and will expect that we will assure that the financial system is resilient and robust against the risks from climate change.
269,CHAIR POWELL,"Now, I think that’s got to be right."
270,CHAIR POWELL,"We are in the very early stages, as are other central banks, in understanding just what that means."
271,CHAIR POWELL,"And there’s quite a lot of work going on around the world at other central banks and at the Fed, too, to think that through."
272,CHAIR POWELL,"But I do think it’s—in that sense, it has to be part of our role, and—but not the overall response of society to climate change."
273,CHAIR POWELL,That’s not us.
274,HEATHER LONG,"And if I could follow up, can you clarify why the Fed hasn’t signed on to the Network for Greening the Financial System like 40 other central banks have?"
275,CHAIR POWELL,"So we’ve attended all of their meetings and taken part in them, and we’ve been looking at joining in one form or another and talking to them about that."
276,CHAIR POWELL,We probably will do that at some point.
277,CHAIR POWELL,So that’s—that’s an ongoing question.
278,CHAIR POWELL,But we’re very much attending those meetings and taking part in them.
279,EDWARD LAWRENCE,"Thank you, Mr. Chairman."
280,EDWARD LAWRENCE,Edward Lawrence from Fox Business Network.
281,EDWARD LAWRENCE,So there was a signing of a ratified USMCA at the White House today.
282,EDWARD LAWRENCE,"Mid-February, the phase-one China deal gets—goes into effect."
283,EDWARD LAWRENCE,Have you seen business investment pick up at all?
284,EDWARD LAWRENCE,"If not, what will it take to get that business investment going as this uncertainty is—is being cleared up?"
285,CHAIR POWELL,Yes.
286,CHAIR POWELL,So I guess I’d start by saying that the fact that we’ve reached a phase-one deal with China and the fact that we’ve moved ahead closer to getting USM[C]A agreed—those are potentially positive things for the economy without question.
287,CHAIR POWELL,Without question.
288,CHAIR POWELL,And financial markets—the reaction of financial markets is very consistent with that perception.
289,CHAIR POWELL,"A sustained reduction in uncertainty over time should improve business sentiment, investment, which would provide some additional support for the economy."
290,CHAIR POWELL,"It’s important, though, to bear in mind a couple of things."
291,CHAIR POWELL,"First, trade policy uncertainty remains elevated."
292,CHAIR POWELL,Businesses continue to identify it as an ongoing risk.
293,CHAIR POWELL,We still have two or even three active trade discussions that are going on in the public square right now.
294,CHAIR POWELL,"So it hasn’t gone away, and we’ve just come through a round of talking to our vast network of comments—sorry, contacts in the business world."
295,CHAIR POWELL,"And I think, clearly, these are seen as positive developments going forward, but there’s a bit of a wait-and-see attitude—is this going to be sustained?"
296,CHAIR POWELL,"The agreements have to be implemented, too, and that’ll take quite some time."
297,CHAIR POWELL,"So, I would say, we need to be a little bit patient about the effect on the economy."
298,CHAIR POWELL,There’s also the global economy.
299,CHAIR POWELL,"You could—you could well see manufacturing—as I mentioned, manufacturing PMIs have started to tick up consistently among both advanced economies and emerging market economies."
300,CHAIR POWELL,"We do not see a decisive recovery, but it’s possible that this mix of positive developments and also accommodative financial conditions could spur further growth."
301,MICHAEL DERBY,"Hi, Mike Derby with Dow Jones."
302,MICHAEL DERBY,Do you have any greater sense of what—what was going wrong with the repo market starting in September?
303,MICHAEL DERBY,"There seemed to be, you know—whether it was a one-off event, you know, too tight around tax payments and debt settlement, or whether there’s a more enduring issue going on with the market, more structural forces that are basically gumming up the repo sector."
304,CHAIR POWELL,Yes.
305,CHAIR POWELL,"As for those forces, so, as we indicated, we would undertake a, you know, serious review of that question and look at both our regulations and also supervisory practices."
306,CHAIR POWELL,And we’d be prepared to adjust those in ways that might encourage liquidity to flow more easily in the system as long as it didn’t undermine safety and soundness.
307,CHAIR POWELL,"And so we’ve undertaken that, and we’ve done a ton of work, actually."
308,CHAIR POWELL,"We don’t have anything to announce here today, but I feel good about the—what we’ve learned there."
309,CHAIR POWELL,I think—you mentioned other factors.
310,CHAIR POWELL,We will be announcing our findings.
311,CHAIR POWELL,"I’m not going to give you a time, but we’re—we’re well along in that assessment at this time."
312,CHAIR POWELL,"I think we also found out, though, that the level of reserves that we need in the system to conduct our operations without frequent resort to open market operations was higher than we had thought and was higher than others had thought, too."
313,CHAIR POWELL,"We learned that we can’t let reserves—we shouldn’t let reserves go below $1½ trillion—roughly, the level of early September—at any point."
314,CHAIR POWELL,"And that means that reserves will move through in a range over the course of the year that will be substantially higher than $1½ [trillion], but they won’t ever go below."
315,CHAIR POWELL,So $1½ [trillion] is not a target level.
316,CHAIR POWELL,It is the bottom of a range in which reserves will be expected to move.
317,CHRISTOPHER RUGABER,"Hi, Mr. Chairman."
318,CHRISTOPHER RUGABER,I just wanted to ask about how your balance sheet operations and repo—temporary repos—how they affect the system and who they’re helping.
319,CHRISTOPHER RUGABER,"Clearly, they’re mostly designed, as you said, to get—keep the fed funds rate in the range you’re looking for."
320,CHRISTOPHER RUGABER,"But, certainly, the repo market is also used heavily by hedge funds and other Wall Street institutions."
321,CHRISTOPHER RUGABER,"And so, how would you explain to, sort of, Main Street why you’re doing all this for that market?"
322,CHRISTOPHER RUGABER,"And how would you address criticism that it is helping mostly Wall Street, along with everything else?"
323,CHRISTOPHER RUGABER,Thank you.
324,CHAIR POWELL,"Well, let me just stress that we have a very specific and important reason for caring about money market operations generally, and that just is that we are—our monetary policy decisions are transmitted through the financial markets—through the money markets into other financial markets and into broader financial conditions."
325,CHAIR POWELL,So we care that money markets are operating smoothly.
326,CHAIR POWELL,"And they stopped operating smoothly, briefly, back in September."
327,CHAIR POWELL,And so we acted.
328,CHAIR POWELL,This is a one-time thing that we’re doing to adjust the level of reserves so that the money markets will be able to operate smoothly on an ongoing basis.
329,CHAIR POWELL,"Repo markets are important, because that’s where Treasury securities—the purchase of Treasury securities, which is the way—you know, the federal—part of the way the federal government is funding its operations."
330,CHAIR POWELL,It’s the way those are financed.
331,CHAIR POWELL,"So these are largely Treasury securities that have been purchased by dealers to—for distribution to—and buyers, to a substantial extent."
332,CHAIR POWELL,That’s what’s going on in the Treasury repo market.
333,CHAIR POWELL,So it’s just the financing for—for that.
334,CHAIR POWELL,"Now, again, we don’t—that activity is a—is a market activity."
335,CHAIR POWELL,We’re not looking to eliminate volatility or protect anybody from volatility at all.
336,CHAIR POWELL,"What we care about is that volatility in the repo market can affect the transmission of—of our policy decisions to federal funds rate, and that really is important for the public."
337,NANCY MARSHALL-GENZER,Nancy Marshall-Genzer with Marketplace.
338,NANCY MARSHALL-GENZER,"Chair Powell, is the Fed going to vote tomorrow on changes to the Volcker rule restrictions on banks investing in venture capital funds?"
339,NANCY MARSHALL-GENZER,What can you tell us about what the Fed is considering?
340,NANCY MARSHALL-GENZER,And why make those changes?
341,CHAIR POWELL,Sure.
342,CHAIR POWELL,"So we will be looking tomorrow and voting on a—a new part of—part of the existing Volcker rule, and that is the covered fund provisions of the rule."
343,CHAIR POWELL,And we’ll be making a bunch of proposed revisions that we believe are faithful to both the letter and the spirit of the law.
344,CHAIR POWELL,"We’re going to put those proposals out for public discussion, and we’re going to listen carefully, as we always do, to public comments on those proposals."
345,CHAIR POWELL,"Again, we believe that they will be—and you’ll see them tomorrow—will be public—you know, will be publicly—we have a Board meeting tomorrow to do that."
346,NANCY MARSHALL-GENZER,"Now, is this just the venture capital funds, or are also you changing the rules for hedge funds and private equity funds?"
347,CHAIR POWELL,It’s covered funds.
348,CHAIR POWELL,It’s—so it’s that covered—so it’s not the proprietary trading part of Volcker.
349,CHAIR POWELL,It’s the covered funds part.
350,NANCY MARSHALL-GENZER,And is there a chance that banks could take this and run and maybe even get involved in mortgage-backed securities again and risky investments?
351,CHAIR POWELL,"You know, we’ll—we think that what we’re doing is—is very consistent with safety and soundness and absolutely consistent with the letter and spirit of the Volcker rule."
352,CHAIR POWELL,"We’ll be—we’ll be getting comments from people, and we’ll be looking into that question, among many others."
353,GREG ROBB,Thank you.
354,GREG ROBB,"Thank you, Chairman Powell."
355,GREG ROBB,I’d like to turn your attention back to China and the health of its financial sector in particular.
356,GREG ROBB,And I guess I’m basing my question on reading the transcripts from 2014 that came out earlier this month.
357,GREG ROBB,"Just—in March of that year, there was concern about the Chinese economy, and one of your colleagues on the FOMC at that time asked the staff about how the Chinese economy would hurt—hit the U.S. economy."
358,GREG ROBB,"And the staffer said that there was a—what they were worried about was that not only was the Chinese economy slowing down, but there was the financial sector."
359,GREG ROBB,"And the quote was: “There’s a tremendous amount of dodgy loans in China.” Now, I was wondering if you could give us an update on these problems in the Chinese financial sector."
360,GREG ROBB,"And how do you think it might impact the economy, particularly now that they’ve been hit by this unexpected shock?"
361,CHAIR POWELL,"Well, China has had a problem for some years, including from that period—2014 up until, I guess, ’17 or ’18, and I thought—which was essentially just a lot of debt for an emerging market."
362,CHAIR POWELL,"For an economy at the—at the stage of evolution of the Chinese economy, they had very high levels of debt—not sovereign debt the way we think of it, but more business debt—debt of state-owned enterprises and also just private businesses."
363,CHAIR POWELL,And a couple of years ago the authorities decided to try to get that under control—to stop the growth and to control it.
364,CHAIR POWELL,"And that—as I mentioned, that’s one of the reasons why Chinese growth slowed, and it’s one of the reasons why global growth slowed, because we felt that."
365,CHAIR POWELL,"And they’ve actually stuck to that even during this difficult period when they were experiencing, you know, strains from trade negotiations and that kind of thing."
366,CHAIR POWELL,"The authorities have stuck to that and have, again, continued to try to do that, so—to try to control the growth of debt."
367,CHAIR POWELL,And that’s important that they do that.
368,CHAIR POWELL,"We don’t think that—that there’s any imminent risk there, although you—as you point out, the coronavirus thing is a significant thing, which will—will have some effects on the Chinese economy, at least in the short term."
369,CHAIR POWELL,The Chinese economy is very important in the global economy now.
370,CHAIR POWELL,"And, you know, we—when China’s economy slows down, we do feel that—not as much as countries, though, that are near China or that trade more actively with China, like some of the Western European countries."
371,CHAIR POWELL,"We still have—you know, 85 percent of our economy is domestic."
372,CHAIR POWELL,"And we have a much smaller external sector, trade sector, than other economies just because of our physical location."
373,BRIAN CHEUNG,Hi.
374,BRIAN CHEUNG,"Brian Cheung here, Yahoo Finance."
375,BRIAN CHEUNG,"So the combination of T-bill purchases and repo operations have been described colloquially as “liquidity.” I’m just wondering if you semantically agree with that description—then, secondly, what the impact of that has been on risk assets."
376,BRIAN CHEUNG,"I don’t know if that’s something that, you know, the Board or Reserve Banks are formally looking into or just looking at what the effect of it has been."
377,BRIAN CHEUNG,How are you kind of thinking about that going forward?
378,BRIAN CHEUNG,Thanks.
379,CHAIR POWELL,"Well, so, two questions."
380,CHAIR POWELL,"I mean, in terms of liquidity, I think what we’re doing is what I said: We’re trying to raise the level of reserves back up to a level so that banks can meet their reserve requirements, and that there’s enough reserves in the system that we don’t see reserve scarcity, and we don’t have to use repo operations to provide additional reserves."
381,CHAIR POWELL,"So I think, as I mentioned, we believe we can get to that state at the current pace sometime in the second quarter."
382,CHAIR POWELL,"In terms of effects on risk assets, as I said earlier, it’s very hard to say what is affecting financial markets with any precision or confidence at a given time."
383,CHAIR POWELL,It’s not our intention to change the stance of monetary policy.
384,CHAIR POWELL,"These were designed to provide more reserves and, really, to do that in order to enable better transmission of our—of our rate decisions into the economy under our chosen framework."
385,CHAIR POWELL,That’s really the purpose of what we’re doing.
386,JEAN YUNG,Hi.
387,JEAN YUNG,Jean Yung with MNI.
388,JEAN YUNG,I wanted to ask about the framework review again.
389,JEAN YUNG,Would a shift of focus to inflation over an average period—would that call for a different policy stance if you made that shift?
390,JEAN YUNG,"And whether or not we know the answer to that question, would the Fed consider changing the stance of monetary policy for that reason even if there was no change to the economic outlook?"
391,CHAIR POWELL,"Well, as you know, we’re comfortable with our current policy stance."
392,CHAIR POWELL,We think it’s appropriate.
393,CHAIR POWELL,We think it’ll remain appropriate as long as data coming in are broadly in keeping with our outlook.
394,CHAIR POWELL,"Over time—over time, though—let me take a step back."
395,CHAIR POWELL,"Over time, an average inflation-targeting framework would be different than our current framework, in the sense that it wouldn’t be a—there would be some aspect of trying to make inflation average 2 percent over time, which means, if it runs below 2 percent for a time, it has to run above to bring the average up."
396,CHAIR POWELL,So that is a different framework.
397,CHAIR POWELL,Our current framework is one where we say—or we’d be equally concerned with deviations of inflation from target on either side.
