,speaker,sentence
0,CHAIRMAN BERNANKE,Good afternoon and welcome.
1,CHAIRMAN BERNANKE,In my opening remarks I will briefly review today’s policy decision by the Federal Open Market Committee.
2,CHAIRMAN BERNANKE,And then I’ll discuss next the consensus statement that has been distributed to you regarding the Committee’s longer-run policy goals and strategy.
3,CHAIRMAN BERNANKE,"And finally, I’ll place today’s policy decision in the context of our economic projections and our assessments of the appropriate path of monetary policy."
4,CHAIRMAN BERNANKE,"And I’ll then, of course, be glad to take your questions."
5,CHAIRMAN BERNANKE,"As indicated in the statement released earlier this afternoon, to support a stronger economic recovery and to help ensure that inflation, over time, is at levels consistent with our statutory mandate, the Committee expects to maintain a highly accommodative stance for monetary policy."
6,CHAIRMAN BERNANKE,"In particular, the Committee decided to keep the target range for the federal funds rate at 0 to ¼ percent and currently anticipates that economic conditions are likely to warrant exceptionally low levels for the federal funds rate at least until late 2014."
7,CHAIRMAN BERNANKE,"To provide support for the recovery in the context of price stability, the Committee will also continue the program that we announced in September to extend the average maturity of the Federal Reserve’s holdings of securities."
8,CHAIRMAN BERNANKE,"Following careful deliberations, Committee participants have reached broad agreement on a statement that sets forth our longer-run goals and policy strategy."
9,CHAIRMAN BERNANKE,This statement should not be interpreted as indicating any change in how the Federal Reserve conducts monetary policy.
10,CHAIRMAN BERNANKE,"Rather, its purpose is to increase the transparency and predictability of policy."
11,CHAIRMAN BERNANKE,"There is today widespread agreement that clear and transparent central bank communications facilitate well-informed decisionmaking by households and businesses, reduce economic and financial uncertainty, increase the effectiveness of monetary policy, and enhance accountability to the public."
12,CHAIRMAN BERNANKE,"The statement begins by noting the Committee’s firm commitment to fulfill our statutory mandate of promoting maximum employment, stable prices, and moderate long-term interest rates."
13,CHAIRMAN BERNANKE,"Since monetary policy actions tend to influence economic activity and prices with a lag, our decisions appropriately reflect the Committee’s longer-run goals, our medium-term outlook, and our assessment of the balance of risks, including risks to the financial system that could impede the attainment of our goals."
14,CHAIRMAN BERNANKE,An important aspect of policy transparency is clarity about policy objectives.
15,CHAIRMAN BERNANKE,"With respect to the objective of price stability, it is essential to recognize that the inflation rate over the longer run is primarily determined by monetary policy, and hence the Committee has the ability to specify a longer-run goal for inflation."
16,CHAIRMAN BERNANKE,"The Committee judges that inflation at the rate of 2 percent, as measured by the annual change in the price index for personal consumption expenditures, is most consistent over the longer run with our statutory mandate."
17,CHAIRMAN BERNANKE,"Over time, a higher inflation rate would reduce the public’s ability to make accurate longer-term economic and financial decisions, whereas a lower inflation rate would be associated with an elevated probability of falling into deflation, which can lead to significant economic problems."
18,CHAIRMAN BERNANKE,Clearly communicating to the public this 2 percent goal for inflation over the longer run should help foster price stability and moderate long-term interest rates and will enhance the Committee’s ability to promote maximum employment in the face of significant economic disturbances.
19,CHAIRMAN BERNANKE,Maximum employment stands on an equal footing with price stability as an objective of monetary policy.
20,CHAIRMAN BERNANKE,"A difference with price stability is that the maximum level of employment in a given economy is largely determined by nonmonetary factors that affect the structure and dynamics of the labor market, including demographic trends, the pace of technological innovation, and a variety of other influences, including a range of economic policies."
21,CHAIRMAN BERNANKE,"Because monetary policy does not determine the maximum level of employment that the economy can sustain in the longer term, and since many of the determinants of maximum employment may change over time or may not be directly measurable, it is not feasible for any central bank to specify a fixed goal for the longer-run level of employment."
22,CHAIRMAN BERNANKE,"Although the Committee cannot freely choose a longer-run goal for employment, it can estimate the level of maximum employment and use that estimate to inform its policy decisions."
23,CHAIRMAN BERNANKE,"The Committee considers a wide range of indicators in making its assessments of maximum employment, recognizing that such assessments are necessarily uncertain and subject to revision over time."
24,CHAIRMAN BERNANKE,"For example, in the latest set of projections that have been distributed to you, Committee participants’ estimates of the longer-run normal rate of unemployment have a central tendency of 5.2 percent to 6.0 percent—roughly unchanged from last January but higher than the corresponding interval several years ago."
25,CHAIRMAN BERNANKE,"As I noted, the level of maximum employment is not immutable; in particular, it could be increased by effective policies, such as education and training that improve workforce skills."
26,CHAIRMAN BERNANKE,"If the Committee’s assessments pointed to an increase in the maximum attainable level of employment, our policy strategy would be modified appropriately to aim at the higher level."
27,CHAIRMAN BERNANKE,"In setting monetary policy, the Committee seeks to mitigate deviations of inflation from its mandate-consistent rate and deviations of employment from our assessments of its maximum level."
28,CHAIRMAN BERNANKE,These dual objectives are generally complementary.
29,CHAIRMAN BERNANKE,"For example, under present circumstances, in which the unemployment rate is elevated and the inflation outlook is subdued, the Committee judges that sustaining a highly accommodative stance of monetary policy is consistent with promoting both objectives."
30,CHAIRMAN BERNANKE,"And in the longer term, low and stable inflation can help promote healthy growth in output and employment."
31,CHAIRMAN BERNANKE,"Of course, circumstances may sometimes arise in which the dual objectives are not complementary."
32,CHAIRMAN BERNANKE,"In such cases, the Committee follows a balanced approach in promoting these two objectives, taking into account the magnitude of the deviations and potentially different time horizons over which inflation and employment are projected to return to levels judged consistent with our mandate."
33,CHAIRMAN BERNANKE,"In other words, the Committee always treats its primary objectives of price stability and maximum employment symmetrically, and the stance of policy at any given time is determined by the size, social cost, and expected evolution of the deviations of each of the Committee’s policy objectives from its desired level."
34,CHAIRMAN BERNANKE,"I will now turn to the economic projections of the 17 FOMC participants—that is, 5 Board members and 12 Reserve Bank presidents—submitted in conjunction with today’s meeting."
35,CHAIRMAN BERNANKE,The central tendencies and ranges of those projections for the years 2011 to 2014 and over the longer run are depicted in the figures that have been distributed.
36,CHAIRMAN BERNANKE,The longer-run projections—shown at the right of each figure—represent participants’ assessments of the rate to which each variable will converge over time under appropriate monetary policy and in the absence of further shocks to the economy.
37,CHAIRMAN BERNANKE,"Incoming information suggests that the economy has been expanding moderately, notwithstanding some slowing in global growth."
38,CHAIRMAN BERNANKE,"The Committee expects the pace of economic growth to be, over coming quarters—to be moderate over coming quarters, reflecting ongoing drags from the housing sector and still-tight credit conditions for many households and smaller businesses."
39,CHAIRMAN BERNANKE,"Specifically, participants’ projections for the growth rate of real gross domestic January 25, 2012 FINAL product in 2012 have a central tendency of 2.2 to 2.7 percent."
40,CHAIRMAN BERNANKE,Strains in global financial markets Chairman Bernanke’s Press Conference continue to pose significant downside risks to that outlook.
41,CHAIRMAN BERNANKE,"Looking further ahead, economic activity is expected to accelerate gradually in conjunction with strengthening consumer and business confidence, improving financial conditions, and the continuation of a highly accommodative stance for monetary policy."
42,CHAIRMAN BERNANKE,"Specifically, participants’ GDP projections for 2013 have a central tendency of 2.8 to 3.2 percent, and their projections for 2014 have a central tendency of 3.3 to 4.0 percent, noticeably higher than the central tendency of 2.3 to 2.6 percent for their longer-run growth projections."
43,CHAIRMAN BERNANKE,"A number of recent indicators point to some further improvement in overall labor market conditions, but the unemployment rate remains elevated."
44,CHAIRMAN BERNANKE,"Moreover, in light of the anticipated modest pace of economic recovery, the Committee expects that over coming quarters the unemployment rate will decline only gradually toward its mandate-consistent levels."
45,CHAIRMAN BERNANKE,"Indeed, participants’ projections for the unemployment rate in the fourth quarter of this year have a central tendency of 8.2 to 8.5 percent that is little different from the latest monthly reading of 8.5 percent."
46,CHAIRMAN BERNANKE,"With economic growth expected to pick up somewhat over time, the unemployment rate is expected to decline to 6.7 to 7.6 percent by the fourth quarter of 2014—still well above participants’ estimates of the longer-run normal rate of unemployment."
47,CHAIRMAN BERNANKE,I’ll turn now to the outlook for inflation.
48,CHAIRMAN BERNANKE,"The prices of oil and other commodities have generally flattened out or turned downward over the past couple of quarters, while low levels of resource utilization have continued to constrain the growth of labor costs."
49,CHAIRMAN BERNANKE,"Consequently, consumer price inflation—which surged in the first half of last year—has been subdued in recent months."
50,CHAIRMAN BERNANKE,Survey measures and financial market indicators imply that longer-term inflation expectations have remained stable.
51,CHAIRMAN BERNANKE,"Over coming quarters, the Committee anticipates that inflation will run at or below levels consistent with the mandate-consistent rate of 2 percent."
52,CHAIRMAN BERNANKE,"Specifically, participants’ inflation projections have a central tendency of 1.4 to 1.8 percent for 2012 and remain subdued at around 1½ to 2 percent through 2014."
53,CHAIRMAN BERNANKE,"As a further step in enhancing the clarity of our communications, the Committee recently decided to begin publishing information about participants’ assessments of appropriate monetary policy—that is, the path of policy that each participant judges as most likely to foster mandate-consistent outcomes for employment and inflation if the economy evolves as expected."
54,CHAIRMAN BERNANKE,"These judgments about future policy underlie the participants’ projections of growth, unemployment, and inflation that I just described."
55,CHAIRMAN BERNANKE,"Rather—excuse me—Importantly, these policy assessments should not be viewed as unconditional pledges."
56,CHAIRMAN BERNANKE,"Rather, just as with our economic projections, these policy projections reflect the information available at the time of the forecast and are subject to future revision in light of evolving economic and financial conditions."
57,CHAIRMAN BERNANKE,"In the chart labeled “Appropriate Timing of Policy Firming,” each shaded bar indicates the number of Committee participants who judge that the initial increase in the target federal funds rate would appropriately occur in the specified calendar year shown below the bar."
58,CHAIRMAN BERNANKE,"Six participants anticipate that policy firming is likely to commence in 2015 or 2016, while five others expect policy firming to commence in 2014."
59,CHAIRMAN BERNANKE,The remaining six participants judge that policy liftoff would be appropriate in 2012 or 2013.
60,CHAIRMAN BERNANKE,"More detail is provided by the chart labeled “Appropriate Pace of Policy Firming.” In that chart, the dots depict the distribution of participants’ assessments regarding the appropriate level of the target federal funds rate at the end of each of the next several years and over the longer run."
61,CHAIRMAN BERNANKE,"For example, based on current information, 11 participants expect that the appropriate federal funds rate at the end of 2014 will be at or below 1 percent, while 6 participants anticipate higher rates at that time."
62,CHAIRMAN BERNANKE,"In effect, those judgments are reflected in today’s meeting statement, in which the Committee indicated that economic conditions “are likely to warrant exceptionally low levels for the federal funds rate at least through late 2014.” As I have noted, we are also proceeding with the program that we announced in September to extend the average maturity of the Federal Reserve’s holding of securities, thereby fostering more accommodative financial conditions without changing the overall size of the Federal Reserve’s balance sheet."
63,CHAIRMAN BERNANKE,"The Committee regularly reviews the size and composition of our securities holdings, and we will adjust those holdings as appropriate."
64,CHAIRMAN BERNANKE,"In particular, the Committee recognizes the hardships imposed by high and persistent unemployment and an underperforming economy, and it is prepared to provide further monetary accommodation if employment is not making sufficient progress toward our assessments of its maximum level or if inflation shows signs of moving further below its mandate-consistent rate."
65,CHAIRMAN BERNANKE,Thank you for your patience.
66,CHAIRMAN BERNANKE,I’ll be happy to take your questions.
67,STEVE LIESMAN,Thank you.
68,STEVE LIESMAN,"Steve Liesman, CNBC."
69,STEVE LIESMAN,"Mr. Chairman, we’ve had several months of economic data that’s been stronger than most forecasters expected—employment was over 200,000, the unemployment rate’s come down to 8½ percent—but there seems to be very little mention of this recent strength in the statement."
70,STEVE LIESMAN,"Do you and the Committee, Mr. Chairman, harbor doubts about the recent strength in the economy?"
71,STEVE LIESMAN,And are you and the Committee baking in additional quantitative easing in order to achieve the growth rates that you’ve even forecast here?
72,STEVE LIESMAN,Thank you.
73,CHAIRMAN BERNANKE,"Steve, there’s certainly been some encouraging news recently."
74,CHAIRMAN BERNANKE,"We’ve seen slightly better performance in the labor market, consumer sentiment has improved, industrial production has been relatively strong—so there are some positive signs, no doubt."
75,CHAIRMAN BERNANKE,"At the same time, we’ve had mixed results in some other areas, such as retail sales, and we continue to see headwinds emanating from Europe, coming from the slowing global economy and some other factors as well."
76,CHAIRMAN BERNANKE,"So, you know, we are obviously hoping that the strength we saw in the fourth quarter and in recent data will continue into 2012, but we’re going to continue to monitor that situation."
77,CHAIRMAN BERNANKE,"I don’t think we’re ready to declare that we’ve entered a new, stronger phase at this point; we’ll continue to look at the data."
78,CHAIRMAN BERNANKE,"We will, as I’ve said in my statement, and as we have in fact in the FOMC statement, you know, we continue to review our holdings—our portfolio holdings, securities, and we are prepared to take further steps in that direction if we see that the recovery’s faltering or if inflation is not moving toward target."
79,CHAIRMAN BERNANKE,So that’s something—that’s an option that’s certainly on the table.
80,CHAIRMAN BERNANKE,"I think it would be premature to say definitively one way or the other, but we continue to look at that option, and if conditions warrant, we will certainly consider using it."
81,BINYAMIN APPELBAUM,Thank you.
82,BINYAMIN APPELBAUM,I’m a little confused by these forecasts.
83,BINYAMIN APPELBAUM,I was hoping you could sort of help me understand what we’re looking at.
84,BINYAMIN APPELBAUM,"It seems to say that you expect that at the end of 2014, unemployment will be at or above 7 percent, inflation will be at or below 2 percent—and yet 11 of the 17 members of your Committee think that will be a good moment to start raising interest rates again."
85,BINYAMIN APPELBAUM,"If unemployment and inflation are in fact symmetric objectives for the Fed, how can that possibly be the case?"
86,BINYAMIN APPELBAUM,And is there any tolerance for above-trend inflation in the service of catch-up growth?
87,CHAIRMAN BERNANKE,"Well, let me first observe that we have in fact, of course, been very accommodative in the last couple of years."
88,CHAIRMAN BERNANKE,"We’ve kept interest rates close to zero, we’ve done two rounds of asset purchases, we have announced—today, in fact—an extension of the period over which we expect to see rates very low, and our maturity extension program is still ongoing, so we maintain a quite accommodative path of policy at this point."
89,CHAIRMAN BERNANKE,I would further say that I think it’s important to emphasize that we’re not going to mechanically take the interest rate projections that participants provide and just build policy off of that.
90,CHAIRMAN BERNANKE,"I mean, it’s still going to be necessary for the Committee to exercise collective judgment, to consider the costs and risks of additional policy actions, to discuss the uncertainty about the forecast and other factors that come into the policy decision."
91,CHAIRMAN BERNANKE,"Now, all that being said, if inflation is going to remain below target for an extended period, and unemployment progress is very slow, then I think your implicit question is right, there is a case for additional policy action, and we’ll—you know, we want to continue to observe the situation, but we’re certainly prepared to look for different ways to provide support to the economy if, in fact, we have this unsatisfactory situation."
92,CRAIG TORRES,"Hi, Mr. Chairman, Craig Torres from Bloomberg News."
93,CRAIG TORRES,"Congrats on the inflation target, or goal—that’s a big achievement for you, I’m sure."
94,CRAIG TORRES,I’d like to ask if you could explain a little bit the way you think inflation is now working in the economy.
95,CRAIG TORRES,"The 2012 central tendency is kind of low, and along with that question, I’d like to know where you think full employment is in the near term, like the next year or two, given the structural impediments that many Fed officials have been talking about."
96,CHAIRMAN BERNANKE,"Well, there are a number of factors that make us expect inflation to be quite low in the next couple of years."
97,CHAIRMAN BERNANKE,"Certainly, we are seeing a reversal, or at least a flattening out, of the commodity price increases that caused headline inflation to rise earlier in 2011."
98,CHAIRMAN BERNANKE,"And the futures markets, and our own estimates of supply and demand globally with the slowing global economy, suggest that most likely—although, of course, there’s a lot of uncertainty—that commodity prices will remain well controlled over the next couple of years."
99,CHAIRMAN BERNANKE,"On top of that, of course, we have a very high rate of unemployment; pressure on wages is quite restrained."
100,CHAIRMAN BERNANKE,"And putting that together with strong productivity gains, the costs of production—unit labor costs—are growing very slowly."
101,CHAIRMAN BERNANKE,"Expectations of inflation seem well anchored and, in fact, have been on the low side relative to recent history in recent months."
102,CHAIRMAN BERNANKE,"So for all those reasons, inflation looks to be at or modestly below the 2 percent target going forward."
103,CHAIRMAN BERNANKE,"With respect to the maximum employment measure, we provided a—we have been providing, in fact, for four years, as long as we’ve been providing the economic projections—an estimate of the long-run sustainable rate of unemployment, which is currently—the central tendency is currently 5.2 to 6 percent."
104,CHAIRMAN BERNANKE,"That is higher than it was a couple of years ago, reflecting structural impediments and other changes."
105,CHAIRMAN BERNANKE,"We’re concerned that the large amount of long-term unemployment may be causing some workers to lose skills or lose labor force attachment, which, at least for a while, will also likely increase the so-called natural rate, or sustainable rate, of unemployment."
106,CHAIRMAN BERNANKE,So there are a number of factors working in that direction.
107,CHAIRMAN BERNANKE,"But in any case, while there’s certainly a lot of uncertainty about exactly where the natural rate of unemployment is, clearly, at 8½ percent, I think we’re comfortably above anybody’s estimate, and for that reason, we still consider the labor market to be obviously quite slack."
108,JON HILSENRATH,Thank you.
109,JON HILSENRATH,Jon Hilsenrath from the Wall Street Journal.
110,JON HILSENRATH,"Mr. Chairman, how much confidence do you have in the FOMC’s ability to forecast the economy and inflation out three years?"
111,JON HILSENRATH,"And consequently, how much confidence do you have in the interest rate projections that the Fed has made public today, particularly the ones that go out to 2014 and beyond?"
112,JON HILSENRATH,"And if I may add a follow-up to that, there seems to be an asymmetry in these dots in that there’s a view that the view that matters the most to the Fed is the view of the Chairman."
113,JON HILSENRATH,"So when we look at these projections, are we really seeing the most likely expected path of interest rates because the Chairman’s view isn’t represented exclusively here?"
114,CHAIRMAN BERNANKE,"Well, your first question—our ability to forecast three and four years out is obviously very limited, there’s no question about that."
115,CHAIRMAN BERNANKE,"Nevertheless, we have to make a best guess, a provisional plan, in the same way that a firm making an investment has to make a best guess or provisional plan about where the economy and the industry is going to be over a number of years."
116,CHAIRMAN BERNANKE,"And so it’s certainly possible that we will be either too optimistic or too pessimistic, in which case we’ll have to adjust both our forecasts and our policy expectations."
117,CHAIRMAN BERNANKE,"That being said, you know, currently, the zero lower bound on policy rates—at least according to many estimates—is still binding; that is, even if the economy were a bit stronger, the very low interest rates we currently have would still be valid, still be appropriate."
118,CHAIRMAN BERNANKE,"And so for that reason, unless there’s a substantial strengthening of the economy in the near term, I would think that it’s a pretty good guess that we will be keeping rates low for some time from now."
119,CHAIRMAN BERNANKE,We don’t identify the specific individuals who provide the projections.
120,CHAIRMAN BERNANKE,"Among other reasons, we want to make sure that people come to the meeting willing to talk and not be wedded to a specific position, and that’s why, again, the Committee makes a collective decision after using as input these projections, which are circulated to all the members of the Committee before the meeting so that they can see what their colleagues believe."
121,CHAIRMAN BERNANKE,"As far as what individual members do believe, we certainly have other vehicles for expressing our views."
122,CHAIRMAN BERNANKE,"All of us give speeches, all of us give interviews and are—you know, I give frequent testimony, so there are plenty of opportunities to get a sense of what individual members believe."
123,CHAIRMAN BERNANKE,"But again, we felt that this information, which presents both the diversity of views in the Committee but also shows where the central tendencies lie, would be useful."
124,CHAIRMAN BERNANKE,"And I guess I might add to that, you know, the Chairman’s term is not infinite and at some point there’ll be a new Chairman, but there’s a lot more continuity on the FOMC collectively."
125,CHAIRMAN BERNANKE,The average Bank president is on the FOMC for as much as 10 years and Governors’ terms are 14 years.
126,CHAIRMAN BERNANKE,"So even as the Chairman changes, much of the FOMC remains continuous."
127,CHAIRMAN BERNANKE,"So, as we talk about interest rates in 2014, the fact that there is quite wide-ranging agreement that interest rates will be low for a long time, should give you more confidence that that’s not dependent on a single individual."
128,GREG IP,Greg Ip of the Economist.
