,speaker,sentence
148,JIM PUZZANGHERA,"I’m wondering, now, in the past few weeks as Chairwoman, what’s been different about being on the Fed in your responsibilities as Chair, compared to being just a Board of Governors member?"
149,CHAIR YELLEN,"Well, thanks."
150,CHAIR YELLEN,"I feel I’m very lucky that I’ve had a lot of Fed experience to draw on as I approach this role because it’s complicated, and now in many ways I feel the buck stops with me in terms of management of the FOMC and responsibility to assure that the Federal Reserve makes progress on its goals of getting the economy back on track and making progress on our financial stability and regulation objectives."
151,CHAIR YELLEN,"So I feel that weight of responsibility keenly in the new role I have, and I’m very committed to making sure that I provide the leadership that’s necessary for the Federal Reserve System to move forward on these goals."
152,CHAIR YELLEN,"But, you know, in terms of the conduct of business, it’s pretty much the same as usual."
153,CHAIR YELLEN,"I’m not envisioning, nor have there been so far, any radical changes in how the Federal Reserve does its business, and that includes operating the FOMC."
154,ROBIN HARDING,Robin Harding from the Financial Times.
155,ROBIN HARDING,"Madam Chair, given that the new qualitative guidance doesn’t give any information about how you will trade off your unemployment and inflation objectives, does it actually give us any information?"
156,ROBIN HARDING,How will you trade off the risk of higher inflation versus faster progress on unemployment as you get closer to full employment?
157,ROBIN HARDING,Thank you.
158,CHAIR YELLEN,"So, I’d say so far we haven’t had that tradeoff to make because inflation is running well below our objective, and by any measure there remains substantial slack in the labor market."
159,CHAIR YELLEN,"So tradeoffs and worrying about doing more or less because we have conflicting objectives, this really has not been an element in our discussions about how to be conducting policy now."
160,CHAIR YELLEN,"As we get closer to meeting our goals, it could become an element, and I would say that we’ve given guidance in the statement—and we gave perhaps more guidance in our so-called consensus statement or statement of longer-run goals and monetary policy strategies that we’ve now reaffirmed for three years in a row—that the Committee would take a balanced approach in situations where our objectives conflict and we’re faced with tradeoffs between inflation and unemployment."
161,CHAIR YELLEN,"When we first put our thresholds into effect, we envisioned a possible situation where such a tradeoff could arise, where we might face a situation where unemployment was quite high—namely, over 6½ percent—and inflation might be drifting close to 2 or even a little bit above 2."
162,CHAIR YELLEN,And our threshold-based guidance gave some more concrete indication that we would tolerate inflation running a little bit over 2 percent with unemployment sufficiently high before moving the federal funds rate off zero.
163,CHAIR YELLEN,"And to the extent that that concrete guidance is useful, the—I don’t believe that’s a situation that we’re likely—if I thought that that was a situation we were likely to encounter in the next several years, we probably would have revised our forward guidance in a different way."
164,CHAIR YELLEN,"We revised it as we did, eliminating that language, because it doesn’t seem like a situation that’s at all likely."
165,CHAIR YELLEN,"But I would point you to the statement—the final statement in this statement that says that the FOMC does not see this guidance as indicating any change in our policy intentions, and I would include how we would make tradeoffs between our inflation and employment objectives if we were to face that situation."
166,ANN SAPHIR,Ann Saphir with Reuters.
167,ANN SAPHIR,"First, I just wanted a quick clarification."
168,ANN SAPHIR,"You said that something would happen by next fall, and we—on a clear path—on a path until next fall."
169,ANN SAPHIR,I was unclear if you were speaking of rate hikes or if you were speaking— CHAIR YELLEN.
170,ANN SAPHIR,"I simply meant to say that if we continued to reduce the pace of our asset purchases in the manner that we have, in measured steps, that the program would be winding down next fall."
171,ANN SAPHIR,"In this coming fall, you mean, not the fall of next year, is that—just— CHAIR YELLEN."
172,ANN SAPHIR,"Yes, this coming fall."
173,ANN SAPHIR,To be clear—I just wanted to be clear about that.
174,ANN SAPHIR,"Then once you do wind down the bond buying program, could you tell us how long of a gap we might expect before the rate hikes do begin?"
175,CHAIR YELLEN,"So, the language that we use in the statement is “considerable” period."
176,CHAIR YELLEN,"So, I—you know, this is the kind of term—it’s hard to define."
177,CHAIR YELLEN,"But, you know, it probably means something on the order of around six months or that type of thing."
178,CHAIR YELLEN,"But, you know, it depends."
179,CHAIR YELLEN,"What the statement is saying is, it depends what conditions are like."
180,CHAIR YELLEN,"We need to see where the labor market is, how close are we to our full employment goal—that will be a complicated assessment not just based on a single statistic—and how rapidly are we moving toward it?"
181,CHAIR YELLEN,Are we really close and moving fast?
182,CHAIR YELLEN,Or are we getting closer but moving very slowly?
183,CHAIR YELLEN,"And then, what the statement emphasizes, and this is the same language we used in December and January, we used the language especially if inflation is running below our 2 percent objective."
184,CHAIR YELLEN,"Inflation matters here, too, and our general principle tries to capture that notion."
185,CHAIR YELLEN,"If we have a substantial shortfall in inflation, if inflation is persistently running below our 2 percent objective, that is a very good reason to hold the funds rate at its present range for longer."
186,BINYAMIN APPELBAUM,"The Committee’s Vice Chairman, Bill Dudley, said recently, “If the economy decided it was going to grow at 5 percent or the economy decided it wasn’t going to grow at all, those would be the kind of changes in the outlook that I think would warrant changing the pace of taper[ing].” Is that an accurate description of what you mean when you say that you’re not on a preset course, anything between zero to five?"
187,BINYAMIN APPELBAUM,"And, secondly, if I may, there’s a lot of research showing that short-term unemployment seems to be responsible for the level of inflation and that long-term unemployment seems relatively uncorrelated."
188,BINYAMIN APPELBAUM,Is that the Fed’s view at this point?
189,BINYAMIN APPELBAUM,Is that one reason that you expect inflation to rebound in the next couple of years?
190,CHAIR YELLEN,So I think the numbers you cited would be extremes in terms of defining what we’d need to see.
191,CHAIR YELLEN,I wouldn’t go to such extremes.
192,CHAIR YELLEN,I guess the way I would put it is this: There are two conditions for the Committee to decide to continue tapering the pace of purchases.
193,CHAIR YELLEN,The first is that we need to assess that the labor market continues to be on the mend and that we feel reasonably satisfied that the outlook is for further improvement in the labor market that will get us back to our maximum employment objective.
194,CHAIR YELLEN,"And, second of all, we need to see—and now coming back to inflation again—inflation is low, and it’s been running well below our objective."
195,CHAIR YELLEN,"And we need to see evidence that leaves us feeling satisfied that inflation will move up over time, that we believe the evidence is consistent with its moving up over time."
196,CHAIR YELLEN,"If the Committee no longer feels comfortable making such assessments—so, if there is enough change in the data we’re seeing about the economy that it no longer seems reasonable or convincing to make those two separate assessments, then a case has been made to change the pace of asset purchases and to deviate from the current plan."
197,CHAIR YELLEN,"So 5 percent and 1 percent, those are very extreme numbers."
198,CHAIR YELLEN,But I would want to feel confident in making those two statements about the labor market and inflation.
199,CHAIR YELLEN,"With respect to the issue of short-term unemployment and its being more relevant for inflation and a better measure of the labor market, I’ve seen research along those lines."
200,CHAIR YELLEN,I think it would be tremendously premature to adopt any notion that says that that is an accurate read on either how inflation is determined or what constitutes slack in the labor market.
201,CHAIR YELLEN,"So I think this is something our Committee will be looking at, especially as unemployment goes down and other labor market indicators hopefully simultaneously improve."
202,CHAIR YELLEN,We’ll be looking at a broad range of indicators.
203,CHAIR YELLEN,"We’re looking to see progress on many different dimensions where we see slack in the economy, but I wouldn’t endorse, and I certainly don’t think our Committee would endorse, the judgment of the research that you cited."
204,JEFF KEARNS,Jeff Kearns from Bloomberg News.
205,JEFF KEARNS,You’ve spoken in the past about—thinking about back to March of last year—of how you supplement your view of the labor market beyond unemployment with other gauges like quit rates and layoffs and things like that.
206,JEFF KEARNS,"How has your dashboard evolved in the past few months in terms both of the—which indicators you like to watch most, and also in terms of the quality of data that you think—whether it’s positive, negative—that you’re getting from these indicators."
207,JEFF KEARNS,Thank you.
208,CHAIR YELLEN,So I have talked in the past about indicators I like to watch or I think that are relevant in assessing the labor market.
209,CHAIR YELLEN,"In addition to the standard unemployment rate, I certainly look at broader measures of unemployment."
210,CHAIR YELLEN,I mentioned U-6 in my statement.
211,CHAIR YELLEN,"It—5 percent of the labor force working part time on an involuntary basis, that’s an exceptionally high number relative to the measured unemployment rate, and it—so, to my mind, is a form of slack that is—adds to what we see in the normal unemployment rate and is unusually large."
212,CHAIR YELLEN,"However, it is coming down, as well as U-3."
213,CHAIR YELLEN,It’s moving in the right direction and has moved even more recently than U-3.
214,CHAIR YELLEN,"Of course, I watch discouraged and marginally attached workers."
215,CHAIR YELLEN,"The share of long-term unemployment has been immensely high and can be very stubborn in bringing down, that’s something that I watch closely."
216,CHAIR YELLEN,"Again, that remains exceptionally high, but it has come down from something like 45 percent to high 30s, but that’s certainly on my dashboard."
217,CHAIR YELLEN,"Labor force participation—I do think most research suggests that due to demographic factors, labor force participation will be coming down, and there has been a downward trend now for a number of years."
218,CHAIR YELLEN,But I think there is also a cyclical component in the fact that labor force participation is depressed.
219,CHAIR YELLEN,"And so, it may be that as the economy begins to strengthen, we could see labor force participation flatten out for a time as discouraged workers start moving back into the labor market."
220,CHAIR YELLEN,And so that’s something I’m watching closely.
221,CHAIR YELLEN,"In the Committee, we’ll have to watch—there are different views on this within the Committee, and it’s hard to know definitively what part of labor force participation is structural versus cyclical, so it’s something to watch closely."
222,CHAIR YELLEN,"I’ve also mentioned, in the past, measures of labor market turnover."
223,CHAIR YELLEN,You mentioned quits.
224,CHAIR YELLEN,"A remarkably large share of workers quit their jobs every month, usually going directly into another job."
225,CHAIR YELLEN,And I take the quit rate in many ways as a sign of the health of the economy.
226,CHAIR YELLEN,"When workers are scared they won’t be able to get other jobs, they show a reduced willingness to quit their jobs."
227,CHAIR YELLEN,"Now, quit rates now are below normal pre-recession levels, but on the other hand, they have come up over time, and so we have seen improvement."
228,CHAIR YELLEN,The job opening rate has also come up.
229,CHAIR YELLEN,"The hires rate, however, remains extremely depressed, and I take that as a sign of a weaker labor market."
230,CHAIR YELLEN,"But most of these measures, although they don’t paint the identical extent of improvement, if you ask about my dashboard, the dial on virtually all of those things is moving in a direction of improvement."
231,CHAIR YELLEN,"The final thing I’d mention is wages, and wage growth has really been very low."
232,CHAIR YELLEN,"I know there is perhaps one isolated measure of wage growth that suggests some uptick, but most measures of wage increase are running at very low levels."
233,CHAIR YELLEN,"In fact, with the productivity growth we have and 2 percent inflation, one would probably expect to see, on an ongoing basis, something between—perhaps 3 and 4 percent wage inflation would be normal."
234,CHAIR YELLEN,Wage inflation has been running at 2 percent.
235,CHAIR YELLEN,"So not only is it depressed, signaling weakness in the labor market, but it is certainly not flashing."
236,CHAIR YELLEN,"An increase in it might signal some tightening or meaningful pressures on inflation, at least over time."
237,CHAIR YELLEN,And I would say we’re not seeing that.
238,WYATT ANDREWS,"Madam Chair, Wyatt Andrews from CBS."
239,WYATT ANDREWS,"For tens of millions of Americans, the recovery is an awful long time coming."
240,WYATT ANDREWS,"May we know your thoughts on why the recovery is so slow, and why the economy is not creating more jobs?"
241,CHAIR YELLEN,"Well, I think the short answer is that we have lived through a devastating financial crisis that has taken an exceptional toll on the economy in many different ways, from housing to leaving a huge number of homeowners with mortgages living in homes with mortgages that are underwater, has had a highly negative effect on their credit ratings and their ability to access credit, has left businesses with very cautious attitudes that we see in business investment spending that is very restrained."
242,CHAIR YELLEN,"On top of that, we’ve had weakness in the global economy, and we’ve had a very tight fiscal policy at home."
243,CHAIR YELLEN,"After stimulus at the onset of the recession, we’ve had a good deal of fiscal consolidation in the United States and, at a time when fiscal policy normally in the past would have been serving to create jobs, fiscal policy from that standpoint has served as a headwind to the recovery."
244,CHAIR YELLEN,"And at the federal—especially at the federal level, but also with state and local levels as well."
245,CHAIR YELLEN,And so we have had a disappointing recovery.
246,CHAIR YELLEN,And monetary policy has tried to do what we can to offset that.
247,CHAIR YELLEN,"But, you know, the linkages aren’t as strong and aren’t as quick as we might ideally like them to be."
248,GREG ROBB,Thank you.
249,GREG ROBB,"I’d like to take you back to last summer when there were hints—the Fed made hints that they were going to taper, and long-term interest rates spiked, mortgage rates rose."
250,GREG ROBB,"What lessons—looking back at that crisis, at that period, what lessons have you learned from it, and are you confident that you won’t repeat that—those mistakes again?"
251,CHAIR YELLEN,"Well, I think there were quite a number of things happening at that time."
252,CHAIR YELLEN,"I think it’s probably true that monetary policy may have played a role in touching off that market reaction, but I think the market reaction was exacerbated by the fact that we had a very significant unwinding of carry trades and other leveraged positions that investors had taken, perhaps thinking that the level of volatility was exceptionally low and perhaps lower than was safe for them to have assumed."
253,CHAIR YELLEN,"But we certainly saw—now, in some ways, the fact that term premia in interest rates have come up somewhat, although it has had a negative effect on the recovery and that’s evident in housing—in the slowdown in housing—perhaps it’s diminished some financial instability risk that may have been associated with these carry trades and speculative activities that were unwinding during that time."
254,CHAIR YELLEN,"A lesson is that we will try, and we were trying then, but we will continue to try to communicate as clearly as we possibly can about how we will conduct monetary policy and to be as steady and determined and as transparent as we can to provide as much clarity as is reasonably certain—given that the economic developments in the economy are themselves uncertain—but we will try as hard as we can not to be a source of instability here."
255,REBECCA JARVIS,"Madam Chair, Rebecca Jarvis, ABC News."
256,REBECCA JARVIS,"One of the drivers last spring and summer of home prices and home sales was that sense that interest rates were going up, that they were spiking."
257,REBECCA JARVIS,"And now, a year later, we’re looking essentially at a flat interest rate picture as far as homebuyers are concerned."
258,REBECCA JARVIS,"So, is there any sense on your Committee that staying at this level loses its punch the longer we remain here?"
259,REBECCA JARVIS,"And if I’m a buyer, and I’m thinking about going out and buying a home, why should I do that today as opposed to waiting a few more years or even months before interest rates then do go up?"
260,CHAIR YELLEN,"Well, I think the level of interest rates remains low by historic levels."
261,CHAIR YELLEN,"And the level of household formation is very depressed, has been very depressed for some time."
262,CHAIR YELLEN,"There are a lot of kids who were shacking up with their families and probably would like to be going out and acquiring places of their own, whether it’s an apartment or a home."
263,CHAIR YELLEN,"There’s a lot of demographic potential there for new household formation that would ultimately generate new construction, either single or multifamily, and the level of rates I think does matter."
264,CHAIR YELLEN,"And the fact that they’re low now, I think, is something that should serve as a stimulus to people coming back into the housing market."
265,CHAIR YELLEN,"And what we’ve not yet seen—the pickup after the lull—after interest rates went up last summer, I do expect housing activity to begin to expand more rapidly later on."
266,CHAIR YELLEN,I don’t think it’s only the expectation that “I have to move now or things will be more expensive later” that spurs those decisions.
267,CHAIR YELLEN,So— KATE DAVIDSON.
268,CHAIR YELLEN,"Hi, Kate Davidson from Politico."
269,CHAIR YELLEN,Much has been made about the fact that you and your predecessor agreed on many policies.
270,CHAIR YELLEN,You shared a lot of the same policy views.
271,CHAIR YELLEN,Can you tell us one way in which your chairmanship will be different than Ben Bernanke’s?
272,CHAIR YELLEN,"Well, I think we are committed to exactly the same set of goals."
273,CHAIR YELLEN,"And, you know, as I indicated, I—my goal, and I will, you know, throw myself into this as wholeheartedly as I can, is to make rapid progress, as rapid progress as we possibly can in getting this recovery back on track and putting Americans back to work and into jobs, and in moving inflation back up to levels at the Committee’s target of 2 percent."
274,CHAIR YELLEN,My predecessor was also devoted to that.
275,CHAIR YELLEN,"Strengthening the financial system is a work in progress, and he made large inroads in strengthening the financial system."
276,CHAIR YELLEN,"I’d just say, there is more work to be done, I have a long to-do list."
277,CHAIR YELLEN,I would absolutely—it’s high priority for me to see further work done in addressing too-big-to-fail.
278,CHAIR YELLEN,"We have a to-do list of things we want to accomplish, and in assessing threats to financial stability because neither one of us—and no one wants to live through a financial crisis like the last one, and we want to be extremely cognizant of emerging threats to the financial system."
279,CHAIR YELLEN,"So I haven’t answered your question by saying that I will be different, but I think he had a very good agenda, and it’s one I shared."
280,CHAIR YELLEN,"It’s why I came to Washington to be Vice Chair, and it’s the agenda I expect to continue pursuing."
281,PETER BARNES,"Madam Chair, Peter Barnes of Fox Business."
282,PETER BARNES,I wanted to talk about international developments and the crisis in the Ukraine.
283,PETER BARNES,Is the crisis a headwind for the U.S. economy?
284,PETER BARNES,"Are there risks to the U.S. economy and the U.S. banking system, directly and indirectly?"
285,PETER BARNES,And did the Russians move $100 billion in U.S. Treasury securities out of the United States in the last couple of weeks to avoid U.S. sanctions?
286,PETER BARNES,Those are—those foreign securities are held by the Fed.
287,PETER BARNES,Thank you.
288,CHAIR YELLEN,So let me start with the last piece of your question first.
289,CHAIR YELLEN,"I’m sorry, I—movements in custodial accounts at the New York Fed are something that I can’t—I’m not in the position to be able to comment about."
290,CHAIR YELLEN,"But in terms of the situation in Ukraine and Russia, it’s something that we’re monitoring very closely."
291,CHAIR YELLEN,We discussed in our meeting the direct-trade linkages or exposures of the U.S. banking system to the Ukraine and Russia are not large.
292,CHAIR YELLEN,"That’s—we’re not seeing meaningful impacts now, but obviously there are geopolitical risks here that it’s very important for us to be attentive to and to keep our eye on."
293,CHAIR YELLEN,"And we’re not seeing broader global financial repercussions, but if this were to escalate, that would certainly be something that would be on our radar screen, but we’re not seeing—we’re not seeing that now and we’re monitoring it closely."
294,VICTORIA MCGRANE,Victoria McGrane from Dow Jones Newswires.
295,VICTORIA MCGRANE,You’ve spoken about how unemployment is more than just statistics to you.
296,VICTORIA MCGRANE,"And I wanted to ask, when you make that statement, who do you have in mind or—and what do you do, if anything, to keep in touch with that kind of human side of the impact of the economic crisis and slow recovery that we’ve had?"
297,CHAIR YELLEN,"Well, I’d be surprised if anyone in this room doesn’t know someone who has been touched by the crisis, by unemployment, by difficulties in getting jobs, and that is true of me and my family and friends, I think, as it is probably for many of you."
298,CHAIR YELLEN,I talk to a broad range of business contacts and try to stay in touch with what’s happening with real people in the economy.
299,CHAIR YELLEN,We have—do a lot of work in community development in the Fed and have groups come to talk to us and explain to us how their communities have been affected by the economic situation and by the housing crisis.
300,CHAIR YELLEN,"When I was in San Francisco, we worked—you know, we had programs there, we worked very closely, particularly in low-income communities that have been very badly affected, to design programs that could potentially be helpful."
301,CHAIR YELLEN,We tried to study what kinds of programs can be most effective and to try to understand what kinds of advice we could give to those in the community development lending field to help.
302,CHAIR YELLEN,So I do try to listen to people that represent communities that are experiencing the worst of the crisis and stay in touch with it that way.
