,speaker,sentence
0,CHAIR POWELL,"Good afternoon, everyone."
1,CHAIR POWELL,Thanks for being here.
2,CHAIR POWELL,"At today’s meeting, my colleagues and I decided to leave our policy rate unchanged."
3,CHAIR POWELL,"As always, we base our decisions on our judgment of how best to achieve the goals Congress has given us: maximum employment and price stability."
4,CHAIR POWELL,"We believe monetary policy is well positioned to serve the American people by supporting continued economic growth, a strong job market, and a return of inflation to our symmetric 2 percent goal."
5,CHAIR POWELL,"The expansion is in its 11th year, the longest on record."
6,CHAIR POWELL,"Growth in household spending moderated toward the end of last year, but with a healthy job market, rising incomes, and upbeat consumer confidence, the fundamentals supporting household spending are solid."
7,CHAIR POWELL,"In contrast, business investment and exports remain weak, and manufacturing output has declined over the past year."
8,CHAIR POWELL,Sluggish growth abroad and trade developments have been weighing on activity in these sectors.
9,CHAIR POWELL,"However, some of the uncertainties around trade have diminished recently, and there are some signs that global growth may be stabilizing after declining since mid-2018."
10,CHAIR POWELL,"Nonetheless, uncertainties about the outlook remain, including those posed by the new coronavirus."
11,CHAIR POWELL,"Overall, with monetary and financial conditions supportive, we expect moderate economic growth to continue."
12,CHAIR POWELL,"The unemployment rate has been near half-century lows for well more than a year, and the pace of job gains remains solid."
13,CHAIR POWELL,"Participation in the labor force by people in their prime working years, ages 25 to 54, is at its highest level in more than a decade."
14,CHAIR POWELL,"And wages have been rising, particularly for lower-paying jobs."
15,CHAIR POWELL,People who live and work in middle-income communities and low-income communities tell us that many who have struggled to find work are now finding new opportunities.
16,CHAIR POWELL,Employment gains have been broad based across all racial and ethnic groups and all levels of education.
17,CHAIR POWELL,These developments underscore for us the importance of sustaining the expansion so that the strong job market reaches more of those left behind.
18,CHAIR POWELL,Inflation continues to run below our symmetric 2 percent objective.
19,CHAIR POWELL,"Over the 12 months through November, total PCE inflation was 1.5 percent, and core inflation, which excludes volatile food and energy prices, was 1.6 percent."
20,CHAIR POWELL,"Available data suggest similar inflation readings for December, though we expect inflation to move closer to 2 percent over the next few months as unusually low readings from early 2019 drop out of the calculation."
21,CHAIR POWELL,"While low and stable inflation is certainly a good thing, inflation that runs persistently below our objective can lead longer-term inflation expectations to drift down, pulling actual inflation even lower."
22,CHAIR POWELL,"In turn, interest rates would be lower as well—closer to their effective lower bound."
23,CHAIR POWELL,"As a result, we would have less room to reduce interest rates to support the economy in a future downturn to the detriment of American families and businesses."
24,CHAIR POWELL,"We have seen this dynamic play out in other economies around the world, and we are determined to avoid it here in the United States."
25,CHAIR POWELL,"In particular, we believe the current stance of monetary policy is appropriate to support sustained economic growth, a strong labor market, and inflation returning to our 2 percent—symmetric 2 percent objective."
26,CHAIR POWELL,"As long as incoming information about the economy remains broadly consistent with this outlook, the current stance of monetary policy likely will remain appropriate."
27,CHAIR POWELL,"We will be monitoring the effects of the policy actions we took last year, along with other information bearing on the outlook, as we assess the appropriate path of the target range for the federal funds rate."
28,CHAIR POWELL,"Of course, if developments emerge that cause a material reassessment of our outlook, we would respond accordingly."
29,CHAIR POWELL,Policy is not on a preset course.
30,CHAIR POWELL,I will conclude with a brief overview of our current plans for our technical operations to implement monetary policy.
31,CHAIR POWELL,The plan the FOMC announced back in October to purchase Treasury bills and conduct repo operations has proceeded smoothly and has succeeded in providing an ample supply of reserves to the banking system and effectively controlling the federal funds rate.
32,CHAIR POWELL,"In light of the resulting stability in the federal funds rate and money market conditions more generally, we decided to make a small technical upward adjustment to administered rates to ensure that the federal funds rate trades well within the target range."
33,CHAIR POWELL,This action reverses the small downward adjustment made in September when money markets were volatile.
34,CHAIR POWELL,"As our bill purchases continue to build reserves toward levels that maintain ample conditions, the role played by active repo operations will naturally recede."
35,CHAIR POWELL,"Over the first half of this year, we intend to adjust the size and pricing of repo operations as we transition away from their active use in supplying reserves."
36,CHAIR POWELL,"This process will take place gradually, and, as indicated in today’s FOMC directive to the Desk, we expect to continue offering repos at least through April to ensure a consistently ample supply of reserves."
37,CHAIR POWELL,"Based on current projections, we expect that the underlying level of reserves will durably reach ample levels sometime in the second quarter of this year."
38,CHAIR POWELL,"As we get close to that point, we intend to slow the pace of purchases and transition to a program of smaller reserve management purchases that maintains an ample level of reserves without the active use of repos."
39,CHAIR POWELL,"At that point, as in the pre-crisis period, our balance sheet will be expanding gradually over time, reflecting the trend growth in the demand for currency and other Federal Reserve liabilities."
40,CHAIR POWELL,All of these technical measures are designed to support the efficient and effective implementation of monetary policy and are not intended to represent a chance—a change in the stance of monetary policy.
41,CHAIR POWELL,We are committed to completing the transition to our longer-run ample-reserves regime smoothly and predictably.
42,CHAIR POWELL,"Of course, we will continue to closely monitor conditions in money markets, and we will adjust these plans as conditions warrant."
43,CHAIR POWELL,"Thank you, and I’ll be happy to take your questions."
44,CHRISTOPHER CONDON,Thank you.
45,CHRISTOPHER CONDON,"Chris Condon, Bloomberg News."
46,CHRISTOPHER CONDON,"Mr. Chairman, I would like you to comment in a little bit more depth about one small change I’ve noted in the statement."
47,CHRISTOPHER CONDON,It notes that policy will be appropriate to bring—the Committee believes—inflation back to the Committee’s 2 percent symmetric inflation objective.
48,CHRISTOPHER CONDON,"That’s a slight change from the last time, when you were expecting it to bring inflation outcomes back near the objective."
49,CHRISTOPHER CONDON,And I would put this also in the context of a comment you made at the last press conference where you drew attention to the fact that a number of policymakers had projected inflation overshoots two or three years out under appropriate monetary policy.
50,CHRISTOPHER CONDON,"Should we take all of this together to mean simply that the Committee is more confident that a 2 percent outcome for inflation is already baked in the cake, or that this is a signal that the Committee has a stronger resolution to bring inflation at least to the 2 percent objective and put—bring into play an informal makeup strategy for inflation?"
51,CHAIR POWELL,Yes.
52,CHAIR POWELL,"So, in making that change, our goal was, really—that was, changing “near” to “returning to”—was to avoid possible misinterpretation."
53,CHAIR POWELL,"So you may remember, in the December minutes we noted that a few Committee members suggested that the language that stated that monetary policy would support inflation near 2 percent could be misinterpreted as suggesting that policymakers were comfortable with inflation running below that level."
54,CHAIR POWELL,So we thought about that in the intermeeting period and concluded that it would be appropriate to adjust that language to send a clearer signal that we’re not comfortable with inflation rising persistently—running persistently below our 2 percent symmetric objective.
55,CHAIR POWELL,"So, yes, there is something in that."
56,CHAIR POWELL,"It’s just that we wanted to underscore our commitment to 2 percent not being a ceiling to inflation running around—symmetrically around 2 percent, and that we’re not satisfied with inflation running below 2 percent, particularly at a time such as now where we’re a long way into an expansion and a long way into a period of very low unemployment when, in theory, inflation should be moving up."
57,NICK TIMIRAOS,Thank you.
58,NICK TIMIRAOS,Nick Timiraos of the Wall Street Journal.
59,NICK TIMIRAOS,I want to ask about the balance sheet.
60,NICK TIMIRAOS,How many reserves are “ample”?
61,NICK TIMIRAOS,How many reserves does the Fed now think it will need to conduct policy in its current framework?
62,NICK TIMIRAOS,And can you walk me through how you and your colleagues are arriving at that answer?
63,CHAIR POWELL,Sure.
64,CHAIR POWELL,"So, thanks for that question."
65,CHAIR POWELL,"Why don’t I say a few things about repos, since I know that’ll be of interest."
66,CHAIR POWELL,"So, just to bring you back, after last September’s brief turmoil, we took prompt and decisive action, and a result—as a result, money markets have been operating smoothly since then."
67,CHAIR POWELL,"Just to review, those two adjustments were Treasury bill purchases of at least—of $60 billion—sorry—at least into the second quarter, and term and overnight repo at least through April."
68,CHAIR POWELL,And I will get to your specific question.
69,CHAIR POWELL,"The purpose of the adjustments has been to assure that our policy is transmitted smoothly to the federal funds rate, which requires well-functioning money markets."
70,CHAIR POWELL,It doesn’t mean we’re trying to eliminate all volatility in the repo markets.
71,CHAIR POWELL,We know that some volatility is normal and expected in well-functioning markets.
72,CHAIR POWELL,"And, as I mentioned, these adjustments have been successful in supplying an ample quantity of reserves."
73,CHAIR POWELL,"Money markets operated smoothly, including right through year-end, and the fed funds rate has remained in our target range."
74,CHAIR POWELL,"So we know—we will know when these adjustments have run their course when reserves are durably at a level that enables us to control the federal funds rate using our administered rates, the interest on reserves and reverse repo, without the need for frequent use of open market operations."
75,CHAIR POWELL,"Based on current projections, we expect that the bill purchases will durably bring the underlying level of reserves to the ample level sometime in the second quarter of this year."
76,CHAIR POWELL,"And when we see that we’ve reached that level, we’ll begin to gradually reduce our asset purchases to the level of the underlying trend growth of demand for our liabilities."
77,CHAIR POWELL,"As our bill purchases bring the underlying level of reserves up to an ample level on a sustained basis, the necessary quantity of overnight and term repo will gradually decline."
78,CHAIR POWELL,"We’ve already begun the gradual reduction in the quantity of repo, and we’ll continue to reduce those offering amounts gradually as conditions permit."
79,CHAIR POWELL,"At some point, we’ll also raise the minimum bid rate."
80,CHAIR POWELL,"Even after we reach an ample level of reserves, it’s possible that repo operations might play a role as a backstop and support effective control of the federal funds rate."
81,CHAIR POWELL,And we’ll continue to discuss that issue and review it under our implementation framework.
82,CHAIR POWELL,"Coming to your question, in terms of the actually desired reserve level, we know that reserves will continue to move up and down over the course of the calendar year in a wide range depending on volatility in nonreserve liabilities, particularly the Treasury General Account, or TGA."
83,CHAIR POWELL,"In particular, reserve levels will need to be at a level high enough to remain ample even when the TGA peaks during the April tax season."
84,CHAIR POWELL,"Effectively, what that means is that we need reserves at all times to be no lower than they were in early September—and, I would say, around $1½ trillion, subject to learning more."
85,CHAIR POWELL,"Reserves are going to move in a broad range, as I mentioned, and we want to be clear, that will be the bottom end of the range."
86,CHAIR POWELL,We want $1½ trillion or thereabouts to be the bottom end of the range.
87,CHAIR POWELL,"So, most of the time, reserves will be moving in a range substantially higher than that but not going below $1½ trillion."
88,CHAIR POWELL,So it’s not an—it’s not something that we’re aiming at all the time.
89,CHAIR POWELL,We know that reserves will fluctuate and be substantially higher than that most of the time.
90,CHAIR POWELL,We also want interest on excess reserves and the fed funds rate to be well within the FOMC’s target range.
91,CHAIR POWELL,And we think that’ll be the case now that we made our technical adjustment.
92,CHAIR POWELL,Last points—we’re committed to making this adjustment process a smooth one.
93,CHAIR POWELL,"We’ll provide more details as we go, and we expect to learn as we go, as we always have."
94,CHAIR POWELL,And we’re prepared to adjust the details of the plan as necessary to foster efficient and effective monetary policy implementation.
95,STEVE LIESMAN,"Steve Liesman, CNBC."
96,STEVE LIESMAN,"Mr. Chairman, thank you for the question."
97,STEVE LIESMAN,"Following up on Nick’s question, I know you said it’s not QE, but it’s $390 billion over five months, which is a lot to expand the balance sheet."
98,STEVE LIESMAN,I guess I’d ask one more time on Nick’s question—is there a number that you have in mind?
99,STEVE LIESMAN,"Secondly, a lot of people in the market are sort of concerned that it looks like QE, and they’re trading that way."
100,STEVE LIESMAN,"Are you concerned that the market is embracing this like a QE program, and that the rise in the stock market is linked to it, and you may then experience something of a “taper tantrum” the way Chairman Bernanke did when he tried to roll it off?"
101,CHAIR POWELL,"So I’ll just—I’ll repeat that—we think that the—we think we need to continue purchases until the—until reserves are at a level at which they will not go below $1½ trillion, roughly, during the course of the calendar year."
102,CHAIR POWELL,And we know that the TGA will move up and down there.
103,CHAIR POWELL,"So they’ll be much higher than that some of the time, but that’s kind of the number, and we think we’ll reach that sometime in the second quarter."
104,CHAIR POWELL,That’s our estimate.
105,CHAIR POWELL,But we will—we’ll know it when we get there.
106,CHAIR POWELL,"We’ll know it because we’ll be able to be—to control the federal funds rate without use of—without active use, ongoing use of open market operations."
107,CHAIR POWELL,"You know, our intention of these—for these adjustments is just to raise the level of reserves and to allow us to conduct monetary policy in an efficient and effective manner."
108,CHAIR POWELL,And that’s—that is our sole intention.
109,CHAIR POWELL,"I pointed out on other occasions, more than once, the differences—the really specific differences between this and the large-scale asset purchase programs."
110,CHAIR POWELL,We’ve been over that.
111,CHAIR POWELL,"In terms of what affects markets, you know, I think many things affect markets."
112,CHAIR POWELL,It’s very hard to say with any precision at any time what is affecting markets.
113,CHAIR POWELL,What I can tell you is that you know what our intention is.
114,CHAIR POWELL,It is to return reserves to an ample level.
115,CHAIR POWELL,We expect that to happen during the second quarter.
116,CHAIR POWELL,"And our plan as we do that is, as those purchases get to that level, we believe we can gradually reduce them, and we believe we can also gradually reduce repo as—as we reach an ample level, as we’re satisfying demand now more from underlying reserves from bill purchases rather than from repo."
117,CHAIR POWELL,"And, again, the last thing I’ll say is, we’re prepared to adjust the details of this plan as we’ve shown ourselves willing to do depending on conditions."
118,JEANNA SMIALEK,"Hi, Chair Powell."
119,JEANNA SMIALEK,Jeanna Smialek from the New York Times.
120,JEANNA SMIALEK,I was hoping that you could talk a little bit about the labor market.
121,JEANNA SMIALEK,"We’ve recently seen wages moderating a little bit by some measures, maybe even declining a little bit by others."
122,JEANNA SMIALEK,"As you mentioned, at the lower end of the sort of talent pool, it seems like we are seeing those wages climb up a little bit, but it doesn’t seem to be consistent across the entire sort of average."
123,JEANNA SMIALEK,"I was wondering if you’d talk a little bit about whether you guys are noticing any cracks, or whether you’re worried about that, or how you’re thinking about it."
124,CHAIR POWELL,The labor market continues to—to perform well.
125,CHAIR POWELL,The labor market continues to be strong.
126,CHAIR POWELL,We see strong job creation.
127,CHAIR POWELL,We see low unemployment.
128,CHAIR POWELL,"Very importantly, we see labor force participation continuing to move up, really, against expectations."
129,CHAIR POWELL,"If you go back a few years, you will not find a lot of forecasts suggesting that we could have been at 63.2 percent overall labor force participation or the levels of employment to population that we’re seeing now, let alone the unemployment level."
130,CHAIR POWELL,"So I think we’ve learned quite a lot of good things about the labor market, good things suggesting that there’s been more room to run."
131,CHAIR POWELL,"The performance of wages, I think, has to be seen in that context."
132,CHAIR POWELL,"We saw—if you go back four or five years, the four or five major wage statistics that we track were running at around 2 percent, and now they’re running at around 3 percent, which is theoretically about where they might be at full employment."
133,CHAIR POWELL,It would consist of inflation plus—plus productivity growth.
134,CHAIR POWELL,"The—it’s a bit surprising that, with sustained levels of historically low unemployment, we haven’t seen wages moving up above that level as we have in other long expansions and other periods of low unemployment."
135,CHAIR POWELL,"So you asked, what can be explaining that?"
136,CHAIR POWELL,"You know, one thing can be that the natural rate of unemployment is still lower than we think, that the labor market is not as tight as it would appear just from the 3½ percent number."
137,CHAIR POWELL,"And the other can be, I think, that—as I mentioned, the sort of supply-side shock or surprise that we’re receiving from higher labor force participation."
138,CHAIR POWELL,"People are coming in to the labor market and providing more labor supply, and that is—that’s a great thing."
139,CHAIR POWELL,That’s a very healthy thing.
140,CHAIR POWELL,"We’re a country that has low labor force participation compared to essentially all of our advanced-economy peers, and it’s a very good, positive thing."
141,CHAIR POWELL,"Nonetheless, it represents more labor supply, and it may be holding down wages."
142,MICHAEL MCKEE,Michael McKee from Bloomberg Radio and Television.
143,MICHAEL MCKEE,"In terms of the framework review and a little bit on Chris’s question earlier, there is a general feeling now in the markets and among analysts that you’re basically setting us up for some form of inflation-target averaging where you let the inflation rate run above the 2 percent target for some time to make up for the time that it has spent below that."
144,MICHAEL MCKEE,Is that a fair or reasonable assessment of where you think you’re going to end up?
145,MICHAEL MCKEE,"What would you, Chairman Powell, think of that idea personally?"
146,MICHAEL MCKEE,"And, as long as I’m asking, do you have any more details on when we can expect the results of the review?"
147,CHAIR POWELL,Thanks.
148,CHAIR POWELL,"I’ll just say that we undertook the review because we felt, and I felt, that it was time to incorporate the realities of what we could call the “new normal” into our policy framework."
149,CHAIR POWELL,"And some aspects of that new normal would include ongoing powerful global disinflationary trends, which have led to lower-than-target inflation many places in the world; secondly, a flat Phillips curve, by which I mean low levels of sensitivity of inflation to resource utilization—for example, low unemployment; and, thirdly, a much lower neutral real interest rate here and around the world."
150,CHAIR POWELL,"So those are challenging conditions for monetary policy to deliver on our statutory goals of maximum employment and stable prices, although I would say that, under our existing framework, we’ve been able to succeed or get close to succeeding it for most of the time lately to achieve those goals, although we do struggle, as other central banks do, with the inflation goal."
151,CHAIR POWELL,"So this is about reviewing our strategy, tools, and communications to assure that they’re the best that we can do to achieve those goals in this environment on a sustained basis."
152,CHAIR POWELL,And we continued our discussions at this meeting.
153,CHAIR POWELL,"I’m very, very pleased at the process so far."
154,CHAIR POWELL,"It’s included the 14 Fed Listens events around the country, at which we’ve engaged with a full range of people and groups across American society."
155,CHAIR POWELL,"That was a very, very positive experience, and I think we learned a lot."
156,CHAIR POWELL,"We’ve now had a series of—a number of FOMC meetings at which we’ve reviewed what we’ve learned and also dug deeply into strategy, tools, and communications."
157,CHAIR POWELL,I expect that we will conclude the review and announce our conclusions around the middle of the year.
158,CHAIR POWELL,"Right now, we are just at the point of coming together to put all that together."
159,CHAIR POWELL,So I think I’m not the person who should be telling you my personal preferences right now.
160,CHAIR POWELL,I’m trying to—and we were trying to come together as a group around a set of answers.
161,CHAIR POWELL,"I feel very positive about—that we’re going to come up with some good results, and I’m just going to have to wait until we get to that point to announce them."
162,DONNA BORAK,Donna Borak with CNN.
163,DONNA BORAK,"Going back to your outlook for global growth, we’ve seen some significant headwinds, as you mentioned earlier, with the easing—with the partial U.S.–China trade deal, but now that there’s some new concern following the outbreak of the coronavirus—that it might shake global growth."
164,DONNA BORAK,We’re already seeing reports from Ford and Toyota that they’re planning to shut down their assembly plants for an extra week.
165,DONNA BORAK,Apple is rerouting their supply chains.
166,DONNA BORAK,Starbucks is shutting down close to thousands of stores.
167,DONNA BORAK,"Are you worried at all about what the impact would be on the U.S. economy, and do you see that as a significant risk—excuse me—to the outlook at this point?"
168,CHAIR POWELL,"So let me talk about the coronavirus specifically, and then I’ll turn more to global growth more generally."
169,CHAIR POWELL,"First, it’s a—it’s a very serious issue, and I want to start by acknowledging the significant and considerable human suffering that the virus is already causing."
170,CHAIR POWELL,There is likely to be some disruption to activity in China and possibly globally based on the spread of the virus to date and the travel restrictions and business closures that have already been imposed.
171,CHAIR POWELL,"Of course, the situation is really in its early stages, and it’s very uncertain about how far it will spread and what the macroeconomic effects will be in China and its immediate trading partners and neighbors and around the world."
172,CHAIR POWELL,"So, in light of that uncertainty, I’m not going to speculate about it at this point."
173,CHAIR POWELL,"I will just tell you that, of course, we are very carefully monitoring the situation."
174,CHAIR POWELL,"And, you know, as you suggested, our framework ultimately is, what are the potential ramifications for the U.S. economy and for the achievement of our dual mandate?"
175,CHAIR POWELL,"More broadly, though, if I can talk about the global economy for a second—and if you look at the backdrop, you know, if you go back to 2017, that was the year of synchronized growth that lasted into the middle of 2018, and then you saw slowing in growth, which lasted right through the end of last year."
