,speaker,sentence
0,CHAIR YELLEN,Good afternoon.
1,CHAIR YELLEN,I am pleased to join you for the first of my post-FOMC press conferences.
2,CHAIR YELLEN,"Like Chairman Bernanke before me, I appreciate the opportunity these press conferences afford to explain the decisions of the FOMC and respond to your questions."
3,CHAIR YELLEN,The Federal Open Market Committee concluded a two-day meeting earlier today.
4,CHAIR YELLEN,"As you already know from our statement, the Committee decided to make another modest reduction in the pace of its purchases of longer-term securities."
5,CHAIR YELLEN,The Committee also updated its guidance regarding the likely future path of the short-term interest rates.
6,CHAIR YELLEN,"As I’ll explain more fully in a moment, this change in our guidance does not indicate any change in the Committee’s policy intentions as set forth in its recent statements; rather, the change is meant to clarify how the Committee anticipates policy evolving after the unemployment rate declines below 6½ percent."
7,CHAIR YELLEN,Let me explain the economic outlook that underlies these actions.
8,CHAIR YELLEN,"Despite some softer recent data, the FOMC’s outlook for continued progress toward our goals of maximum employment and inflation returning to 2 percent remains broadly unchanged."
9,CHAIR YELLEN,Unusually harsh weather in January and February has made assessing the underlying strength of the economy especially challenging.
10,CHAIR YELLEN,"Broadly speaking, however, the spending and production data, while somewhat weaker than we had expected in January, are roughly in line with our expectations as of December, the last time Committee participants submitted economic projections."
11,CHAIR YELLEN,"In contrast, labor market conditions have continued to improve."
12,CHAIR YELLEN,"The unemployment rate, at 6.7 percent, is three-tenths lower than the data available at the time of the December meeting."
13,CHAIR YELLEN,"Further, broader measures of unemployment—such as the U-6 measure, which includes marginally attached workers and those working part time but preferring full-time work—have fallen even more than the headline unemployment rate over this period, and labor force participation has ticked up."
14,CHAIR YELLEN,"While the Committee continues to monitor developments in global financial markets carefully, financial conditions remain broadly consistent with the FOMC’s objectives."
15,CHAIR YELLEN,"In sum, the FOMC continues to see sufficient underlying strength in the economy to support ongoing improvement in the labor market."
16,CHAIR YELLEN,Inflation has continued to run below the Committee’s 2 percent objective.
17,CHAIR YELLEN,"Given that longer-term inflation expectations appear to be well anchored, and in light of the ongoing recovery in the United States and in many economies around the world, the FOMC continues to expect inflation to move gradually back toward its objective."
18,CHAIR YELLEN,The Committee is mindful that inflation running persistently below its objective could pose risks to economic performance.
19,CHAIR YELLEN,"The Committee also recognizes, however, that policy actions tend to exert pressure on inflation that is manifest only gradually over time."
20,CHAIR YELLEN,The FOMC will continue assessing incoming data carefully to ensure that policy is consistent with attaining the FOMC’s longer-run objectives of maximum employment and inflation of 2 percent.
21,CHAIR YELLEN,This outlook is reflected in the individual economic projections submitted in conjunction with this meeting by the 16 FOMC participants—4 Board members and 12 Reserve Bank presidents.
22,CHAIR YELLEN,"As always, each participant’s projections are conditioned on his or her own view of appropriate monetary policy."
23,CHAIR YELLEN,The central tendency of the unemployment rate projections has shifted down by about two-tenths since December and now stands at between 6.1 and 6.3 percent at the end of this year.
24,CHAIR YELLEN,The unemployment rate is projected to reach its longer-run normal level by the end of 2016.
25,CHAIR YELLEN,The central tendency of the projections for real GDP growth stands at 2.8 to 3 percent for 2014 and remains somewhat above that of the estimates of longer-run normal growth through 2016.
26,CHAIR YELLEN,"Meanwhile, as I noted, FOMC participants continue to see inflation moving only gradually back toward 2 percent over time as the economy expands."
27,CHAIR YELLEN,"The central tendency of the inflation projections is 1.5 to 1.6 percent in 2014, rising to 1.7 to 2.0 percent in 2016."
28,CHAIR YELLEN,Let me now return to our decision to make another measured reduction in the pace of asset purchases.
29,CHAIR YELLEN,"Starting next month, we will be purchasing $55 billion of securities per month, down $10 billion per month from our current rate."
30,CHAIR YELLEN,"Even after today’s action takes effect, we will continue to significantly expand our holdings of longer-term securities, and we will also continue to roll over maturing Treasury securities and reinvest principal payments from the FOMC’s holdings of agency debt and agency mortgage-backed securities in agency mortgage-backed securities."
31,CHAIR YELLEN,"These sizable and still-increasing holdings will continue to put downward pressure on longer-term interest rates, support mortgage markets, and make financial conditions more accommodative, helping to support job creation and a return of inflation to the Committee’s objective."
32,CHAIR YELLEN,The FOMC views today’s decision to reduce the pace of asset purchases as consistent with the decisionmaking framework laid out last December and still in place today.
33,CHAIR YELLEN,"As before, if incoming information broadly supports the Committee’s expectation of ongoing improvement in labor markets and inflation moving back over time toward its longer-run objective, the Committee will likely continue to reduce the pace of asset purchases in measured steps at future meetings."
34,CHAIR YELLEN,"However, purchases are not on a preset course, and the Committee’s decisions about the pace of purchases remain contingent on its outlook for jobs and inflation as well as its assessment of the likely efficacy and costs of such purchases."
35,CHAIR YELLEN,Today the FOMC also updated its forward guidance regarding the path of short-term interest rates.
36,CHAIR YELLEN,"As emphasized in the statement, the new guidance does not indicate any change in the policy intentions of the FOMC but instead reflects changes in the conditions we face."
37,CHAIR YELLEN,Let me explain this more fully.
38,CHAIR YELLEN,"In December 2012, the Committee first stated its guidance in terms of economic thresholds, stipulating that the current low range for the federal funds rate target would be appropriate at least as long as the unemployment rate remains above 6½ percent, inflation is projected to be no more than a half percentage point above our longer-run goal, and longer-term inflation expectations remain well anchored."
39,CHAIR YELLEN,"Since that time, progress in the labor market has been more rapid than we had anticipated, while inflation has been lower than the Committee had expected."
40,CHAIR YELLEN,"Although the thresholds served well as a useful guide to policy over the past year, last December the FOMC judged it appropriate to update that guidance, noting that the current target range for the federal funds rate would likely be maintained “well past the time that the unemployment rate declines below 6½ percent, especially if projected inflation continues to run below the Committee’s 2 percent longer-run goal.” Today the Committee has further revised its forward guidance to better reflect conditions as they now stand and are likely to evolve over coming quarters."
41,CHAIR YELLEN,The revised formulation starts with a general description of the factors that drive FOMC decisionmaking and then provides the FOMC’s current assessment of what those factors will likely imply for the future path of short-term interest rates.
42,CHAIR YELLEN,"In particular, the Committee states that “[i]n determining how long to maintain the current 0 to ¼ percent target range for the federal funds rate, it [the Committee] will assess progress—both realized and expected—toward its objectives of maximum employment and 2 percent inflation.” In short, the larger the shortfall of employment or inflation from the respective objectives set by the FOMC, and the longer any such shortfall is expected to persist, the longer the target federal funds rate is likely to remain in the present 0 to ¼ percent range."
43,CHAIR YELLEN,"The FOMC will base its ongoing assessment on a wide range of information, including measures of labor market conditions, indicators of inflation pressures and inflation expectations, and readings on financial developments."
44,CHAIR YELLEN,"As I’ve noted, the FOMC’s assessment of these factors at present is consistent with the characterization provided in previous forward guidance."
45,CHAIR YELLEN,"The Committee continues to anticipate that conditions will likely warrant maintaining “the current range for the federal funds rate for a considerable time after the asset purchase program ends, especially if projected inflation continues to run below the Committee’s 2 percent longer-run goal, and provided that longer-term inflation expectations remain well anchored.” The FOMC also supplemented its guidance pertaining to the period after the asset purchase program ends and the initial increase in the federal funds rate target has occurred."
46,CHAIR YELLEN,"The statement continues to note that in deciding on the pace for removing accommodation, the Committee will take a balanced approach to attaining its objectives."
47,CHAIR YELLEN,"The statement now adds the Committee’s current anticipation that “even after employment and inflation are near mandate-consistent levels, economic conditions may, for some time, warrant keeping” short-term interest rates “below levels the Committee views as normal in the longer run.” This guidance is consistent with the paths for appropriate policy as reported in the participants’ projections, which show the federal funds rate for most participants remaining well below longer-run normal values at the end of 2016."
48,CHAIR YELLEN,"Although FOMC participants provide a number of explanations for the federal funds rate target remaining below its longer-run normal level, many cite the residual impacts of the financial crisis, and some note that the potential growth rate of the economy may be lower, at least for a time."
49,CHAIR YELLEN,"In summary, the Committee’s actions today reflect its assessment that progress in the labor market is continuing, but that much remains to be done on both the jobs and inflation fronts."
50,CHAIR YELLEN,"Unemployment is still elevated, underemployment and long-term unemployment remain significant concerns, and inflation is running significantly below the FOMC’s objective."
51,CHAIR YELLEN,These conditions warrant the continuation of highly accommodative policy reflected in today’s policy statement.
52,CHAIR YELLEN,"The Federal Reserve’s interest rate guidance and its substantial and still-increasing holdings of longer-term securities will ensure that monetary policy remains highly accommodative, promoting the FOMC’s objectives of maximum employment and price stability."
53,CHAIR YELLEN,Thank you.
54,CHAIR YELLEN,I’ll be glad to take your questions.
55,MARTIN CRUTSINGER,"Madam Chair, Marty Crutsinger with the Associated Press."
56,MARTIN CRUTSINGER,Could you give us a little insight in how the decision was made on dropping the 6½ percent numerical target in the forward guidance?
57,MARTIN CRUTSINGER,"Was there any concern expressed that there’s been criticism on forward guidance, that it’s confusing markets, not helping them in some ways?"
58,MARTIN CRUTSINGER,"Was there concern expressed that perhaps it would have been better to go to just a lower target, say, 6 percent?"
59,MARTIN CRUTSINGER,"And could you also address the concerns raised in the dissent that by dropping this, it lowers the commitment on fighting low inflation?"
60,MARTIN CRUTSINGER,Thank you.
61,CHAIR YELLEN,Thanks.
62,CHAIR YELLEN,"Well, as I mentioned in my statement, the reason the Committee felt that the time had come to revise the forward guidance is not because we think it has not been effective."
63,CHAIR YELLEN,I believe the Committee does think it’s been effective.
64,CHAIR YELLEN,I think it’s had a very useful impact in helping markets understand our expectations and shaping their own.
65,CHAIR YELLEN,"But it is becoming—as the unemployment rate gets closer and closer to 6½ percent, to breaching that threshold that seems like the one that is likely to be breached."
66,CHAIR YELLEN,"The question is: Markets want to know, the public wants to understand, beyond that threshold, how will we decide what to do?"
67,CHAIR YELLEN,"So the purpose of this change is simply to provide more information than we have in the past, even though it is qualitative information, about what we will be looking at as the unemployment rate declines below 6½ percent in deciding how long to hold the federal funds rate at this 0 to ¼ percent range."
68,CHAIR YELLEN,"And, as I said, we’ve tried to give a general formulation of what we’ll be looking at, which is: How far are we?"
69,CHAIR YELLEN,How large are the shortfalls in achieving our goals?
70,CHAIR YELLEN,And how fast do we expect progress to be?
71,CHAIR YELLEN,That will be the main factors we’ll be looking at.
72,CHAIR YELLEN,We initially started with an unemployment rate as a threshold.
73,CHAIR YELLEN,"That was easy enough for the Committee to say, “With an unemployment rate above 6½ percent, we know we’re not close to full employment, not close to an employment level consistent with our mandate, and unless inflation were a significant concern, we wouldn’t dream of raising the federal funds rate target.” Now, the Committee has never felt that the unemployment rate is a sufficient statistic for the labor market."
74,CHAIR YELLEN,"I think if I had to choose one indicator of the labor market, the unemployment rate is probably as good a one as I could find."
75,CHAIR YELLEN,But in assessing the real state of slack in the labor market and ultimately of inflationary pressures that might—or deflationary pressures that could result from that—it’s appropriate to look at many more things.
76,CHAIR YELLEN,And that’s why the Committee now states we will look at a broad range of information.
77,CHAIR YELLEN,"So the closer we get as we narrow in on coming closer to the target we want to achieve, we will be carefully considering many indicators of how close are we to our targets."
78,CHAIR YELLEN,So those are the main reasons.
79,CHAIR YELLEN,"Now, you asked as well about the dissent."
80,CHAIR YELLEN,President Kocherlakota felt—I believe he noted in his dissent that he endorses the new guidance about the likely path of the federal funds rate after we begin to finally raise it.
81,CHAIR YELLEN,"And that indicates that it’s unlikely to be back to normal levels for some time, but he questions whether or not the reformulated forward guidance shows sufficient commitment of the Committee to its 2 percent inflation objective."
82,CHAIR YELLEN,"And I will simply say on my own behalf, and on behalf of the Committee, that we are fully committed to the 2 percent inflation objective, and we do not want to undershoot inflation for a prolonged period of time."
83,CHAIR YELLEN,"As I mentioned, monetary policy operates with lags, so, the policies we have in place, we think, will gradually—only gradually—move inflation back to 2 percent."
84,CHAIR YELLEN,"But if the Committee had real concerns that inflation were going to remain persistently below 2 percent, I feel confident that the Committee would act to prevent that."
85,JON HILSENRATH,Jon Hilsenrath from the Wall Street Journal.
86,JON HILSENRATH,"Chair Yellen, in the interest rate projections made by FOMC participants that supplement your statement, there seems to be a slight upward drift in the expectations for rates going out to 2016."
87,JON HILSENRATH,"For instance, a majority of officials see rates at 1 percent or higher in this forecast round."
88,JON HILSENRATH,"In the last forecast round, a majority saw officials less than 1 percent."
89,JON HILSENRATH,"I wonder if you could explain why there is this small upward drift in expected rates among Committee members, whether these projections are a good guide for the public about where rates—about the path of rates going forward, and also how you reconcile this upward drift with the assurances that the Committee makes in its statement that rates will stay below normal levels well into the future."
90,CHAIR YELLEN,"Well, to my mind, there is only very limited upward drift."
91,CHAIR YELLEN,"You know, the Committee—I think the Committee, in assessing the economy—if you compare today’s assessment with December’s, is virtually identical."
92,CHAIR YELLEN,Almost nothing has changed in the overall Committee assessment of the outlook.
93,CHAIR YELLEN,"As I mentioned, unemployment has come down."
94,CHAIR YELLEN,"The labor market more broadly, I think, has improved a little more than we might have expected, and that slightly more rapid improvement in the unemployment picture might explain—I can’t speak for why people write down what they do, but—a little bit of the upward shift in those dots."
95,CHAIR YELLEN,"But, more generally, I think that one should not look to the dot plot, so to speak, as the primary way in which the Committee wants to or is speaking about policy to the public at large."
96,CHAIR YELLEN,"The FOMC statement is the device that the Committee as a policymaking group uses to express its opinions, and we have expressed a number of opinions about the likely path of rates."
97,CHAIR YELLEN,"In particular, the Committee has endorsed the view that it anticipates it will be a considerable period after the asset purchase program ends before it will be appropriate to begin to raise rates."
98,CHAIR YELLEN,"And, of course, on our present path, well, that’s not utterly preset."
99,CHAIR YELLEN,We would be looking at next fall.
100,CHAIR YELLEN,"So, I think that’s important guidance."
101,CHAIR YELLEN,"Looking further out, let’s say if you look toward the end of 2016 when most participants are projecting that the employment situation—that the unemployment rate will be close to their notions of mandate-consistent or longer-run normal levels."
102,CHAIR YELLEN,"What you see, I think, if you look this time—if you gaze at the picture from December or September, which is the first year that we showed those dot plots for the end of 2016, is the massive points that are notably below what the participants believe is the normal longer-run level for nominal short-term rates, and the Committee today, for the first time, endorsed that as a Committee view."
103,CHAIR YELLEN,So I think that’s significant.
104,CHAIR YELLEN,"I think that’s what we should be paying attention to, and I would simply warn you that these dots are going to move up and down over time a little bit this way or that."
105,CHAIR YELLEN,"The dots moved down a little bit in December relative to September, and they moved up ever so slightly."
106,CHAIR YELLEN,I really don’t think it’s appropriate to read very much into it.
107,CHAIR YELLEN,"More generally, you know, the end of 2016 is a long way out."
108,CHAIR YELLEN,"Monetary policy will be geared to evolving conditions in the economy, and the public does need to understand that as those views evolve, the Committee’s views on policy will likely evolve with them."
109,CHAIR YELLEN,And that’s a kind of uncertainty that the Committee wouldn’t want to eliminate completely from its guidance because we want the policy we put in place to be appropriate to the economic conditions that will prevail years down the road.
110,STEVE LIESMAN,Thank you.
111,STEVE LIESMAN,"Steve Liesman, CNBC."
112,STEVE LIESMAN,"I wish to look not to the dots, but to the statement, as you suggest, Madam Chair, and that one particular paragraph, which says that the Committee anticipates a lower-than-normal rate even once you return to the long run."
113,STEVE LIESMAN,"So, just so I understand correctly, it means that once you hit the longer-run unemployment rate of 5—which is the central tendency average of being 5.4 percent—once you get a 2 percent inflation rate, the market should not, then, anticipate the longer-run 4 percent fed funds rate, and that would be question one."
114,STEVE LIESMAN,"Question two is, doesn’t that implicitly suggest a shallower glide path once you take off, or once fed funds rates would begin—when you first hike them?"
115,STEVE LIESMAN,Wouldn’t that suggest a shallower glide path to the funds rate?
116,CHAIR YELLEN,"Yes, I think it does suggest a shallower glide path, and what the Committee is expressing here, I would say, is its forecast of what will be appropriate some years from now based on its—the understanding that we’ve developed about what are the economic forces that have been driving economic activity."
117,CHAIR YELLEN,We’ve had a series of years now in which growth has proven disappointing.
118,CHAIR YELLEN,"Now, members of the Committee have different views about why this is likely to be true, that the funds rate—when the labor market is normalized and inflation is back to our objective—they maybe have slightly different views on exactly why it’s likely to be the case that interest rates will be a little lower than they would in the longer run."
119,CHAIR YELLEN,"But for many, it’s a matter of headwinds from the crisis that have taken a very long time to dissipate and are likely to continue being operative."
120,CHAIR YELLEN,"So, some examples I would say is, we have under—many households are undergoing balance sheet repair."
121,CHAIR YELLEN,"There are many underwater mortgage holders, difficulties therefore in gaining access to credit—for example, through home equity lines of credit."
122,CHAIR YELLEN,"For some, that makes it difficult to finance small businesses."
123,CHAIR YELLEN,Mortgage credit is very difficult for those still to get without pristine credit scores.
124,CHAIR YELLEN,"That’s improved somewhat over time, but it’s not back to normal."
125,CHAIR YELLEN,"For some, fiscal policy is somewhat tighter than would be expected over the next several years."
126,CHAIR YELLEN,"For some, it’s headwinds from the global economy play a role as well."
127,CHAIR YELLEN,"But the general assessment is that even after we’ve had an accommodative monetary policy for long enough to get the economy back on track in the sense of meeting our objectives, the stance of policy that will be appropriate to accomplish that will be easier or involve somewhat lower than would be normal short-term interest rates."
128,CHAIR YELLEN,"Now, eventually, years later, most people think they will go back up."
129,CHAIR YELLEN,"But, as you said, that suggests the path will be gradual."
130,CHAIR YELLEN,"But I do want to emphasize, this is a forecast, and this is the Committee’s forecast based on its understanding of the economy at this time."
131,CHAIR YELLEN,"And as we watch the economy over the next several years, that could evolve."
132,YLAN MUI,"Hi, Ylan from the Washington Post."
133,YLAN MUI,"You mentioned in your testimony on Capitol Hill recently that the Fed was trying to assess the balance of weather effects versus more fundamental weakness in the economy as the reason for the slowdown in growth in the first quarter, and you guys mentioned in the statement weather specifically."
134,YLAN MUI,"Does that mean that the Fed’s analysis has come down on the side of weather, or are you still concerned that there could be something else going on that could be contributing to slower growth?"
135,YLAN MUI,And you guys also lowered your forecast for GDP growth this year.
136,CHAIR YELLEN,"So, I’d say, certainly the analysis that we’ve done—and we did spend a lot of time discussing weather and how it’s affected businesses and households in various parts of the country—certainly weather has played an important role in weakening economic activity in Q1."
137,CHAIR YELLEN,"It’s not the only factor that is at work, and most projections for growth in the first quarter are reasonably weak."
138,CHAIR YELLEN,It’s an important factor.
139,CHAIR YELLEN,It’s not the only factor.
140,CHAIR YELLEN,"But I would say it’s likely in the view of most of the Committee to begin to wash out in the second quarter, and we can even see some rebound."
141,CHAIR YELLEN,"Now, I would say, I know what we’ve said about weather is a little bit complicated and confusing."
142,CHAIR YELLEN,"So, you know, let me just say between December and January, the Committee saw data that led it to be quite a bit more optimistic about the economic outlook."
143,CHAIR YELLEN,"So I would say incoming data since January, when our statement sounded quite an optimistic tone, partly down due to weather and partly down because we probably overdid the optimism in January."
144,CHAIR YELLEN,"So, in some sense, our views have moved around here a little bit, but if we take December to March, the Committee’s views are largely unchanged."
145,JIM PUZZANGHERA,"Hi, Madam Chairwoman."
146,JIM PUZZANGHERA,I’m Jim Puzzanghera with the L.A. Times.
147,JIM PUZZANGHERA,You’ve been on—you’ve served on the Fed previously.
