,speaker,sentence
129,GREG IP,"Mr. Chairman, the Fed’s statutory goals are price stability and maximum employment, but traditionally the Fed has interpreted that somewhat flexibly in the sense that if there was a conflict between the two, they would push for price stability rather than for full employment on the view that over time, stable prices was the best contribution monetary policy could make to maximum employment."
130,GREG IP,"But today you went to some pains to say that, actually, you treat these goals—put them on an equal footing, and that there might be circumstances in which you put one above the other."
131,GREG IP,"So following up a little bit on Binyamin’s question, do I take it that if inflation were to move somewhat above your 2 percent preferred level, that you would tolerate that in order to make further progress on unemployment?"
132,CHAIRMAN BERNANKE,"Well, the period of time, yes, we treat them symmetrically."
133,CHAIRMAN BERNANKE,"We cannot control, of course, where inflation and unemployment are at each moment in time, and so there will be periods when, for reasons outside of our control, inflation and unemployment will move away from their desired levels."
134,CHAIRMAN BERNANKE,"If—In those situations, the speed at which—I think “tolerate” might be too strong of a word, because we always want to get everything, both sides of the mandate, back to their desired levels—but the speed at which we would enforce that return would depend on what’s happening with the other variable."
135,CHAIRMAN BERNANKE,"So, for example, if inflation did go above target by a modest amount, we would certainly try to get it back down to target, but if unemployment were very high, that would lead us to be more cautious and slower in returning to target."
136,CHAIRMAN BERNANKE,"So that’s why “medium term”—which is, these targets are all medium term—is a flexible concept, and it depends on the initial conditions, how far away the two key variables are from their objectives at the beginning of the process."
137,GREG ROBB,"Greg Robb, MarketWatch."
138,GREG ROBB,"Mr. Chairman, thank you."
139,GREG ROBB,"You haven’t had a very good time in all the Republican presidential debates, and I was wondering if I could have your comment on what you’ve heard."
140,GREG ROBB,"And some of the analysts I talked to said that one of the reasons for this hostility, perhaps, is that a lot of the Republican primary voters are on fixed incomes and have an inability to invest and make money with their funds."
141,GREG ROBB,So could you talk to them as well?
142,GREG ROBB,"And one more thing, if Republicans take back the White House in November and ask you to resign, would you?"
143,CHAIRMAN BERNANKE,So I’m not going to get involved in political rhetoric.
144,CHAIRMAN BERNANKE,I’m just going to stay completely away from that.
145,CHAIRMAN BERNANKE,"I have a job to do, and as long as I’m here, I will do everything I can to help the Federal Reserve achieve its dual mandate of price stability and maximum employment."
146,CHAIRMAN BERNANKE,That’s my answer to the last part as well.
147,CHAIRMAN BERNANKE,I’m not going to be thinking about hypothetical situations in the future.
148,CHAIRMAN BERNANKE,"In the case of savers, you know, we think about all these issues, and we certainly recognize that the low interest rates that we’re using to try to stimulate investment and expansion of the economy also impose a cost on savers who have a lower return."
149,CHAIRMAN BERNANKE,"And we do hear about that, obviously, and we do think about that."
150,CHAIRMAN BERNANKE,I guess the response I would make is that the savers in our economy are dependent on a healthy economy in order to get adequate returns.
151,CHAIRMAN BERNANKE,"In particular, people own stocks and corporate bonds and other securities as well as, say, Treasury securities, and if our economy is in really bad shape, then they are not going to get good returns on those investments."
152,CHAIRMAN BERNANKE,"So I think what we need to do, as is often the case when the economy goes into a very weak situation, then low interest rates are needed to help restore the economy to something closer to full employment and to increase growth and that, in turn, will lead ultimately to higher returns across all assets for savers and investors."
153,CHAIRMAN BERNANKE,So that’s—I think that’s how we would explain it.
154,CHAIRMAN BERNANKE,"But again, you know, we recognize that during periods like this, savers are getting a lower return."
155,CHAIRMAN BERNANKE,"One reason why it’s extremely important for us to maintain price stability, of course, is that at least that minimizes any losses due to inflation that savers might suffer."
156,DONNA BORAK,"Hi, Chairman."
157,DONNA BORAK,Donna Borak of American Banker.
158,DONNA BORAK,"Shifting a little bit, I’d like to take a look back to the rules that the Fed released back in late December."
159,DONNA BORAK,"Obviously, it was a mammoth task for Fed staff to put forth, and considered the heart of Dodd–Frank."
160,DONNA BORAK,"There were certain provisions that were left out, including the liquidity requirements, due largely to the fact that there’s global consensus needed on those rules in the Basel III process."
161,DONNA BORAK,"But I was hoping you could expand a little bit more on the decision for Fed staff to forgo specifying what the additional capital requirements would be for those banks that were not necessarily deemed GSIBs, at least now, but were still above the $50 billion threshold, and to talk a little bit about what the core issues are in deciding whether or not that additional capital should come in the form of a surcharge, what that surcharge might look like, and when we might know."
162,CHAIRMAN BERNANKE,"Well, you’re referring, I think, to the 165–166 rules, which will focus on the supervisory oversight of the largest banks."
163,CHAIRMAN BERNANKE,"It’s a very big and complicated rule, as everyone knows, and so our position at this time is that we would still like to get feedback from the industry and from the public about what the best approach is."
164,CHAIRMAN BERNANKE,"So we put out a lot of questions, and we’ll be considering those during the comment period and after, as we put together a rule."
165,CHAIRMAN BERNANKE,"The notion of the surcharges is that banks which do not pose significant threats to the systemic stability of Unites States, you know, should not have a significant surcharge."
166,CHAIRMAN BERNANKE,"We’re required to consider these issues by Dodd–Frank, but our view is that it’s the largest banks, the ones whose failure would endanger our financial system, that should be subject to these surcharges because, first—because we need to have them be safer than smaller banks, and secondly, because we want to try to equalize the cost of credit that they face."
167,CHAIRMAN BERNANKE,"In other words, a bank which is thought to be too big to fail gets an artificial subsidy in the interest rate that it can borrow at, and by having additional capital requirements, that tends to equalize the cost of funding to different banks and reduces the incentive of banks to get large just to create the impression of being too big to fail."
168,CHAIRMAN BERNANKE,So we think those are important and we will continue to work with them.
169,CHAIRMAN BERNANKE,"The Basel Committee has provided some sense of the range of what those surcharges will fall into, and so we’re still working on defining exactly the criteria, but you can assume that it will be a fairly continuous range between the $50 billion banks and the very largest banks in our economy."
170,CHAIRMAN BERNANKE,"As I said, we’re getting reactions and comments."
171,CHAIRMAN BERNANKE,"We hope to get—you know, early this year—we hope to come back with a clarification on the rule, and of course, we’re also working hard on implementing Basel III itself, which we want to do during 2012—we want to put out the rule during 2012."
172,MARK FELSENTHAL,Mark Felsenthal with Reuters.
173,MARK FELSENTHAL,"Mr. Chairman, for more than three years now, the Fed has conducted policy through extraordinary means, and yet the new information that we have today pertains mostly to an eventual tightening of policy through raising interest rates."
174,MARK FELSENTHAL,"Why is there no new information about the size of the Fed’s balance sheet, and what should anybody looking at your communications today deduce about an eventual expansion of the balance sheet through more asset purchases?"
175,CHAIRMAN BERNANKE,"So we will be providing, in our minutes and in our Survey of Economic Projections, which will be released in three weeks—we’ll be providing some additional qualitative information about peoples’—participants’ views of the balance sheet going forward."
176,CHAIRMAN BERNANKE,"The reason that I can’t provide all that information now is basically that we received, you know, a whole range of qualitative comments, and we had further discussion during the meeting yesterday and today, and so, you know, we’re going to need a little time to summarize that and to have it approved by, you know—the minutes, of course, and the SEP are approved by the entire Committee—and so, in that respect, it will be a definitive statement about what we currently know about the balance sheet."
177,CHAIRMAN BERNANKE,I can say a few things.
178,CHAIRMAN BERNANKE,"You know, one is that it certainly remains—expanding the balance sheet certainly remains an option, one that we would consider very seriously if—in particular, if progress toward full employment was continued, or it became more, inadequate, or if inflation remained exceptionally low."
179,CHAIRMAN BERNANKE,So we’ll continue to look at that.
180,CHAIRMAN BERNANKE,"As we say in our statement, we’re prepared to take additional measures in general, and that would be certainly one class of measures we would want to consider."
181,CHAIRMAN BERNANKE,"I can make one additional point, which maybe wasn’t obvious, which is that, in June, we provided some principles relating the sales of assets—ultimate sales of assets—to the path of interest rates, and those remain—those principles remain in force."
182,CHAIRMAN BERNANKE,"And so one implication of our extension of our expected point of takeoff to late 2014 is to imply that the initial sales from our balance sheet, which again are far down the road but—that begins—that will be later than previously thought."
183,CHAIRMAN BERNANKE,That will be presumably in 2015.
184,CHAIRMAN BERNANKE,So we do expect to hold our balance sheet at a high level for a longer period.
185,CHAIRMAN BERNANKE,"Additional sales again—I’m sorry—Additional purchases remains a topic that we are still debating, and it will depend both on our assessment of the efficacy and the risks of that particular tool, but also of how the economy is evolving."
186,ROBIN HARDING,Robin Harding from the Financial Times.
187,ROBIN HARDING,"Mr. Chairman, when I look at these forecasts for 2014, the median of the forecast is, I think, 0.75 and the mean is 1.12 percent."
188,ROBIN HARDING,"If I were to draw a line through this—these dots, how should I draw it so I best understand what the FOMC is most likely to do?"
189,ROBIN HARDING,"And the second part—in the minutes, you say that the Committee will consider further options for improvements to the SEP, the economic projections."
190,ROBIN HARDING,Could you tell us a bit more about what further you might do?
191,ROBIN HARDING,Thank you.
192,CHAIRMAN BERNANKE,"Well, again, first I want to emphasize that there is no mechanical relationship between these projections and the outcomes of the FOMC decisions."
193,CHAIRMAN BERNANKE,"Of course, they’re a big input into those decisions, but it’s a collective decision."
194,CHAIRMAN BERNANKE,"If you want to draw lines, I guess I would—I guess my suggestion would be to look at the median, the middle of the distribution, because we do have a democratic process in the Committee, and so the median would give you some sense of where the weight balances against higher—in favor of higher or lower rates."
195,CHAIRMAN BERNANKE,"Again, we did note that in support of our assessment of late 2014, which is a Committee decision, and of course there was a 9-to-1 vote in favor of that, but that is supported by the observation that 11 of the 17 participants expect the funds rate at the end of 2014 to be 1 percent or less, and so presumably the takeoff would not be much earlier than that."
196,CHAIRMAN BERNANKE,"In terms of future additions, there are a lot of ways we could go."
197,CHAIRMAN BERNANKE,"We could provide, for example, more relationships between—more information about the relationship between individuals’ policy preferences and their forecasts, and so on."
198,CHAIRMAN BERNANKE,But there’s nothing specific now that has been decided.
199,CHAIRMAN BERNANKE,"We have a very capable subcommittee, which is charged with continual assessment and analysis of possible ways of improving our transparency."
200,CHAIRMAN BERNANKE,"So we will be looking at additional possibilities, and we would welcome feedback for that matter."
201,CHAIRMAN BERNANKE,But there’s nothing specific planned at this point.
202,DEREK KRAVITZ,"Derek Kravitz, Associated Press."
203,DEREK KRAVITZ,Last night the President unveiled a plan to revamp and expand the government’s refinancing program.
204,DEREK KRAVITZ,"Essentially, the Fed released a white paper earlier this month that said that up to 2½ million homeowners could benefit from this, essentially save $3,000 per year in mortgage payments."
205,DEREK KRAVITZ,"Right now there’s a mortgage settlement being brokered between state attorneys general and the nation’s major mortgage lenders, something to the tune of $25 billion, much of which would be in the form of principal reduction."
206,DEREK KRAVITZ,"In the white paper that was released earlier this month, the Fed seemed to indicate that principal reduction could be helpful, but it was unclear about whether they thought that this was an acceptable or even feasible option."
207,DEREK KRAVITZ,"They also made clear that a lot of the proposals that are currently out there “eat around the edges,” so to speak, when you’re dealing with a foreclosure crisis, and a lot of economists agree."
208,DEREK KRAVITZ,Do you think a principal reduction in the form of the major mortgage settlement would do a lot to help the housing crisis?
209,DEREK KRAVITZ,"And if not, is there any other alternative proposal that would help?"
210,CHAIRMAN BERNANKE,"Well, the Federal Reserve obviously has a very strong interest in the housing sector."
211,CHAIRMAN BERNANKE,"The weakness of the housing sector is an important reason why the economy is not recovering more robustly, and the problems in housing finance are part of the reason why monetary policy has not been more powerful—because part of our transmission mechanism is through lower interest rates, which affects refinancing; it affects sales and purchases as well."
212,CHAIRMAN BERNANKE,"So, in addition to that, as bank supervisors, we have considerable interest in servicing, in loan modifications, in delinquencies, and all the aspects of mortgage lending."
213,CHAIRMAN BERNANKE,"So we have a considerable interest in this area, and as you say, we did a white paper, which looked at a number of issues, including refinancing and mortgage finance."
214,CHAIRMAN BERNANKE,I think it’s important to say that our intent in that white paper was to provide the benefit of our analysis to the public and to those who will be making policy.
215,CHAIRMAN BERNANKE,We did not take specific stands on individual issues.
216,CHAIRMAN BERNANKE,What we tried to do was provide the pros and the cons and provide some context for these debates.
217,CHAIRMAN BERNANKE,"So we did discuss refinancing, we did discuss principal forgiveness."
218,CHAIRMAN BERNANKE,"I would say that there’s a variety of views about principal forgiveness within the Federal Reserve System, and there is no official position."
219,CHAIRMAN BERNANKE,"There—It seems very likely that principal forgiveness could be helpful, depending on how it’s structured, in reducing delinquencies."
220,CHAIRMAN BERNANKE,"There are also some potential drawbacks; one of them is the fact that the amount of negative equity in the United States is about $700 billion, which is enormous, and so there is no conceivable program that is going to put everybody in the country above water."
221,CHAIRMAN BERNANKE,"And so I think the issue then becomes, if we have $20 or $25 billion or whatever the number may end up being in this settlement, you know, what is the most cost-effective way to help as many people as possible?"
222,CHAIRMAN BERNANKE,And I think that’s an ongoing debate.
223,CHAIRMAN BERNANKE,"But with respect to principal reduction, you know, I’ve spoken about this in the past, and it certainly has some advantages; a lot depends on how it’s structured, and a lot depends on what the alternatives are that you’re considering."
224,PETER BARNES,"Thank you, Mr. Chairman."
225,PETER BARNES,Peter Barnes of FOX Business.
226,PETER BARNES,"One of the goals of the Fed and the release of all these new materials, the forecast, and the policy announcement are to help to create expectations and set expectations."
227,PETER BARNES,But are you concerned at all that this—that the materials and the forecasts and the policy announcement path today might help create negative expectations?
228,PETER BARNES,"In other words, the average American’s takeaway of your announcement to keep interest rates low—exceptionally low, through 2014 now, might signal to them that maybe the Fed thinks that the economy is in much worse shape than we all thought, and that, in turn, could affect consumer confidence, consumer spending, and the ability to create a self-sustaining economic recovery at some point."
229,PETER BARNES,Is there a risk of this?
230,CHAIRMAN BERNANKE,"Well, whenever the Fed takes a policy action, there’s always some potential for a signal."
231,CHAIRMAN BERNANKE,"I mean, that’s true not just in these current times, but anytime the Fed lowers or increases interest rates, and that’s something we have to think about."
232,CHAIRMAN BERNANKE,"But I think, generally speaking, that those considerations are outweighed by the need to maintain accommodative financial conditions so that it’s attractive to firms to invest and hire, attractive for those who are eligible to buy homes, and so on, and I think that that ultimately is more powerful than the signal from the change in policy."
233,CHAIRMAN BERNANKE,"In particular, the markets and the news media are very good at picking up the underlying economic data and making assessments of the state of the economy and reporting what different people think about the economy, so I wouldn’t overstate the Fed’s ability to massively change expectations through its statements, for example."
234,CHAIRMAN BERNANKE,"So, again, I think that while we certainly take that into account, we think it’s important for us to say what we think, and we think it’s important for us to provide the right amount of stimulus to try to help our economy recover from its currently underutilized condition."
235,DARREN GERSH,"Darren Gersh, Nightly Business Report."
236,DARREN GERSH,Let me kind of follow up on Peter’s question.
237,DARREN GERSH,"Why shouldn’t somebody looking at these numbers from the outside say “Look, as aggressive as you say you’ve been, and as aggressive as you have been, it doesn’t look like you’re meeting any of your goals for the next three years on the economy, so why isn’t the Fed doing more now?” CHAIRMAN BERNANKE."
238,DARREN GERSH,"Well, again, as I said earlier, the Fed has been doing a great deal."
239,DARREN GERSH,Just since August we have put a date on our expected period of low interest rates.
240,DARREN GERSH,"We undertook the maturity extension program, which is still continuing."
241,DARREN GERSH,Today we announced a further extension of the expected period of low rates.
242,DARREN GERSH,"By issuing this expected policy rate information, we hope to convey to the market the extent to which there is support on the Committee for maintaining rates at a low level for a significant time."
243,DARREN GERSH,"So, you know, I don’t accept the premise that we’ve been passive; we’ve been actually quite active in our policy, and in one respect, the low level of inflation is a validation in the following sense, that there were some who were very concerned that our balance sheet policies and the like would lead to high inflation."
244,DARREN GERSH,"There’s certainly no sign of that yet, and it hasn’t shown up either in financial markets or in outside forecasters’ expectations."
245,DARREN GERSH,"Now that being said, as I mentioned earlier, if the situation continues, with inflation below target and unemployment declining at a rate which is very, very slow, then more—our framework, the logic of our framework, says we should be looking for ways to do more."
246,DARREN GERSH,"It’s not completely straightforward because, of course, we’re now dealing with a variety of nonstandard policy tools—we can’t just lower the federal funds rate 25 basis points like in the good old days—but your basic point is right, that, you know, we need to adopt policies that will both achieve our inflation objectives and help the economy recover as quickly as is feasible."
247,DARREN GERSH,"And, I would say that your question—actually, an earlier question—shows a benefit of explaining this framework because the framework makes very clear that we need to be thinking about ways in which we can provide further stimulus if we don’t get some improvement in the pace of recovery and a normalization of inflation."
248,PATRICK WELTER,"Mr. Chairman, Patrick Welter from the Frankfurter Allgemeine Zeitung."
249,PATRICK WELTER,I have two short questions.
250,PATRICK WELTER,"Your predecessor, Mr. Greenspan, once said about his personal inflation—long-term inflation goal that it would be 0 percent if appropriately measured."
251,PATRICK WELTER,And I would like you to compare the inflation goal you told us about today with that statement.
252,PATRICK WELTER,"And, the second question is, Comparing what you did today, are you approaching more some kind of inflation targeters like the central bank of Sweden or Norway, or are you approaching more the European Central Bank, for example, which has some kind of inflation goal but is not really an inflation targeter?"
253,CHAIRMAN BERNANKE,Excellent questions.
254,CHAIRMAN BERNANKE,"So, a literal reading of price stability would say inflation should be at zero."
255,CHAIRMAN BERNANKE,"Now, there are some technical reasons why that may not be true."
256,CHAIRMAN BERNANKE,There are probably some measurement biases and other issues that mean that a measured value of inflation above zero is probably consistent with stable prices.
257,CHAIRMAN BERNANKE,"But as we’ve talked about frequently, we set inflation—our inflation objective in a way that was consistent with both sides of the mandate: price stability—and 2 percent is low enough that we believe that it’s not going to extensively interfere with financial planning and economic planning on the part of households and businesses—but also in the interest of employment."
258,CHAIRMAN BERNANKE,A target for inflation that was zero would have several consequences.
259,CHAIRMAN BERNANKE,"First, we would be spending maybe half of our time, or at least a significant amount of our time, in a deflationary zone."
260,CHAIRMAN BERNANKE,"And we’ve seen in many instances that deflation can be bad for economic performance and bad for employment, and, therefore, setting an inflation target at zero would be not consistent with the other part of our mandate."
261,CHAIRMAN BERNANKE,"Incidentally, related to that, a zero inflation rate would mean that nominal interest rates would be at very low levels, typically 2 to 3 percent or whatever they might be, and that would increase the risk and probability that we would be in a situation like today where we really can’t cut the short-term interest rate any further."
262,CHAIRMAN BERNANKE,So I think there are good reasons from a dual-mandate perspective to have inflation greater than 2 percent.
263,CHAIRMAN BERNANKE,"And I would add that, you know, if you look at central banks around the world, whether they are nominal inflation targeters or not, that use; the ECB, many other central banks either use 2 percent or a range around 2 percent."
264,CHAIRMAN BERNANKE,So this is not at all different from what many other central banks do.
265,CHAIRMAN BERNANKE,"Now, are we inflation targeters?"
266,CHAIRMAN BERNANKE,"If by “inflation targeter” you mean a central bank that puts top priority on inflation and other goals, like employment, as subsidiary goals, then the answer is no."
267,CHAIRMAN BERNANKE,We are a dual-mandate central bank: We put equal weight on price stability and maximum employment; those are the goals given to us by the Congress.
268,CHAIRMAN BERNANKE,"And so, in that respect, as I mentioned earlier, I think, to Greg, we’re not absolutists: If there’s a need to let inflation return a little bit more slowly to target in order to get a better result in employment, then that’s something that we would be willing to do."
269,CHAIRMAN BERNANKE,"Having said all that, I think it’s worth noting that even banks that—central banks that call themselves inflation targeters typically pay at least some attention to other parts of the economy: employment, growth, financial stability, and the like."
